comment_id,post_id,subreddit,body,score,created_utc
mwvv3r1,1l7ctih,depression,"It's not unnecessary if it gets you through one more day. You still have passion, that's important. Other people are blowing their money on drugs and gambling. You're getting something you love that keeps you going. Keep going with it.",26,2025-06-09 19:22:16
mwx1lds,1l7ctih,depression,They're not unnecessary if you need them.,9,2025-06-09 22:51:32
mwvu2b1,1l7ctih,depression,I’ll do exactly the same,7,2025-06-09 19:17:19
mwwyhor,1l7ctih,depression,"it’s not unnecessary. it seems to bring you a small amount of joy to collect these records, isn’t that enough? i’m the same way, i buy things to “keep me going”, it gives me something to look forward to and i collect multiple things because of this. a lot of people would think it’s stupid to spend so much on my collections but at times it was the only thing keeping me going. i think as long as you’re not in a position where you’re going to lose your housing or be unable to pay for your NEEDS, there’s nothing wrong with what you’re doing",6,2025-06-09 22:34:57
mww2k2f,1l7ctih,depression,"Buying things gives a lot of people a dopamine rush. It's temporary, so we keep buying more.

Collecting is a hobby, something you have a passion for. That's a good thing. Anything that can distract you from the negative thoughts is a good thing.",3,2025-06-09 19:57:45
mwx85pc,1l7ctih,depression,"I live with a person like you. In the long run it won't make you happy. Stuff will pile up making you more unhappy. Debt will pile up forcing you to stop the things you do enjoy. The people around you will reset the junk and debit. It's hard but find a way to stop. go outside, exercise, find a passion like art ot writing.",5,2025-06-09 23:26:56
mwxpt2r,1l7ctih,depression,"it's one of the few things that still makes me feel something, though I regret it often. 

kind of like a deadline extension or something. you got a package coming, so you can't die yet, I guess. gives you something to look forward to, you know?

which is strange to say, because you'd think I'd rather look forward to dying.",3,2025-06-10 01:05:52
mwyyo4e,1l7ctih,depression,"This is exactly what I do. The dopamine hit and the anticipation keeps me going for another week. It keeps me living, but I don't really feel alive. I have nothing saved. No future. Just bursts of temporary relief to keep me going.",4,2025-06-10 06:04:53
mx0gim0,1l7ctih,depression,"I order things from Temu, waiting for more slipper socks and a couple of neat tops! 😌",3,2025-06-10 13:22:39
mwx0udq,1l7ctih,depression,"I did the same when I was 16-18 and unmedicated. I'd buy books so that I had something to live for, as well as an escape from my own life. We all have our own ways of keeping ourselves from committing suicide. I'm not suicidal anymore, but still depressed as shit. My distractions now are my cat and my college career.",2,2025-06-09 22:47:34
mwxiqhz,1l7ctih,depression,"I think its the exhaustion of work coupled with that dopamine hit of buying something new. 

I remember when I was working 7 days a week and I was very moody. I kept buying junk I did not need just to feel better. I bought a lot of switch games that I never play.",2,2025-06-10 00:25:54
mwy4uwz,1l7ctih,depression,Things give schizoid me more joy than people or experiences. I just wish I had more square footage in my condo.,2,2025-06-10 02:31:11
mwy8ct6,1l7ctih,depression,Try golf lots of unnecessary thing you could buy and you get outside little that's what I do.,2,2025-06-10 02:51:47
mwyrt5s,1l7ctih,depression,"I do it all the time too. Especially after ive been broke for a while, i always spend a little something on myself almost every paycheck. It keeps my head above water when life feels like the ocean.
Spent $40 on new shoes today which felt nice since i have been wanting a pair for years and havent bought shoes for myself in *years*",2,2025-06-10 05:07:07
mwyxr7h,1l7ctih,depression,and yet i still am (｡♥‿♥｡),2,2025-06-10 05:56:56
nt6sf8f,1pigot1,depression,"I understand. I've tried to have hobbies, but they all fizzle out so quickly because of how bad my brain gets.

I've lost jobs from being too in my head depresson-wise.
Lost all my family and irl friends as well as soon as they saw how depressed i am behind the silly mask. I dont see the point in pushing for connections when i simple am unable to make them",138,2025-12-09 22:12:57
nt6cspn,1pigot1,depression,"Same. I'm trying. My life is full of distractions and hobbies. I try to socialize and find routines, too. 

Every friendship feels wrong, because I'm so worried that they'll hate me that I just have no boundaries and am agreeable and a good little emotional support doll. If they knew the real me, if they heard my real thoughts, if I ever stopped smiling and nodding and absorbing, they would - all of them - not want to be around me. 

Exercise hasn't done anything except make me feel a little moment of awe at how my body moves. That's cool, that's not a cure, and I don't get that nice endorphin boost that people claim to get. A few years ago, I could ground myself with the idea that, even if I was upset, the world was evolving towards a better world. That my despair was all in my head.

Nope. Turns out the world is never going to be better, and never really had a chance. So that's not there anymore.

There's nothing to help me and no escape.",61,2025-12-09 20:56:22
nt7vwgw,1pigot1,depression,"Honestly what helped with my depression was just being home and moving slow through my day. Allowing myself to just exist and watch TV and not worry about anything else. I made my world small and quiet. After a year, I naturally felt energized to come out of this and start being in the world again.",25,2025-12-10 01:56:59
nt72dey,1pigot1,depression,"I hear you, friend.  I have very caring friends and I still isolate myself and stew in my misery.   There are outlets for depression.  It’s just that those outlets don’t necessarily make you feel better. And if they do, it doesn’t last.  I know that seems oxymoronic, but the only times I feel relief is when I get outside myself and focus on others.  

It doesn’t solve anything, but for brief moments I’m able to forget about my negative thoughts.  

Volunteering can be a respite from worrying about your own thoughts.  It’s by no means a solution, but if you have the will and energy, it might help you escape yourself for a bit and find some connection.  

Give yourself some grace, if you can.",17,2025-12-09 23:05:53
nt7sflh,1pigot1,depression,"Exactly! I try to go to the gym but the bad thoughts and feelings they stick with me through my sets, when I go to the park is the same situation, I keep walking but my head won’t shut up the negative thoughts",7,2025-12-10 01:36:23
nt87a0e,1pigot1,depression,"Loneliness is the real cause for me, I live with my mother, she is very old now, later I will be alone",7,2025-12-10 03:04:22
nt8n3k8,1pigot1,depression,"One thing I cling to is, you are not your depression but your depression is a part of you. Think of it like a black cloud, even if it covers you fully and you have just a pinprick of light coming in, it's only enveloping you, not combining with you. It's a parasite that is taking over your mind, but that doesn't make you the parasite. You are not what your parasite suggests you are. Even when you feel weak, you're still here, and it takes strength to live. I just refuse to believe that it's unbeatable.",6,2025-12-10 04:50:13
nt8j0qf,1pigot1,depression,I just take a walk at night not because it's fun but because it feels better than staying in bed,4,2025-12-10 04:20:59
nt8kzqt,1pigot1,depression,Following because I relate. Sleep and vacation are it for me.,4,2025-12-10 04:35:04
nt8r1tn,1pigot1,depression,"Gaming worked for me, I guess.",3,2025-12-10 05:20:04
nt8zz7z,1pigot1,depression,It just feels never ending. I just gave up on thinking one more positive activity or habit would cure my depression. It’s horrible.,3,2025-12-10 06:35:02
nt7bbjk,1pigot1,depression,"Yeah, pretty much, OP.",2,2025-12-09 23:57:02
nt7y8az,1pigot1,depression,"  yeah, different Person but same story here too. I guess some people just dont meant to be happy in this world.

  No matter what ive try the bad thoughts always come back. Its like a spiral that suck me in every time again and again. I dont exercise and have not lot of hobbies besides gaming and music because i am quite lazy. 

 This illness is so crippling took away all the ambitions ive once had. All the future plans. I was once a very contact loving Person which use to go to parties and meeting new persons every week. Now i developed kind of a social anxiety.

I wish all of us good Luck and hope for better times friends.",2,2025-12-10 02:10:43
nt85ion,1pigot1,depression,"It never fully goes away.  We can manage it a good bit but it is still there.  

I'm a man in a large city.  I found a men's support which is a bit like having friends.  Have you looked into that?",2,2025-12-10 02:53:42
nt8ma7m,1pigot1,depression,"Isn't it crazy how in a world full of people, the base of so much depression is loneliness?

For me, it's mindset. I'm between jobs right now and in a new city, so that's hard, but I otherwise have great support. I've been on meds for MDD for a few years now and it's great 90% of the time, but then the thoughts hit sometimes and I just can't shake them. It's the feeling lost, no job, losing my motivation, the ""what would I do if --- happened? What would be my purpose here? How do I find myself?""",2,2025-12-10 04:44:25
nt95hre,1pigot1,depression,Agree with you. At least you’re not alone in this. Everyone with depression feels alone but really we all suffer in collective silence together across time.,2,2025-12-10 07:25:22
nzutxax,1qe4kl1,depression,"i'm younger than you but i feel the same, just watching the days pass but every day is the same, just boring and depressing",117,2026-01-16 03:29:24
nzusqqv,1qe4kl1,depression,"Damn are we the same? I’m the same age too. I have hobbies but just haven’t really done them in years. I hear you though, feeling stuck, empty, flat. You heard of the term anhedonia?",66,2026-01-16 03:22:37
nzuxm19,1qe4kl1,depression,"Same, I'm an empty husk rotting like zombie",62,2026-01-16 03:51:12
nzvdvxv,1qe4kl1,depression,"Sleep doomscroll work sleep doomscroll. No motivation to fucking do anything. Can't even try to enjoy a new show or anime or play video games, all things I used to enjoy. No money for anything other than rent and food.",32,2026-01-16 05:38:56
nzuvek2,1qe4kl1,depression,"I wish my parents were still alive so I could live with them. Your problem is comparing yourself to other people's ability to acquire independent sovereignty over their lives, while you're depressed and living with your parents. That's a problem? In a couple years, when half the world is unemployed, people are going to be crying the blues and you'll still (hopefully) have a place to live. Survival is survival, sure you're not growing as a person, and you're probably emotionally stunted and developmentally challenged, but you have a place to live and that's going to be of extreme importance in a few years, so who cares what other people think?",27,2026-01-16 03:38:03
nzvm14l,1qe4kl1,depression,"Sometimes we have to acknowledge,  and then try one thing to fix. Just pick one. Maybe focus on one hobby and go from there 

Somehow when one thing goes well, you improve your life more in other domains. its a positive feedback loop.",26,2026-01-16 06:42:21
nzvlza5,1qe4kl1,depression,This is honestly really common. I talk to a lot of cohorts our age and they tell me the same thing,21,2026-01-16 06:41:56
nzv1tth,1qe4kl1,depression,"I can relate, but the real bitch about it... is that I know what we have to do. 

We're like a self-fulfilling prophecy. We have no value or worth, because we're worth no value. 

Diet, exercise, discipline, patience, and optimism - would probably bring some sense of accomplishment... in turn, giving us a reason to fight for life. 

Unfortunately, our current society turns a profit on people like us. We're a commodity. 

The older I get (42 now) the more I wish things were simple. I daydream about having enough money to buy some land deep in the forest with my wife and kids. Then live off the land, somewhat ""off grid"". Our ""jobs"" would surround survival, and probably bring a lot of peace and joy. 

Instead, we're all glued to screens... eat junk, and do very little for ourselves. Let alone the ""community"". It feels soooo incredibly wrong, but we're all trapped. It sucks.",21,2026-01-16 04:17:21
nzy1jxj,1qe4kl1,depression,35 and same. I am just waiting for the sweet release of death.,18,2026-01-16 16:27:48
nzvqgo3,1qe4kl1,depression,"The thing is: life has no ultimate purpose. To live your life is enough. Eating, breathing, being with and caring about others,… . That is all. No justification, explanation, ‘higher’ goals, … needed nor possible.",14,2026-01-16 07:19:34
nzvs5oa,1qe4kl1,depression,very very much the same OP. capitalism squeezes the humanity out of every nook and cranny. i feel so helpless. sending you a hug.,7,2026-01-16 07:34:16
nzxrpaq,1qe4kl1,depression,"We’re almost like the same person, only my siblings can’t help me and the one who could wouldn’t help me. And finding a job is hard especially after nearly 9 years of unemployment. 
I told my therapist I give up and only attend our sessions because I feel bad if I don’t show up or cancel. Life is just not for me, no matter how hard I embarrassingly try to be positive or do more. It’s like the universe sees me trying and goes, “That’s cute, I’m not gonna let anything good happen.”",7,2026-01-16 15:44:25
nzxt1c2,1qe4kl1,depression,I'm 30 and I feel the same. I have felt like this for a decade,7,2026-01-16 15:50:16
o0ffnan,1qe4kl1,depression,38 F and I'm the most depressed ive been in 4 years. Does anyone else feel paralyzed by the world and all the chaos? I'm constantly stuck in regret of all the things I should have done in the last 4 years. ,5,2026-01-19 05:31:03
nzw6gvj,1qe4kl1,depression,"I think you gotta at least talk to someone in your family.  If the dynamics arent there or you are not vibing it I would recommend professional altho I have not taken that route myself.  One thing I did notice is that your siblings are providing you a path, but ultimately its up to you to make that decision.


You got nothing left to lose.  Why not go for it?  Make yourself reborn?


Just wanna let everyone know that I was once like this too.  There is hope tho, the light at the end of the tunnel is there just gotta start moving towards it.


Best of luck to everyone.",4,2026-01-16 09:45:34
nzvrymp,1qe4kl1,depression,"I can so relate to this, I’m close in age too. I don’t really advice either bc nothing has worked but I feel you",2,2026-01-16 07:32:33
oa116ll,1rrntq0,depression,"Same, nothing really has a point anymore. How do people find interest in things and get the energy to live their life everyday?",98,2026-03-12 12:30:03
oa0q0j5,1rrntq0,depression,Feel like everything are meaningless ,78,2026-03-12 11:13:33
oa15gnm,1rrntq0,depression,"x2. I hate when someone asks me about my future plans,  I just want a well paid job that allows me to do the few activities that I like, or dying before 30 idk.",51,2026-03-12 12:56:04
oa1t1st,1rrntq0,depression,"I feel you. I do have a job. I do own a home. I do have financial security. I could easily get married. But none of it makes my depression lift. 

I do find that traveling helps lift my depression. There is something really grounding about living out of a suitcase for 2-4 weeks. Observing other cultures and the way people live. Not understanding their language, not having to talk to anyone. Sitting on a train and journaling my thoughts. Solo travel specifically is incredibly therapeutic for me. It reminds me that being alive is still worth it, even if these moments of joy are temporary. 

I know that not everyone can afford to travel, but I prioritize saving for travel above everything else. I never eat at restaurants or drink alcohol. I rarely buy clothes. I save all of my money for experiences, especially travel.",16,2026-03-12 15:00:37
oa1vqfk,1rrntq0,depression,im even irrelevant even on reddit at least ppl respond to u and other ppls posts no even responded to my post u ever feel depressed think ppl r out here not even getting their post responded too,11,2026-03-12 15:13:23
oa11ot2,1rrntq0,depression,"I get you, but I do really enjoy working and antidepressants helped so much. But sometimes I just wanna stay in bed for days…",10,2026-03-12 12:33:11
oa7bhqy,1rrntq0,depression,"i wish we could transfer life forces, because i would totally give this to someone who needs/wants it. This isn’t just a persisting sadness, I’ve been like this for as long as i can remember. i just want everything to stop. i feel like a ghost walking around, already dead ",8,2026-03-13 10:52:39
oa38c27,1rrntq0,depression,"This is the human dilemma.. we are supposed to ignore the fact that we are on this planet for a short time, or maybe long depending on your life span.. we can die at anytime.. and yet we are suppose to navigate this existence as if there’s something so profound and so existential that it’s worth living for it. People talk about love and human relationships, success and nature, Arts and all the other stuff humans have created in order to somehow grapple with this world and life.

So when people realize that most of these things (Not saying this is true.. just my version) are illusions. That at the end of the day we tell ourselves stories in order to live..

We eat, f***, navigate through our good or bad relationships, work shitty jobs, just a clog in a wheel.. grinding until we are sick and tired doing meaningless jobs..

So now we see what’s in front of us. The dread.. the absolute dread of being alive 

This is the human predicament 

",7,2026-03-12 18:58:53
oa1hchm,1rrntq0,depression,"i get it, i have days like this too. there will be sometimes worse days, but some days will be better",5,2026-03-12 14:02:04
oa0upbc,1rrntq0,depression,Same buddy same,3,2026-03-12 11:47:35
oa0x536,1rrntq0,depression,Hey that's meeeee. But I already do that...lol ,3,2026-03-12 12:04:01
oa1ufhb,1rrntq0,depression,The same here. And one online friend i have never met sent me 95usd that I can take antidepressants. I hope I can live a meaningful life. Now I'm struggling to earn 15k usd to pay debt. I feel myself useless and just a burden to others. ,3,2026-03-12 15:07:12
oa2trbg,1rrntq0,depression,"I feel similarly, except I want to just play video games and read all the time.",3,2026-03-12 17:52:17
oa2vxy4,1rrntq0,depression,I don't want to be anywhere for eternity.,2,2026-03-12 18:01:50
oa297yt,1rrntq0,depression,"I am feeling the same way. What's helping me is to ask myself if there's anything I'd rather be doing or somewhere I'd rather be? So I'm going to ask you the same things: If you could do anything, be anyone, or go anywhere in the world, what would you do? Where would you go? Who would you be? You may not find the answer to all of those questions, but you may find the answer to at least one of them. Don't let your negative thoughts discourage you from the answer. Just ask and listen. Be curious.


For example, I asked and discovered that I've always wanted to go to Ireland. It just popped into my head. I also realized and accepted that I have never been happy in the United States no matter how hard I've tried (which is probably why I've been depressed). I didn't argue with these thoughts or tell myself to ignore them. I simply accepted them. I accepted that it IS possible to go to Ireland. It is possible to leave the United States. I don't need to know how right now, I just need to accept that it is possible.


Give it a try and see what happens. You might be pleasantly surprised. But if you ask yourself these questions and don't get much results, think of it like a Magic 8 Ball and ""Ask again later.""",2,2026-03-12 16:18:40
oa2np48,1rrntq0,depression,"i feel this to my core but then i tell myself “i don’t want to be homeless, i don’t want to be broke, i don’t want to be hungry, i don’t want to be overweight, i don’t want to be lonely” so then i get up and take small steps to be a little productive",2,2026-03-12 17:25:11
oa3ms3y,1rrntq0,depression,"Ditto, everything feels pointless and meaningless and I only do some things because of boredom even though it doesn't help and only distracts me a bit from my unbearable boredom.",2,2026-03-12 20:06:57
oa4hs5j,1rrntq0,depression,I definitely feel this I have manic Major depression disorder. Most days gaming and away from people make me happy.,2,2026-03-12 22:38:19
oa52jbe,1rrntq0,depression,"OP, give yourself some grace. Wjat you are feeling is very valid given the current state of affairs. 

I can't imagine what the new generation has to deal with as things feel like we're going backwards. 

I saw a video this morning, and it was actually taken in 2024. Someone from the SSA (I think) was testifying about how social security will be insolvent in 6 years!!!! Now, wtf is that supposed to mean? By the time I reach retirement age in 10 or so years, I won't be able to get the SS I had withheld during all the years of working? Other than that, I really don't have much of a retirement plan.

So, I told myself, ""Ok, well then that's it. There's no point in trying to plan for a future that may not even exist. So, for my sanity, let me just focus on the next few years and enjoy myself as much as I can.""
Mind you, this is all probably heavily influenced by the subreddit, GenX (which I am a part of) where an OP was talking about an ""end date.""

Give yourself a break, OP. And know, you are not alone. ",2,2026-03-13 00:31:56
ng2cc2p,1npvjky,depression,"Don’t beat yourself up. I know that’s totally cliche and hard to do because you’re human. 
I have dental issues so I do understand. It’s the worst thing to be judged by silly little teeth. And it’s insane how painful they can be. 
Could you ask around for payment plans? There’s a company called Cherry that works with dental offices and is 0% APR for a long time. 
Have you thought about going to dental school yourself? Highly likely they’re gonna love having a live practice dummy. I don’t know. 
Give yourself a rest tonight, ok? Let the worry stay in the background and just breathe.",218,2025-09-25 03:09:32
ng2ierc,1npvjky,depression,"Same happened with me, but I fell so far from grace I ended up at rehab with state paid insurance, and they fortunately covered almost 30 crowns in my face over the course of months.

The crowns are kinda shitty and still hurt with cold liquids and other fun pain, but it was so nice to not laugh and reveal rotted living dead teeth anymore 🤦‍♂️

I know your pain 🫂🫂",51,2025-09-25 03:52:10
ng319ix,1npvjky,depression,"I’m struggling with the same thing. Depression has pretty much taken over my life for almost a decade and I’ve greatly struggled to keep up with taking care of myself, teeth included. But at a certain point my self-hatred got so bad that I purposefully started neglecting my dental health to ensure that I’d develop dental issues in the problem to pressure myself into ending my life, and unfortunately that ended up working out pretty well. I have a bunch of holes on my molars and probably a bunch of cavities all over, it’s going to cost so much to fix all of this and when I just want to die I don’t want to bother wasting money on that.",33,2025-09-25 06:28:57
ng4akza,1npvjky,depression,"I am in a similar boat. At this point, theres not a tooth that doesn’t hurt and need to be removed. 

COMPREHENSIVE DENTAL CARE SHOULD BE A BASIC HUMAN RIGHT.",29,2025-09-25 12:54:10
ng319js,1npvjky,depression,"I'm in the same boat. All four of my shitty growing wisdom teeth need to be removed. Without insurance it's 4k to get two of them out, the other two require a specialist. I have two teeth falling apart and rotting away, that'll probably be a good 5-6k there. My gums are shit. I need more of this and more of that and I just... I dont know what the fuck to do. I brush, I floss, I just couldn't afford yearly cleanings and maintenance.",29,2025-09-25 06:28:57
ng322tr,1npvjky,depression,I’m scared this might happen to me because I don’t take care of my teeth,26,2025-09-25 06:36:45
ng2e6sz,1npvjky,depression,"Im in the same position. the repairs will clost money, the plan is to work hard and earn the money and do a repair whenever possible. you can do it, its worth it. you got this bubba",13,2025-09-25 03:22:17
ng33mhz,1npvjky,depression,"I'm not sure where you live, but please look into resources local to you. For instance, where I live in Indiana, there is an organization called Volunteers in Medicine that provides healthcare needs for free. If you're in the US, I would contact your township trustee, local government or even the local hospital for this information. Help is out there and I understand how tough this must be for you. I'm sending you a virtual hug and hope you get the help you need and deserve. There is no shame in that and we can only move forward. Please don't beat yourself up for just trying to survive.",11,2025-09-25 06:51:27
ng29u7t,1npvjky,depression,"I have faith you can make a comeback someday and wear new teeth and feel normal. Please don’t give up, your worth is intrinsic. You can do it 😇🫂♥️🪽",8,2025-09-25 02:52:51
