comment_id,post_id,subreddit,body,score,created_utc
nbpu6sp,1n53yu3,depression,"Hey, I can relate to your situation. When did this start? Do you think work and being a mother at the same time is too stressful atm? And please be open to your therapist, for you and your child it will be best in the long term.",69,2025-08-31 19:49:05
nbq2czy,1n53yu3,depression,"I'm in the exact same position. Almost 30 and have my own small business, take care of my nephew and sister due to circumstances, volunteer every weekend yet I feel dead all the time. Everyone i meet tells me I'm an amazing person for what I do, yet I can hardly hold a conversation and feel anxious 24/7.... Sorry if I was no help lol",40,2025-08-31 20:31:22
nbq7oo4,1n53yu3,depression,"Just a reminder, depression is a sickness that distorts your view of reality. It’s not you and it’s not real. Keep going and try to see past those lies your brain tells you, it’s possible to get better and find relief! Sending hugs ❤️",37,2025-08-31 20:58:19
nbq6f8u,1n53yu3,depression,"It might not be appropriate but any time I see posts like this I can’t help but laugh a little, not at the person suffering from this, but comparing it to my own situation. People who have a college degree, maybe a good job, married, children, owns a home in a nice area. Pretty much having everything someone could want in life and still being depressed. Then I look at myself, college degree but worthless job, never been in a relationship, will never have a family, will never own a home in fact still living with my parents in my 30s, don’t even have positive memories to look back on. And I wonder, if even people in a situation like OP are depressed, why should someone like me even have hope about things getting better? And if I magically did get a lot of these milestones, who’s to say I’ll stop being miserable? And I think that may be the thing I’m most scared of, that even if I do achieve these things that I never have that’s left me in this position, I still won’t be happy, and I’ll know at that point that my life truly needs to end.

I know it may be insensitive, like thinking that anyone who isn’t a complete loser has no right to be depressed. You absolutely do, as everyone does. But that’s all that comes to my mind when I see posts or people like this: what hope is there for me?",34,2025-08-31 20:51:54
nbq5hrs,1n53yu3,depression,"Sorry you are going through what you are going through.

Felt the way you do for 20 years. Grew up with demanding parents who wanted nothing but perfection.
What got me through was the gym and being in nature.

Now back at law school and looking forward.

Practice gratitude and get into the gym if you can. It will help with your looks insecurities when you see how strong and better you can be and look.

Focus on what is within your control to change. The past is not within your control, nor is the future, only the present. We can only take lessons from the past.

Look at your failures and mistakes as learning opportunities not something that diminishes your worth as a human being.

Therapy and medication are just a Band-Aid meant to keep you coming back. Take action if you can.

Where are you from btw?",24,2025-08-31 20:47:11
nbq0arz,1n53yu3,depression,"As I’m sure you know, there’s something deeper going on. Keep at therapy and be open with your therapist. Put in the effort and you’ll be able to work through this, I don’t know why but I’m confident that you will get better when you get to the root of the issue. Lots of love.",16,2025-08-31 20:20:56
nbqp1va,1n53yu3,depression,Live for your daughter then. My father did unalive himself when I was 10yo and this shit caused 30 years of major depression in me.,10,2025-08-31 22:34:42
nbqtpfd,1n53yu3,depression,"I completely relate (see below for my situation). My advice is to find a therapist (maybe the one you have) who understands passive SI (I don’t want to exist/live but I wouldn’t take action on it) and how it is different than active SI (I want to die and I’m thinking of ways to make that happen). Be open with them about how long you have felt this (I’ve had periods of passive SI for 25 years and haven’t attempted yet) which helps them not to worry about you at this moment. Also, if it gets really bad, consider making a plan and voluntarily checking in somewhere, it gives you more control of what happens to you. This summer I took FMLA leave from work and did intensive outpatient with plans to go inpatient if I felt I needed it. You might consider a residential stay (it could be a boring version of a stay-cation) maybe it would help not to worry every moment about kid/husband/work so you can think straight. 

I’m a 37f and have a law degree and practiced for 5 years before getting work at the law school and setting my sights on becoming a psychologist. I want to help people, but a large part of following that path is the attempt to understand myself. I had my first period of passive SI at 12 years old. I kept on over-achieving (youth orchestras, college D1 athlete, law school full ride) but it all felt empty. I’m persistently depressed at a low level but can fake it and even get happy with the right stimulus. But I never feel a strong reason to live. 

Unfortunately, my major depressive episodes keep getting longer and I have fewer rationales to keep living (one parent died, one parent moving along in Alzheimer’s, special needs dog who was my world passed). I don’t have the answers, but we all need someone to talk openly about it with. Hopefully my tips help you to open up about it.",8,2025-08-31 23:03:27
nbq3e5j,1n53yu3,depression,"Seems like you just went 'the family route', but have you ever really considered what you actually want in life?


I know it's a hard question, but just because you haven't found your interests/hobbies doesn't mean you don't have them. Maybe you just need a bit more time.


Does your husband know about all this? Is there maybe an option to live a more minimalistic way of life, where you can have more time for yourself?",6,2025-08-31 20:36:34
nbvld5e,1n53yu3,depression,Update: just want to say I’m feeling better today and I appreciate all of your comments and sentiments. Mental illness is a roller coaster 😭,5,2025-09-01 18:06:11
nbq9oxv,1n53yu3,depression,"I feel the same, I'm 31. I've a degree and work in that field. My partner and I are emigrating soon. I just can't stop constantly not wanting to exist & feeling so empty. 

You're not alone in this and I'm sorry you are feeling this way. Therapy shouldn't result in you losing your child but it should allow you to venture into why you're feeling this way. ADHD presents in women as anxiety and depression as well. 
Give yourself some recognition, you're so accomplished. Be gentle with yourself",2,2025-08-31 21:08:50
nbqqeou,1n53yu3,depression,I’m so sorry you have to go through this,2,2025-08-31 22:42:51
nbrziyn,1n53yu3,depression,"I can relate. I also look good on paper, but there are some holes. Suicide or self harm is not the answer and if you feel at serious risk, please call and get immediate help. Your life is valuable.

I would continue with the therapist and meds and share just want you are comfortable and if it isn't working change therapists.

I think part of it is the times. Focus and meaningful passion is rare. Society can be judging. People can be their own worse enemy.  Trust me I know.

That being said you have a lot going for you.  You have a built in support structure with your family and you already have a therapist. Rely on them, and while it doesn't seem like much it something that you have.  Also I think it would be safe to reveal generically that your current meds are not working well, but you likely know best. I think it is very unlikely your daughters are at risk of being taken in your current situation.

I am curious of your medical degree or training might be able to give you some insight if you give it some additional thought, but I do think your plan overall is good and you are taking some action which is good.",2,2025-09-01 03:25:18
nbs0ydf,1n53yu3,depression,"I completely understand. I’m in medicine as well and from an outsiders perspective, I have it all.  It’s awful because it’s a lie.  They think im interesting, funny and well put together.  It’s all a facade~ a mask to hide what I really am to the public.  I’m miserable and I think about how peaceful the end will be because every day is suffering.  I take meds that don’t help, I’ve been switched over to new ones over the period of 20 years with barely any effect.  I see a counselor but keep the darkest thoughts out of the conversation so I am not institutionalized.  It a pathetic existence.",2,2025-09-01 03:35:30
nbsb0k1,1n53yu3,depression,"Maybe it’s clinical depression, or maybe what you thought you wanted wasn’t really what you want. Think back to when you were a kid- like 5 to 12. What made you really happy or joyful? Also if you want to share more with your therapist without getting thrown in the hospital or get your child taken away, make sure when they ask “Have you thought about how you’d do it?” Your answer is “No”. Or any variation of when or where would you do it and oh by the way, homicidal thoughts is a No also.",2,2025-09-01 04:51:35
nbu7k28,1n53yu3,depression,"I live for my two kids. My wife and I had infertility problems and there was a point when I feared I would never become a father. Finally we managed to get them and now they're the only thing that give my life meaning or purpose, everything else is a complete disaster (including my marriage). If I didn't have them I would surely have offed myself by now, but whenever I have ideations I remind myself that they love me and need me and I love them more than my own life so I have to stay for them and to enjoy seeing them grow and become better men than me, as they surely will. Let your daughter give you purpose and a will to live.",2,2025-09-01 14:02:05
nbuxo81,1n53yu3,depression,"Try to reconnect with what life gave you. Your daughter is more than a hobby. You gave her her life and you are her dearest person. 

It is very easy to say, I know that. I knew a man who wanted to make the worst mistake. He later admitted that his sons saved his life and gave him a purpose. 

Maybe your job doesn’t mean anything to you. 
Nowadays, it feels so hard to feel connected with people or even with what we do during our day (thanks to the burn outs, toxic managers , colleagues etc). You have a medical degree. It seems to be very challenging but at least, you have a real purpose. You have something I consider to be a REAL job. Not a bullshit one. 

I used to have bad thoughts about me but then I realised that I would never talk to others the way I talk about myself. I never said to someone that they were embarrassing or gross after any socialisation. Why would you think that of you ?",2,2025-09-01 16:12:08
nbxj0fm,1n53yu3,depression,"I looked good on paper too. Burnout is an understatement. Then I had a horrible chemical reaction to a birth control medicine. Once it left my system I still Never bounced back. I was already tired before. Tired of having to work so hard for the basics. Tired of being tired. Tired of being the ""great person"" in everyone's lives. It feels like a compliment at first but then you realize it's an insult because why am I the only one? Then you see all the random suffering that we go through as humans regardless of how good your life is. Some type of tragedy awaits. And the downward spiral of humanity and I just don't want to deal anymore.",2,2025-09-02 00:20:07
nmjp9xh,1olpsvr,depression,"One of the biggest reasons is the age of the average home buyer is almost 40. So the young families that used to fill neighborhoods can’t afford houses due to cost, and competition from people and companies.

This means over the years older people (especially Boomers) sit in their houses for years without their kids or really grandkids. So many people decide to just not hand out candy.

There are other reasons such as all the trunk or treats now, economy (candy was almost $20 a bag), and some fear out of parents (right or wrong).

But not having a lot of young kids in an area will kill a lot of the old style community gatherings and holidays we all used to have.",704,2025-11-01 15:32:05
nmjv53y,1olpsvr,depression,"Two reasons: Firstly, People can't afford it. The candy, the decorations, the costumes... Money is so tight holidays are canceled. Secondly... The magic is gone. The whimsy, the carefree, the *color*... The magic is gone. Sanitized, Sterilized, compressed reality is all there is now. It's dreadful, in ways even goths and emos find depressing.",226,2025-11-01 16:02:33
nmjmw9o,1olpsvr,depression,Halloween fell into a depression too 😕,201,2025-11-01 15:19:16
nmjmcbw,1olpsvr,depression,"My neighborhood was wild.   We had a whole two sets of kids.  A few years ago, we ran out of candy.  People who live nearby, like one street over, reported running out and having record numbers.  I guess it's just pretty random.  I was still pretty upset.  I have so much leftover, I don't know what to do with it all. I've always been that cool house with the good stuff, too. 😞",99,2025-11-01 15:16:20
nmjnir5,1olpsvr,depression,"I feel like this is damn near every holiday these days. I get times change, but holidays were the time when everyone used to seem to come together and we could ignore all our problems for the day.",89,2025-11-01 15:22:37
nmjq4zj,1olpsvr,depression,Everyone is too sad to make babies,82,2025-11-01 15:36:39
nmjk80o,1olpsvr,depression,"Our neighborhood was pretty dead, but the one next-door to us was so full of people that it was hard to get around.",74,2025-11-01 15:04:51
nmjxnvq,1olpsvr,depression,"My wife and kids said it was dead out there too. Very few homes with lights on. 

We were just talking about this subject a few days ago. Our town started ""trunk or treat"" during Covid, at car dealerships. All of the new cars trunks were open with a bowl of candy in there, and someone in a mask and gloves would hand out the loot. 

I guess they had something similar last weekend, except at an old folks home, and regular people with their own personal cars could go there to hand out candy. 

I get the sense that the ""trunk or treat"" is endorsed and/or preferred... but if you choose to still go around to homes, ""trick or treating"" is to take place between 5 and 7 pm.

It SUCKS! 

When I was a kid in the 80's and 90's, we had the run of the town. No set hours, and you could go anywhere/everywhere either by foot, or bike... relatively unsupervised. If we got ""lucky"" a parent or grandparent who owned a big van would drive 5-10 of us around to different neighborhoods. But they didn't walk with us. They were more like a shuttle bus than anything.

Then there were a healthy amount of teenagers smashing pumpkins, throwing eggs, and toilet papering trees after trick or treat.",33,2025-11-01 16:15:42
nmjr3vy,1olpsvr,depression,"Seems like a lot of people near me do Trunk or Treat events. Halloween in the early to mid 90’s (and I would assume the 80’s haha)was really something magical. People out everywhere, planned with your friends which houses to make sure and hit (you always made note of the house that gave full candy bars!).",21,2025-11-01 15:41:40
nmjt94q,1olpsvr,depression,"Halloween is very much still alive bro. Maybe it wasnt around your neighborhood but its like that everywhere. Some neighborhoods are super busy and other neighborhoods arent. My neighborhood is same as yours. Dead, not many kids but a neighborhood close by had a lot of ppl and decorations. Just gotta find the areas that are poppin'!",16,2025-11-01 15:52:46
nmk29jc,1olpsvr,depression,"I miss the Halloween of my 70s childhood. We had horrible cheesy costumes and it was so much fun because the entire town participated. 

Now it’s just depressing.",19,2025-11-01 16:39:39
nmjpn7k,1olpsvr,depression,"On my block, I was the only house passing out candy. I had thirty baggies made up and they were gone in 30 minutes. Next year I'm going to make 50.",7,2025-11-01 15:34:02
nmjzq5g,1olpsvr,depression,Everyone does Trunk or Treat in my area :( takes the fun out of it imo,8,2025-11-01 16:26:33
nmjiwge,1olpsvr,depression,Where I live there were quite a few houses that had the same experience. Some neighborhoods saw over 500 kids while others saw none all night. Sucks but what can you do?,8,2025-11-01 14:57:37
nmjujxx,1olpsvr,depression,Trunk or treat is probably one of the reasons,9,2025-11-01 15:59:28
nmjqujx,1olpsvr,depression,"It depends on the area. Growing up I lived in a neighborhood that was totally devoid of trick or treaters because most of my neighbors were older and didn’t have young kids anymore. We had to drive to other neighborhoods to trick or treat. Now I live in a neighborhood with lots of young families and we had a ton of trick or treaters. It’s not dying, I promise. ❤️ Maybe next year you can volunteer for a trunk or treat event? I’ve never done it myself (as a driver, I did do it once as a kid) but it might be fun!",7,2025-11-01 15:40:18
nmjuz4i,1olpsvr,depression,"Most of my neighborhood is older people. We’re in our 40s and one of the younger families on the street. People with young kids can’t afford houses around here. The wealthy neighborhoods were full of trick or treaters. My son went to one with one of his friends who lives up there. I’m a firefighter and we took our engine to a trunk or treat at the community center. More kids there this year than I have ever seen before. 

Parents were saying it’s easier to do it all in one place like that than it is to burn gas driving around neighborhoods. There were only two lights on along my street last night. The whole neighborhood used to go hard on Halloween but candy was too damn expensive this year. I couldn’t justify it.",7,2025-11-01 16:01:40
mz133gs,1lgz4uz,depression,This has been happening to me for the last 10 years. The downswing also comes with a severe drop in energy. I feel like I can’t do anything and like I would need to sleep for 10+ hours to recover. It gets so tiring never being able to predict how I’m gonna feel in 5min. Kind of robbing me of my life and all the joy in it haha.,137,2025-06-21 18:55:04
mz1aggh,1lgz4uz,depression,"Today I had a similar situation but for me it was more stretched out over time, I woke up normally in the morning, did all my chores around the house, sat down to play, I was in a great mood, and by the evening my mood changed to the fact that I don’t want to live in our world, that our life is bullshit, it’s not that I want to die, but I just don’t like our world and the concept of life. I still can’t find an answer to what to do in such a situation, but so far I only see that I like to immerse myself in stories, games, anime, cartoons, movies, and I seem to live these stories that are obviously better than life. If you think that I’m a hikka who doesn’t leave the house, then that’s not true, I have a girlfriend, friends, family, I go out for walks, I work, pay bills, take care of my family and others, that is, I’m not cut off from life, but I still think that it’s bullshit.",37,2025-06-21 19:35:54
mz2wxk3,1lgz4uz,depression,"Yep, that's (major) depression for you. Life is a constant rollercoaster, it gets really tiring and we get burnt out easily.  That being said, there will be slower moments, moments we can enjoy. I think those are the moments that really keep me going, I almost want to spite my depression and keep living just for that lol. My therapist once told me that I'd have depression and anxiety all my life, but it's about learning to live with them I guess. I hope there's a way, for all of us.",18,2025-06-22 01:19:18
mz1cfxd,1lgz4uz,depression,"Yeah I used to have this a lot. And i would listen to music and stay in my imagination to make myself happy. But now it seems my imagination is killed by self-hatred and impatience... ""Face your problems"". Like fuck off, a coping mechanism is okay, if it helps me it HELPS me. We all live on ""coping mechanisms"" anyway, society just doesn't call it that when it's people partying and exercising and talking to others about video games. But those do help. Are we monks sitting with nothing? God, the fact I feel pressured to be one is just so....mood-killing.",16,2025-06-21 19:47:01
mz054en,1lgz4uz,depression,first of all i hope you will be okay and even tho i don't know why i had that too at first its wasn't very noticeable but it was getting more and more fast and i almost tought i was going crazy i hope someone have the answers to that cause your not alone 😔,16,2025-06-21 15:56:11
mz34ey2,1lgz4uz,depression,I do this too. Sometimes I wonder if I'm borderline.,13,2025-06-22 02:07:00
mz5hd9w,1lgz4uz,depression,"Suicidal thoughts that appear suddenly, even when the person appears to be well, may be caused by fluctuations in the brain's neurotransmitters (such as serotonin, dopamine and norepinephrine), which affect mood and emotional control. These fluctuations can be influenced by factors such as stress, past trauma, poor sleep, hormonal changes or genetic predisposition. Additionally, areas of the brain such as the amygdala and prefrontal cortex can become dysregulated, causing negative thoughts to emerge intensely and impulsively, without warning.",10,2025-06-22 13:45:13
mz5418o,1lgz4uz,depression,"ive been having similar mood swings for the past 2 months now, i could be feeling so happy i could climb mount everest and then five minutes later im back to wanting to kill myself over the smallest things",7,2025-06-22 12:18:20
mz5pzan,1lgz4uz,depression,"This has literally been my life too for the past 3 years. Some moments I feel great, in control, hopeful, and feel I'm working towards my dreams. Then the next moment I'm depressed with a weight in my chest, hopeless, crying uncontrollably, overwhelmed with regrets and my life, and just want to kill myself (and I know how I would do it too).

Usually when it gets really bad I just sit on my couch and play video games until the feeling goes away. Then after a while I feel regret that i haven't actually done anything to better myself. My PCP thinks it's all in my head. I did therapy for a year and it just got repetitive and meaningless. I honestly don't know if one day it'll just get so bad I'll finally do it. In the meantime i chat with Robin (chatgbt) and Grok to vent and get it out",7,2025-06-22 14:33:19
mz3phrs,1lgz4uz,depression,i feel like im bipolar or something ive been going through this exact thing for months,5,2025-06-22 04:35:09
mz3zn2n,1lgz4uz,depression,Maybe you have BPD? Look into other criteria.,5,2025-06-22 06:01:06
mz4dkp1,1lgz4uz,depression,cyclothymia is a subtype of bipolar disorder that involves mood swings even on a daily basis. Much more frequent than classic bipolar disorder. It could be that or BPD,6,2025-06-22 08:14:30
mz29xz1,1lgz4uz,depression,Is it possible you are experiencing manic depression ?,5,2025-06-21 22:58:01
mz3g8mb,1lgz4uz,depression,"I would check my blood sugar. It really does have a big effect on your mood, especially if it’s up and down daily. Hope you get past this",5,2025-06-22 03:25:57
mz3iahs,1lgz4uz,depression,"i've always been like this too, lately i've been on mood stabilizers and they help",3,2025-06-22 03:40:48
mz3t5fp,1lgz4uz,depression,Totally my situation. I always feel mode swings,3,2025-06-22 05:04:41
mz42dgn,1lgz4uz,depression,The first question I would ask myself is what meds am I taking.  Prescribed and recreational and how much for how long.  Some of these drugs will....for lack of a better term wear out your mental state over time (especially if your every day life is challenging/chaotic).  Even heavy Marijuana or Alcohol use over long time periods can have a mental destabilizing effect over time.  Not to mention these prescription drugs that are handed out like popcorn or rave drugs.,3,2025-06-22 06:26:07
mz44dvx,1lgz4uz,depression,The world needs more people like you,3,2025-06-22 06:45:08
mz5jv11,1lgz4uz,depression,I have this happen as well. It's frustrating. I am on a mood stabilizer and depression medication. I have been diagnosed with bipolar disorder type 2 and borderline personality disorder. It sucks when you don't know how you are going to feel mentally/emotionally in an hour.,2,2025-06-22 13:59:43
n2s07rx,1ly8t50,depression,"Real talk, same here, hug from France",134,2025-07-12 19:31:05
n2sov05,1ly8t50,depression,"Yeah, I hate that the rest of my life is doing stuff I either don't want to do or don't care about just in order to be independent.  Growing up I thought that I'd get to enjoy life. Have fun, get a good job, take vacations, be successful, and raise a family. 

I guess I just have to settle for a dead end job, no wife, no kids, no success, and no fun while watching others live a fulfilling life that they're proud of. I'm destined to be the old, fat, bald dude that lives alone and has no friends. I hate that this is the future I'm expected to keep fighting for.",54,2025-07-12 21:44:27
n2s659i,1ly8t50,depression,I’m right there with you. I’m over it all.,35,2025-07-12 20:03:15
n2sxe0i,1ly8t50,depression,"I have been feeling this so much more these past few weeks. I am just so tired of everything. I don't have any desire, motivation, or energy to ""build my future"" life, career, retirement, etc. anymore. I don't want to be here. I want to do everything I've ever wanted to do and go out with a blast. I don't really have any more will or energy to fight for ""what I want,"" only for the goal post to move once I get it. I am tired of chasing a future I want that'll never happen because of things out of my control. I don't want to live too",39,2025-07-12 22:33:36
