comment_id,post_id,subreddit,body,score,created_utc
dnev6v5,720kcr,depression,Ah man are you getting help? This feeling turned into wanting to commit suicide pretty quickly,9,2017-09-23 21:00:49
dnf0si7,720kcr,depression,I'm curious actually. I've been feeling this way very strongly the past few months but I don't have any other symptoms of depression. Am I fine?,9,2017-09-23 23:05:17
dnf9h0v,720kcr,depression,Half the time I WANT to just be allowed to take my life. I'm in a ton of mental pain and living is agony. There SHOULD be allowed suicides for people who have such severe depression that it feels like living is hell on earth.,8,2017-09-24 02:31:12
dnf1qe1,720kcr,depression,"I can't. Simply because I couldn't do it to my kids or my mom. But if they didn't exist and my mom was gone, absolutely. Not to say this is healthy because it's not but yes I do feel that way from time to time",7,2017-09-23 23:26:53
gxm2ijw,n959fs,depression,This is me the past few years.,278,2021-05-10 14:41:50
gxmwkis,n959fs,depression,This is my #1 “it’s getting bad again” warning sign,123,2021-05-10 18:14:33
gxmn56i,n959fs,depression,"Relatable. Every time I wake up and go somewhere, I’ll want to be back in bed only 30 minutes later",62,2021-05-10 17:08:16
gxmlkyp,n959fs,depression,That's why you have suicidal ideation. The only thing you can look forward to besides sleep,47,2021-05-10 16:57:19
gxmomfx,n959fs,depression,"The last thing I say every night before passing out,”please don’t let me wake up”.",38,2021-05-10 17:18:41
gxmhf32,n959fs,depression,this is me everyday.,36,2021-05-10 16:28:10
gxnv7vh,n959fs,depression,"Posts such as this, as troublesome as they may be, at least bring me some comfort in knowing I am not alone in my struggle with depression. Thank you for sharing.",28,2021-05-10 22:25:33
gxmlaqn,n959fs,depression,"I'm there this week, it's a low one.",18,2021-05-10 16:55:19
gxmybjd,n959fs,depression,"I straight up feel this so much, sleep just seems about the only good escape from everyday life especially when your depression makes you not want to do anything anymore or even be awake.",16,2021-05-10 18:26:45
gxnyfvv,n959fs,depression,"Can you try making a very simple check list for tomorrow when you wake up ? 

Brush teeth
Wash face/take shower
Trim nails
Walk around the block
Speak to two new people
Watch a tv show on nature
Drink less coffee, or no sugar/caffeine


Listen to one new song you've never heard before
Soothe yourself by talking nice to yourself as you fall off to sleep, it could help you have nicer dreams. Speak to yourself as if you were a young child. Say it out loud.

Check them off as you go
If you do anything not on the list put it on and check it off.

I'm not much of a writer, but over the last few months I've gotten on the computer or my phone and just written out a statement or letter to myself or anyone else that I needed to have a difficult conversation with. It put my thoughts in order and helped me effectively express myself, even if I didn't end up using the letter in my conversation. Little life changers.

When I'm at ground zero I take little baby steps.

Check them off as you go.

Repeat.

Just some ideas that help me through painful times. I hope some of them bring you relief, you deserve peace.",13,2021-05-10 22:51:40
gxmip7p,n959fs,depression,Yep every day,12,2021-05-10 16:37:07
gxmm9ti,n959fs,depression,Or when you're scared to go to sleep because of the nightmares,11,2021-05-10 17:02:05
gxmveth,n959fs,depression,"holy shit this!!!! groundhog day. worst part is i ""sleep"" like shit so even sleeping sucks",10,2021-05-10 18:06:27
gxmsjz8,n959fs,depression,That's kind of how I've been feeling. Fuck.,7,2021-05-10 17:46:24
gxnbydl,n959fs,depression,"And then when it's time to go back to bed, you can't fall asleep, for one reason or another.",8,2021-05-10 20:02:36
gxn906k,n959fs,depression,Sometimes I wake up and two seconds after I say 'I hate my life' or 'I wish I was dead' out loud. Ridiculous.,6,2021-05-10 19:41:41
gxodm20,n959fs,depression,"Sleep is like a temporary death

- Bob Dylan",6,2021-05-11 00:59:32
gxozueb,n959fs,depression,"Sleep is great. Makes me think of a post I saw the other day. “Sleep is great because you’re it actually dead but you’re not awake so it’s a win-win”

“It’s like being dead without the commitment”

“An open relationship with death”

“Death with benefits”

All of that is true in my case because when I’m asleep I sometimes have dreams of a life I wish I could have had instead of the pathetic existence I’m stuck with. By sleeping constantly I can experience those good feelings. But just like death it means I don’t have to deal with the crushing reality of life. I often wake from dreams in despair because the happiness I felt seemed so real and it takes me a while to come to terms with the fact that my dream wasn’t truly my life.

Sure hope this makes sense because I’m quite the inebriated fellow rn.",4,2021-05-11 04:27:11
g6p0acm,j07hbh,depression,"Same. The weird thing is though, I keep seeing people kind of happy, and that annoys me so much I can't even tell you. I'm 23, and how the f are people my age finding motivation to study, to do their (work from home) job etc. When I can't even find the energy (mental strength) to get out of my bed?",209,2020-09-26 15:58:41
g6pfq15,j07hbh,depression,"I've been taking care of my now 93 YO Dad for the last 6+ years since his stroke.  This shit is getting old, but I can't quit.  He's my Dad.

Lately, I've been experiencing extreme Caregiver Fatigue, as well as some unrelated physical problems.  It's a difficult job.  But it's what I do, right?  I wake up with anxiety.  I get depressed and frustrated easily.  I have lost my sense of humor.  I used to have the gift of making people laugh, but that has escaped me now.

My family hates me.  My friends have abandoned me.  I finally got a puppy, and even that doesn't assuage my depression and anxiety.  (It helps.  She's a wonder mutt.)

Advice to anyone with an elderly parent - unless you're an only child, don't do it.",90,2020-09-26 18:27:28
g6pd9dl,j07hbh,depression,I had a close friend cut me off because of how I treated her right before she ended the friendship. I was suicidal and depressed at the time though. Just a month before she cut me off I attempted suicide and I nearly made a second attempt right after she cut me off but I backed out because I saw people nearby.,43,2020-09-26 18:02:47
g6pjex0,j07hbh,depression,"Yup. My mood has been in the dumps for the past two days after a period of being a little better. I have friends who don’t know too much about my depression and how I isolate and stuff, and so I fear they wonder why I’m not texting back as much. I fear that they’ll think I’m rude or that I don’t care, but I’m just exhausted and I don’t have the energy to let them know why I’m being so unpredictable",27,2020-09-26 18:59:13
g6piwkf,j07hbh,depression,"I hate that feeling. Its awful. Its lonely. I'm sorry you're feeling this right now. I want you to know that its ok that you're not ok. You're not alone in feeling this. You won't be not ok forever, so just try to take care of yourself as best you can for now. 

I've found that letting my loved ones know that I'm in a bad place helps a lot. Its hard to do at first but it gets easier over time, and they will start to notice the subtle changes after a while too. It helps them support me when I'm honest about why I'm a little rougher around the edges than usual. 

I hope you're able to find lighter times soon.",12,2020-09-26 18:55:58
g6pk3aq,j07hbh,depression,"Yeah, it’s bad. I sort of had this, but in fairness I think I should’ve dealt with it better.

I can think of an episode before I hit rock bottom, but I was definitely on the way down. At the time, I didn’t see it or recognise it, and even when I recognised my depression, it still took years to understand what went on. I only understood once I realised I had Aspergers.

But going back to the Episode, and this was about 20 years ago now. A friend at the time really wanted to go to this club, and was on at me to go, so I said I would. I was having a bad time and the energy was just draining out of me. On top of that I’d been working all week in a job that was really hitting my mental health, and I got to the end of that week and I was burnt out. I didn’t have the energy to get out of bed and communicate. I couldn’t even really explain what was going on to myself, let alone think about it enough to be able to explain to ANYONE. I didn’t have the energy to think at all. I was living at home. I hadn’t told my Mam of my original plans, so she wasn’t there to prompt me. I was scared because it was the first time I’d experienced this. I told my Mam I’d been drinking after work and had a hangover. So obviously I left my friend dangling outside this nightclub and he wasn’t best pleased. My Mam took a message from him, he was angry and never wanted to speak to me again.

I felt disgusted in myself. I felt embarrassed about the phone call my Mam had taken, but I had no energy and couldn’t explain what was happening or why to myself let alone my Mam, or my friend or anyone.

As far as I was concerned I was a disgusting person, and a failure and I didn’t deserve to have friends.

We never did speak again, and I still feel shitty about that.

I know how to cope with depression now and that helps with my Aspie Burnouts - I do think the two are linked.

I don’t have a lot of friends, but I do have a couple. If we were going out and I’d cry off, I’d tell them and they’d get a bit pissed off at first, and they’d be ‘ come out for a drink, it’ll do you good!’ or ‘You need to come out of your shell!’ But because I knew what was happening, I felt I was able to fore warn them, because I was managing my burnouts.
As time went on, I was able to explain a bit more. I still don’t think they fully understand, but we’re all in our 30s and 40s now, so they’re more accepting - and when we do go out, it’s a bit quieter. Not out as late and. one or two pubs and or meals rather than big pub crawls or nightclubs, which I find much easier.
(That’s not a hatred of large crowds by the way, I’ve been going to Football matches since I was a kid without any problems and I’m OK with gigs too. But I’ve always felt lost and out of control in places like nightclubs, they have triggered one or two meltdowns.)",10,2020-09-26 19:02:49
g6pslyg,j07hbh,depression,"I feel this. I've been shutting myself out a lot lately. I have zero contact with my friends. They don't call me nor do I. In fact, at this point I don't even have friends I guess. I don't go out my room and sit with my parents because they won't have anything else to talk about other than criticize me. At this point I feel like I can't even share an opinion without getting any criticism. I literally feel lonely and I remember how I was there for everyone but nobody is here for me now. I don't know how long can I live like this, shut in my room, not talking to anyone. I just wanna get out of here literally.",7,2020-09-26 19:51:06
g6q9q7m,j07hbh,depression,"I feel your pain.    
I will say this: if you are on medication, it could be no longer working, or you need something added. If you don’t take medication, you really should consider it.    

I stopped taking a certain depression med a few years ago for blood pressure reasons, but I thought it was no longer working, and wanted to see if I could live without it. I still took an anxiety med, and I thought it would be good enough.     
I didn’t change all at once, but over the years my path felt darker and darker. I should have taken the hint something was wrong when I got fired from a job I was at for 15 years, because I abused Fmla. I 100% take responsibility for that. I just couldn’t get out of bed hardly. And I have other health issues that make me tired on top of that, so I figured it was more due to that illness than anything mentally. I was wrong.    

It’s just that my mind comes up with wack excuses to not do things when it’s off balance. I just imagine the worst things right off the bat.
I continued to struggle to survive, until a little while ago I finally had enough. I felt so despondent. I am lucky to have a few friends and a SO, but what was I to them but a fleeting face once in a while?    

I don’t like depending on others. Especially for depression issues, because I don’t want to bring other people down with my brain’s bs. Because to me, that’s what it is- part of it is growing up in an unstable household, and part of it is genetics.     

I didn’t want to depend on meds either. But it was either that or drown in darkness. And I realized from taking the med hiatus for depression that I can’t not have chemical help. And so be it. I deserve to be a whole individual, not a ghost.

It’s been 3 weeks since I started on depression meds again, and I feel different already. Placebo or no, I don’t care. I left my house for the first time socially in 8 months. It felt great. One small leap, sure, but a world of difference to me.

Now I am thinking about switching careers too. Maybe I need to plug myself into learning something totally new and something that could benefit me in the future. Even if it doesn’t work out, I’m going for it. 

Because now my thought is: it only has a chance if I give it one. 

There’s no way my brain could have believed that before. So I say to whomever is reading this: you CAN get help- something to give you a hand up and start helping YOURSELF. So you can really be present when you’re with other people. 

So you can stop struggling for air and finally begin to walk, so that yes- you can RUN!",4,2020-09-26 21:26:19
g6pdfqu,j07hbh,depression,"Be brave, my friend",3,2020-09-26 18:04:28
g6pp2un,j07hbh,depression,"This happened to me the first time five years ago. I was in a band with some really 'close' friends. We were almost gig ready and my mental health took a sharp nose dive. I asked for a few days to collect myself. During those days the 'leader' of the band called for a band meeting. I thought this was to talk about the possiblility of looking for places to play.   
this wasn't the case, as soon as the 'leader' arrived he said that collectivly they where going to remove me from the band. The reason was that I was using depression as an excuse to slack off during the week and they couldn't rely on me. This was a huge blow to my self esteem. it took years to gain any confidence to play music again. I have only just started to pick my bass guitar up.   


Needless to say, I'm better off with out those people in my life. silver linings and all that.   


Sorry for bad grammer.   


TLDR; got kicked out of band because depression.",3,2020-09-26 19:30:41
g6q2jug,j07hbh,depression,"This quickly made me delete my post on my throwaway account. I was on the receiving end of this. An online close friend wouldn't answer me much these days, even when two three years ago we could go on talking the entire day and never get bored. Life's become complicated now, and we're only both online at one particular time in the entire day and even that doesn't clash most days. We've had more than one or two arguements regarding this very same reason. And even though they've told me the reason behind it, I didn't realize just how much until I saw this post. This really shifted things into perspective.",3,2020-09-26 20:45:23
g6qrowd,j07hbh,depression,my friends have abandoned me long time ago but my family is the opposite thankfully even my father is conserned about me and my mother is always supporting me,3,2020-09-26 23:15:28
g6pqbgm,j07hbh,depression,I've been there. And it sucks. No matter how you try to explain it they can never truly understand 😞,2,2020-09-26 19:38:39
eltukd5,bhlyu2,depression,"Yes massively. I can't hold conversations very well, I also lose track of time/space.  I've only just started my recovery process but i'm hoping one day I can go back to remembering stuff",882,2019-04-26 13:28:51
eltstpn,bhlyu2,depression,"Not exactly a memory decline but I've noticed that I've genuinely become less sharp the longer I've lived with depression. Takes me longer to understand things. I've recently taken an IQ test (not an online test, but with a psychologist) and found out my IQ has dropped quite a fair bit since the last time I got tested 5 years ago.  Not sure if it's directly related to depression or if it's something else though.",515,2019-04-26 13:08:49
eltvtoq,bhlyu2,depression,"Yessss I used to have amazing memory with clear, vivid detail. Now I struggle to remember what I had to eat yesterday.",252,2019-04-26 13:42:58
elu1oa1,bhlyu2,depression,What's there to remember when every day is the same,146,2019-04-26 14:41:09
eltxvpr,bhlyu2,depression,"Five years so far. I’ve noticed I’m becoming dumber. I was “gifted” as a kid and excelled in early school and even a bit in high school. I mean, I never really tried, so I never actually picked up the practical skills I should have. If I go to college I’m fucked. But, at this point, I’m feeling incredibly stupid. Few years ago, I could pick up new things so easily. Now, I’m a year behind in high school. I’m a senior, and barely know algebra, despite math being what I excelled at as a kid. I think my language skills are genuinely becoming worse. My grammar is getting shittier and I forget how to actually spell things a lot more now. I struggle picking up directional awareness IE learning roads and stuff. What’s simple for most, feels so complicated for me. The only things I “enjoy” doing, I’m utter shit at, I don’t improve, and it just makes me feel even more awful when I fail constantly. On top of that, my body already feels like it’s falling apart. I ain’t even gunna talk about social skills. I don’t have a job, yet I dread one. Maybe I’m incredibly fucking lazy, but whatever, that’s a whole different topic. 

I really don’t know what to do. It’s hard to even “comprehend” what I’m thinking/feeling. I can’t actually put it on paper 99% of the time and this pisses me off so much. It’s like one of those fiberglass splinters you can’t find or get out, but it’s in the back of my mind. Some little undertone to everything, that keeps eating away at me. Maybe I’m being dramatic lol. Even if I “get better” I don’t know what direction or purpose I will have. I really just don’t want to exist. This world is trash. I don’t know man. I don’t know anything. 

Bit of a tangent. Maybe I should just put this as it’s own post. No one will read it, or care either way.",145,2019-04-26 14:03:44
eltth94,bhlyu2,depression,"Cognitive doesn't decline, memory does as our mind on overthinking, tends to make space for emotional stuff kicking out the real content.
It makes real difficult to gain back skills cuz of long term impact anyway :(",82,2019-04-26 13:16:46
elu2hrp,bhlyu2,depression,Yes I call it depression dementia,53,2019-04-26 14:49:00
eltuc2u,bhlyu2,depression,"Are you referring to ""brain fog?"" I believe people are intact. It's just an overload of emotions and sometimes numbness that outweighs problem-solving skills.",33,2019-04-26 13:26:25
elu43e6,bhlyu2,depression,"My memory fails me mid conversation - I’ll be saying something and just completely forget what I was saying. I struggle to concentrate reading a book, watching a movie, I don’t like groups of people at social gatherings as I feel abnormal. 

My worst issue was today. Went to Costco with the kid. Walking back to the car I told him I think I forgot to lock it. Not only did I not lock my car, I left the engine running - for close to two hours!!! I have absolutely no idea how I managed to do that",24,2019-04-26 15:05:00
eltz8py,bhlyu2,depression,"Yeah i feel pretty dumb most of the time, feel like im declining the older I get, I was definately smarter at 17, idk why this happens, I've had depression since puberty though... I'm just hoping the cognitive decline is reversible... I read some promising stuff about excercise increasing grey matter so I'm just throwing my efforts at that in the hope it will help.",22,2019-04-26 14:16:55
elwg4v3,bhlyu2,depression,"Howdy,

Wanted to add something positive to this thread.

Having experienced exactly what you're talking about, i can tell you that as you work your way out of depression, your brain will recover slowly as well.

It takes a little bit of time. The brain requires stimulation in order to perform well, which is why it seems that during phases of depression you are thinking, acting slower than usual. 

Personally, I went through 7-8 years of not stimulating myself, due to depression. As i'm recovering, I find myself able to think much more clearly and quickly. I definitely feel a lot smarter.

Hang in there, and try and find something that works for you. Recovery isn't easy, but even a small improvement over weeks can have great effects. And remember, if you have a bad day during recovery, that's OK. Focus on what you can do NOW in order to make things a little better for yourself.

Best of luck.
We all have faith in you :)",22,2019-04-27 09:08:44
elumjjx,bhlyu2,depression,"Yes, it’s also made word recall hell for me. Anyone else?",19,2019-04-26 18:01:43
elu7t7d,bhlyu2,depression,"Yeah. I'm having a very hard time backing up my opinions because I cannot remember some facts about the topic, eventhough I know it to be true. I have to use lots of notes to remind me of important stuff but more often than not, it becomes very messy because of the chaotic nature of the world.
I envy people who can be spontaneous and tell long, coherent stories.",12,2019-04-26 15:41:39
elu68nx,bhlyu2,depression,"I don't know whether it's memory decline or whether my memory isn't functioning.

The only thing I can compare it to is when you're blackout drunk, you don't remember anything because you don't form any memories, even though you can be grand all night, talking away to people.

I sometimes can't remember whole weeks, and it frightens me.

Hope you're okay. ✊️",10,2019-04-26 15:26:21
elu65c7,bhlyu2,depression,Yesssss! I thought I was the only one experiencing this,10,2019-04-26 15:25:27
eluamxr,bhlyu2,depression,"Definitely, It feels like I’m losing my memory and my intelligence from depression which is actually one of the biggest reasons I’m depressed. I got depressed enough to start feeling dumb and then that made me more depressed so now I’m basically braindead. I mix up dates and times and I get caught up spelling words sometimes. I wish I was dead.",8,2019-04-26 16:08:25
elu204h,bhlyu2,depression,"Yes. With the medication im on for anxiety and depression I forget things regularly. In one sense it sucks because im forgetting my life, but on another level (I have really thought about this) I like it because Id rather forget and be numb ,than aware and in pain.",8,2019-04-26 14:44:25
elu2qvd,bhlyu2,depression,"Yep I experience this too! My therapist recommended high octane MCT oil, it’s supposed to help with brain fog. It’s some form of coconut oil that helps restore medium chain triglycerides",7,2019-04-26 14:51:26
elu7wil,bhlyu2,depression,"I've noticed a huge drop in memory, attention, and understanding. I also lose control of my speech and fumble with my words quite frequently, where I used to be pretty well spoken. I've considered depression as a cause, but the more I think about it, the more extreme cases come to mind, like brain tumor, or some atrophying disease. I try not to focus on it for too long.",7,2019-04-26 15:42:35
f20fvk9,dbd5gr,depression,I’m so sorry for your loss ❤️,441,2019-09-30 15:59:46
f20sy44,dbd5gr,depression,"I don’t want to sit here and tell you how sorry I am, I’d rather say that you are right, she wouldn’t want you to be sad over her. Death is something that everyone experiences, for example my Great Aunt was one of the best woman I’ve known and recently I went to South Dakota to see her in the hospital and she was strong all the way through even after having multiple strokes and I remember her cussing at the nurses for sticking her with iv needles, telling everyone that she’s fine and she can go home, then the day after I left South Dakota she passed. I couldn’t move I was so depressed, but my grandmother reminded me of all the good mementoes and we laughed and cried and even got angry but that’s all ok because she would want us to remember her for who she was not how she isn’t anymore.",210,2019-09-30 17:14:32
f20qg6e,dbd5gr,depression,"With what I am going through now, I swear this made literally cry. I am just so sorry!",71,2019-09-30 16:59:28
f20ogyj,dbd5gr,depression,"I can’t possibly communicate how sorry I am for you. Loss is always so very hard, especially with people you’re close to. Wishing the best for you. ❤️",52,2019-09-30 16:48:07
f20owvs,dbd5gr,depression,I’m so sorry! 💔 Was it unexpected? I hope she did tell him how she felt.,41,2019-09-30 16:50:34
f20ycxi,dbd5gr,depression,"My therapist who I'd been seeing for almost 6 years, and the first one to really help me, moved to the other side of the world about a year ago (his wife started a job revolved around stopping sex trafficking, she's an incredible person and I'm glad she does the work she does). I cried and cried for weeks. I still miss him. I can't imagine if he passed away. I'm so sorry for your loss.",36,2019-09-30 17:46:02
f20oh25,dbd5gr,depression,Sorry for your loss!,10,2019-09-30 16:48:07
