comment_id,post_id,subreddit,body,score,created_utc
ncywl9d,1nb3uff,depression,I feel you. I feel weird being alive this long knowing that I was damn sure I’d be dead by 18. I bought a large case of Benadryl and thinking about an overdose. But I chickened out and now I’m using it for its intended purpose. I know a lot about the jumping cases in my city because I was considering that too. But also that convinced me out of it because I saw so many people traumatized from those cases. I’m doing better these days but it feels weird still.,307,2025-09-07 20:36:40
nczlgsq,1nb3uff,depression,"For now it's more of a passive ideation. I'd definitely prefer not to live any longer than I have to, but my cat needs me and my parents would never emotionally recover. So it's more of a ""I know how I'm going to die, it just hasn't happened yet"" type of thing.",257,2025-09-07 22:42:58
nczoncz,1nb3uff,depression,"I eat well and exercise pretty much every day. I keep my house clean enough. I work and pay my bills. But it's *always* in the back of my mind: I'm going out on my terms. I don't know when or how, but I just know. It is comforting. It's a small amount of control no one can take from me.",180,2025-09-07 23:00:11
nczeoc7,1nb3uff,depression,"It's weird I made it to my 30's. Sometimes I don't know if being suicidal anymore is my mental health or a habit. Definitely mental health, and imposter syndrome. Like I can't surely have felt this way my whole life.",126,2025-09-07 22:06:54
nd06rf7,1nb3uff,depression,"I’ve felt passive suicidal ideation since I was at least in my mid teens, though I didn’t realize that’s what it was until I was in grad school to get my degree in counseling and learned about passive ideation. It seems weird that every time something goes wrong, even if it’s not something huge, my first thought is about wanting to die. But having had my brain work that way for half my life makes it seem impossible to rewire. At least it’s passive 98% of the time. 🤷🏻‍♀️",68,2025-09-08 00:44:43
nczs9mw,1nb3uff,depression,"I have these thoughts all day, everyday. Its exhausting.",66,2025-09-07 23:19:59
nczze3n,1nb3uff,depression,"Hope for the best, plan for the worst.",30,2025-09-08 00:01:00
nd0p7dj,1nb3uff,depression,"I joked with my psychiatrist that I only think about suicide on days ending in y. I'm 50 and celebrating 40 years of depression, and I'm honestly surprised I'm still here.",33,2025-09-08 02:35:36
nd134kr,1nb3uff,depression,"I have a can full of pills in my drawer. I keep adding to it whenever I find some, I don’t even know why. It’s not like I’m planning to do it, but that’s the only reason the can exists",20,2025-09-08 04:06:32
nd1s7eo,1nb3uff,depression,"I don’t wanna die, but sometimes wish I’d never been born at all…. Struggle is so real. Racing suicidal thoughts are really hard to describe to someone who doesn’t have them, not that I would want to burden anyone with that truth ever anyways.",15,2025-09-08 07:50:46
nd0mmis,1nb3uff,depression,"This is so sadly funny. I’ve been there myself and boi I can relate so hard with it. 

The real question isn’t why we are not dead yet, the real question is what makes us keep alive? 

This isn’t just suicidal thought, it’s a psychological question on how we want to live. You grabbed those healthy things to protect your body from any harm. Yet your mind is still convinced that in order to get out of pain it is important to escape it. So who’s at pain here? It’s obviously is your mind. 

Suicide is not an option. It doesn’t vanish your pain. Sure you may think that death will remove you from your body so as there won’t be soul there won’t be any pain. But that’s not the case. You will die with that pain and will never get a chance to actually escape it. On the last breath you would still be in the pain. But in that moment your body will scream at you for not making it feel minds pain. 

Sorry if this sounds philosophical. And I’m no expert at it either. But honestly this somthing worth doing: just live. Death isn’t an option to conquer pain. It never is. Be rebellious, and you already are; your body is telling you to take care of itself even when you are suffering. Be rebellious to live against death. Just live! 

Take care!",15,2025-09-08 02:19:49
nd184j7,1nb3uff,depression,"I'm diabetic. My insulin pen goes up to 60. The highest dose I've ever taken (I take it based on the food I eat) is 30. To give an idea of scale, accidentally dosing like 2-3 units too much has almost killed me a couple times. The pen also *carries* 300, so it would be pretty easy to dose 60 twice. The furthest I've gotten is dialing it up and staring at it.

For a long time, I didn't check my life insurance's policy on suicide, as a safety measure. I finally checked it a while back as I feel in a good enough place to know, turns out my policy *does* pay out if I kill myself, so that's good to know I guess.

Anyways, work tomorrow.",15,2025-09-08 04:45:14
ncyxcgb,1nb3uff,depression,"Honestly yeah its weird,but because it became so normal in my life, like a part of me Im used to. When I mention feeling suicidal to other ppl, or make a joke about it they seem so worried, when In my eyes its a normal thing. Been suicidal and sh myself since 12, Im about to be 18 in a couple of months and Its kind of weird sometimes realising that I could end it at any moment lol, so sometimes I enjoy the little things in life and try new things just because, you live everyday, but die only once, and since you dont know when you're gonna die, just enjoy the little things and remember that you are strong just for surviving this long. Being suicidal and still living feels like a quote"" What doesn't kill you makes you stronger"" haha :D. So anyways, stay strong guys, we got this.",9,2025-09-07 20:40:14
nd0us5q,1nb3uff,depression,"I've been passively suicidal for decades now. Fantasizing about death has become my go-to coping mechanism at this point. But as long as my only true anchor to this world is alive, I'll never bring her that pain.",8,2025-09-08 03:10:29
nd0dhkr,1nb3uff,depression,"Yeah... I'm trying to improve some things, which is better than nothing I guess, but the thought of suicide is always on my mind, literally every day. I wish I was dead, but I don't wanna do it.",6,2025-09-08 01:24:38
nczyf48,1nb3uff,depression,I really relate. It's exhausting,4,2025-09-07 23:55:18
nd0vg9a,1nb3uff,depression,I have been suicidal since I was 8 and now this feels like a normal part of life I can't imagine people not having to make the choice every day to keep on living.,2,2025-09-08 03:14:57
nd2mzq2,1nb3uff,depression,"I was in my darkest phase for around 4-5 years. Suicidal ideation was just a part of my personality it was so intertwined into who I was. Not a day went by normally without me thinking “what will we have for dinner?  I guess I should do the dishes. Oh yea, still wish I would have an aneurism about now.”  

It has gotten quite a bit better thanks to a treatment I’m on, but I’ve decided I will never be “normal” again. Too many years rewriting my personality in survival mode has just made changes to who I am as a person, to how I see the world, and my goals in life. Maybe long term 10+ years of stability I might come back in most ways, but I don’t count on it. I still cry a couple times a week for no apparent reason, but at least I’m functioning now, even if it is still a struggle.",3,2025-09-08 12:23:21
mzg4f12,1liz21i,depression,my dad told me during a moment of weakness due to his chronic pain that he would’ve taken his life a long time ago if he didn’t have his two girls. we all need our dads :(,724,2025-06-24 02:54:41
mzg79fu,1liz21i,depression,"Three daughters by 30 is a tremendous amount of pressure; to be quietly suffering in the background while raising children during your formative years is a huge strain and I’m sorry that you are not properly seen.

For the sake of your little girls, please consider either couple’s therapy or therapy for yourself. You deserve you-time after all the hard work you put into being a good father. I am happy you’ve been there for your girls and I know they’d want their dad to be happy too.",651,2025-06-24 03:12:49
mzfzozx,1liz21i,depression,"Have you communicated to your wife that you would like some appreciation or words of affirmation? 

Have you tried therapy? Maybe it’s time to work on you for you. Rediscover who you are for yourself.",342,2025-06-24 02:26:07
mzg3uyt,1liz21i,depression,"Please don’t. Your kids need you. I know things may feel hopeless right now, but please do not take your life. It will destroy your children for life. I am so sorry that you are going thru this. Both my husband and myself go thru periods where we feel this way. We have two young girls. Parenting young children is HARD, it’s not completely abnormal to start feeling like life can be pointless. Is there a way you can seek help? Does your job offer any kind of mental health assistance?",92,2025-06-24 02:51:11
mzg6gq8,1liz21i,depression,"It’s time to see your gp! Get your blood work and hormone levels checked. There are lots of physical reasons that this could be happening. And if it’s psychological, they can help you find an antidepressant and therapist. It will get better!",59,2025-06-24 03:07:40
mzg03tc,1liz21i,depression,"Every man deserves to come home and have a life where they are treated human and not like a pieces of machinery, you truly are strong to be honest about these feelings",47,2025-06-24 02:28:32
mzg2rjw,1liz21i,depression,"as a daughter ive seen my father silently struggle with depression for a lot of his life. The possibility of losing him to it is something i cant even wrap my head around. Im so so grateful he stayed but still so afraid of losing him. I really wish there was more acceptance towards mens mental health. 

Id recommend looking for a therapist. Or even joining a support group. I know it sounds kinda scary. But if you get sick you go to a doctor and theyll help you recover. This applies to both physical AND mental health. I know we dont think of the brain and mind as part of the body but it IS. If your mind is sick it can take the help of a professional to help heal. 

I’ve struggled with depression myself. And i speak from experience when i say it can get better. Please hang in there and keep looking for ways to heal.",35,2025-06-24 02:44:32
mzgmz91,1liz21i,depression,My fiancés dad committed suicide in 1989 and the 3 girls he left behind still miss their dad every day. He has 2 incredible granddaughters who never get to have a Grampy. Please don't let them miss even a day of having you in their lives.,26,2025-06-24 05:06:31
mzg9pmb,1liz21i,depression,You are needed by your girls.,26,2025-06-24 03:28:54
mzgcefj,1liz21i,depression,"You're 30 and able to support a family of 5 on 1 salary? That's quite the accomplishment, genuinely. There are so many people who can't even support themselves at 30. I understand how difficult it can be, not being acknowledged for your efforts. I'm sorry you're having such a hard time.

For what it's worth, this stranger is proud of you. Struggling is evidence of strength, not the lack thereof.",26,2025-06-24 03:47:11
mzghime,1liz21i,depression,"I was in your shoes 20 years ago. And I never wanted to do anything. I was depressed and completely lacked motivation. Two young boys and a great wife rarely overcame my feelings of worthlessness. I felt like I couldn’t move and became withdrawn. Tried anti depressant for ten years with limited success. The game changer/light bulb event happened when I started on Vyvanse. I helped me focus, that allowed my brain to fire up its planning center. I realized I could plan and complete projects. That was rewarding. That led to some motivation to pitch in and be an involved Dad and better husband. Turns out that I had ADD throughout school. I was constantly overwhelmed and my solution was to shut down while feeling extremely guilty. I felt worthless. Maybe some of this applies to your situation. There is light at the end of the tunnel. Maybe explore some meds that improve focus and at the same time can be motivational. Take that first step.",22,2025-06-24 04:23:55
mzg74k8,1liz21i,depression,"My friend please don’t. As a daughter, she will always carry that with her . 
Can you see a counselor? Try meds???
Thank you for reaching out.",17,2025-06-24 03:11:55
mzgg3re,1liz21i,depression,My father committed suicide when I was a child. I'm 36 and I still mourn his loss every second of every day. Please don't. Your girls need you.,16,2025-06-24 04:13:20
mzg3mcu,1liz21i,depression,"i love u man. hope things get better for you. your family loves you and wants you around. 

Have you talked to your wife about how you're feeling?",14,2025-06-24 02:49:42
mzg9oa2,1liz21i,depression,Hey. My dad struggled with depression and he got medicated and turned his life around. I’m grateful everyday. I know it’s not for everyone but it gave me my dad back. Hang in there.,13,2025-06-24 03:28:38
mzg2c9p,1liz21i,depression,Not being able to achieve what you currently have is my reason for not wanting to go on after 30,11,2025-06-24 02:41:57
mzg3d6b,1liz21i,depression,"reading this, one of the first thoughts that struck is how some parts of society have this presumption that dads ""must have it together"", adding pressure to dads who are sensitive to this undercurrent. I think we, really anyone, isn't perfect and some of us need more/ have received less than others in terms of time, resources, emotional care in feeling comfortable and feeling like we've got things sorted out",12,2025-06-24 02:48:10
mzg44xu,1liz21i,depression,"There’s knowing you need to do more, realizing you can’t do more, and being honest about that. Then there’s the final step of realizing that you not doing more means your wife is doing more when she’s probably also struggling, which makes it very hard to see small steps if she’s taking large ones. Unfortunately parenting is not a 50/50 job, it’s a 100/100 job from each partner and when one loses that capability, the other will burnout from giving 150%. It’s what we sign up for as parents but that doesn’t make it any less hard for either one. 

It’s very obvious you love your family deeply, and that you’ve struggled with depression since your teens. I’d really recommend therapy and meds. Meds will help while a therapist can talk to you about your feelings and help you find coping strategies that will enable you to take more small steps towards doing more! It’s really scary to go at first, but so worth it. I wish I did both earlier. Therapy took some time to get used to, but it helped me and my family significantly.",10,2025-06-24 02:52:55
mzgmbky,1liz21i,depression,OP - my mother chose to leave when I was about 8 and my sister was 6. She’s still alive but walking out of our lives was her choice. My father raised my sister and I. He says now that it was all a blur but even though he struggled with alcoholism and a lot of our childhood was hard because he worked so much… I would always choose the life we had with him versus a life without. He is our rock. I love him for all of his good and his bad because somewhere along the way it taught me that people are just real and flawed and imperfect and just trying to survive in the ways they know how… and that’s beautiful. I’m 34 now and was diagnosed with bipolar 2 last year. I also have two young children of my own. Shit in this world is HARD. Everyone is suffering in different ways but that does not discount the suffering. I have had so many moments where I have felt that my family would be better off without my negative presence in their lives but I have to remind myself that I am harder on me than anyone. I am my own worst enemy and my greatest challenge because I will slam the door in my own face time and time again. It’s hard to keep going when you just look around and feel failure. But please know that you are not alone - you GOT THIS. You got YOU. And I’ve learned that as cliche as it may be … self care is crucial. Allow yourself to rest. I hated when my therapist told me that but it’s so true. If you can - therapy has helped me. Just having that one person outside of my family structure I can just be around. Also - this quote changed my life because I always felt that I was constantly giving giving giving to those around me and just draining myself. I love giving - I’ll give my last ounce of self if I can but this quote changed everything - “Fill up your own cup and let them fall in love with the overflow.” Something clicked - you’re allowed to do what you need to for you to fill your cup. Do not wait for others to see it needs filling - find your things and do them. Then if need be you can fill those you loves cups up with everything else. Your cup remains filled because YOU are looking out for you and by doing that … you’re no longer using your own tears to sustain the lives you love but your extra bits of you that you’ve mined. Hope this helps  in some way. Just remember you’re never alone. People out here even in this strange world will listen. 💚,8,2025-06-24 05:01:10
nx5sqyg,1q1i7hd,depression,Sort of - I'm waiting for something really tragic to happen; maybe that'll be enough to push me over the edge,110,2026-01-01 23:21:48
nx69roq,1q1i7hd,depression,"I think it has a lot to do with not wanting to be disappointed all over again. If I never get better, then I don’t have to worry about getting worse all over again in the future. No more being played for a fool.",88,2026-01-02 00:57:27
nx5s1d7,1q1i7hd,depression,Yeah I can relate to that as a secret.,62,2026-01-01 23:17:50
nx668a4,1q1i7hd,depression,"for me it was because i was comfortable in the dark. getting better was scary because it would change absolutely everything. better the devil you know than the angel you don’t, right? i’m glad i was able to get better",38,2026-01-02 00:37:10
nx6gzyx,1q1i7hd,depression,"I wonder how common this is, because I'll tell myself sometimes that if I stop taking the meds that things will get worse and I can egg myself into it. 

Sometimes people tell me that this place is an echo chamber of sad people .. but it helps me understand that there's a common pathology to this and it helps me.",20,2026-01-02 01:41:37
nx65jzy,1q1i7hd,depression,"To be honest, I’m in that same exact boat.

In the last year, losing my cat who was always there for me and my snuggle buddy, while dealing with serious health issues was terrible but all at the same time, my wife abandoned me and began cheating on me. That was the biggest catalyst, because she was my rock, best friend and we had loved each other since we were 13. I don’t want to get better because I don’t want to live to move forward without her, see her with someone new or deal with the cold demeanor she puts me through now. I feel alone in the world now having her in my life for so long and she suddenly disappears from it…the hardest pain I’ve ever endured.",16,2026-01-02 00:33:22
nx6vqj3,1q1i7hd,depression,"I feel like that’s what’s been in the back of my mind of the past 10 years. One of my biggest fears these days isn’t that I’ll kill myself, it’s that I won’t have the courage to actually go through with it and would truly be trapped in this nightmare world. And I’m still pretty terrified of dying. ",14,2026-01-02 03:11:33
nx6xd2m,1q1i7hd,depression,"I understand so much where you are coming from, but… I do believe that’s because somehow this is our comfort zone",13,2026-01-02 03:21:54
nxbjaap,1q1i7hd,depression,"my biggest fear is putting in the work to get better, metaphorically climb the mountain just to find nothing, no one worth my climb. I can't say I've climbed a mountain but a few hills, and I was always met with extreme disappointment or straight up tragedy. I'm tired. I don't want to do it all again for nothing. And no I don't give a shit about ""the journey"", my brain does this nice thing where I can't be happy about accomplishments because all I remember is the pain I went under to achieve them.",12,2026-01-02 20:57:10
nx7ko80,1q1i7hd,depression,Same. Sometimes I wish I had some terminal disease as well,8,2026-01-02 06:01:31
nx5w8tn,1q1i7hd,depression,"Resident Evil is coming Brah, no need to end anything.",7,2026-01-01 23:41:39
nx85fvd,1q1i7hd,depression,"Exactly right, it feels good to be extremely sad.

I push people away, they make me laugh I resist the urge to laugh, right now I am not talking to people arround and just sitting in a corner typing this, trying to get tears flowing so that I can feel sorry for myself.

I can still get my life together, I can succeed beyond measure. But I chose not to work, I chose to rot in a corner like wet garbage.",6,2026-01-02 09:09:11
nx73uhj,1q1i7hd,depression,Do not know about better all.i have ever found is a measure of temporary balance.,5,2026-01-02 04:03:42
nx9931z,1q1i7hd,depression,"Depression lies. Your thoughts and feelings are distorted. The lies are so insidious that you start to take them on as core values.

Not committing suicide can feel unbearable. Guilt, shame, attacking yourself as ""not strong enough"" to end your own life. These are lies that only feel like truths to you in the moment.

Strength is continuing through hell when all life promises nothing but more misery. I hope you can confront these depression lies for what they are.",5,2026-01-02 14:20:25
nx5t025,1q1i7hd,depression,Real i want to get worse,4,2026-01-01 23:23:10
nx6blop,1q1i7hd,depression,"I used to feel like that to a greater degree, just because pain felt comfortable after so much time hurting. Now I pretty much feel the same but accept the wins I have from time to time rather than denying them inside.",3,2026-01-02 01:08:31
nx7rag9,1q1i7hd,depression,I’ve never felt more understood in a post than this one. Copy paste. I fully relate with every cell in my body. 🫂,3,2026-01-02 06:56:46
mmx5fhw,1jyamss,depression,Did they pump your stomach or were u past that. I'm so sorry. Hospitals are scary lonely places after attempts and I'm my experience I never got treated the best:(,335,2025-04-13 16:46:39
mmxkdiw,1jyamss,depression,"I was revived 12 years ago and as disappointed as I was waking up in an ER, I look back and am extremely thankful. Nothing in life is permanent, not your feelings or life situation. I was so depressed, I was a 23yr old single Mom that was poor & struggled from addiction. I felt things would never get better. In the past 12 years, I finished college, got sober (10yrs), have the closest relationship to my son, found an amazing husband & have 3 pets that make me happy and feel unconditionally loved every day. If I ended it 12yrs ago, I wouldn't be able to see how everything played out & how amazing things can get. If you're struggling with addiction, get help, there's also obviously help for mebtal health struggles. Life is beautiful... from the food, nature, traveling, family, pets, other relationships... there's so much good out there. You won't get to experience it if you're dead. Life is short, very short, see how it goes... life will surprise you.",228,2025-04-13 18:02:22
mmxfmdf,1jyamss,depression,"Please stay. As a mom who lost her 15 yr. old son to suicide in 2021, I can tell you that your existence means so much to your family. They love you more than words. You DO deserve happiness. Depression lies to you, telling you things and making you believe things that aren’t true. I’m so thankful you survived your attempt. PLEASE talk to your parents. I wish my son had. Tell them the extent of your feelings. I wish you all the best.",94,2025-04-13 17:38:11
mmww45u,1jyamss,depression,Live for your family . They do care about you. Imagine what they must have been feeling seeing you in that condition.,60,2025-04-13 15:57:42
mmwx5ul,1jyamss,depression,Been there twice . Please stay safe . Praying for you .,21,2025-04-13 16:03:04
mmya3hz,1jyamss,depression,"I’m glad you’re here. I’m sorry that you’re hurting, but I’m glad you’re here.",7,2025-04-13 20:19:07
mn3sy0p,1jyamss,depression,"My most serious suicide attempt was similar to yours. I remember falling asleep thinking, this is it, the last moment of my life, and I was okay with that. I fell asleep smiling. But I too was found and brought in and spent a day in a coma and another with full amnesia, and it took years for me to appreciate not dying that day, but it did come. I did find happiness after that incident. Eventually I even created my own family and now I never could kill myself because my children deserve better than that. Ultimately I have never stopped being extremely relieved at surviving my suicide because if my life had ended then, it would have been the saddest life in the world. A little girl is born and abused so badly her whole life that she killed herself at 15 before ever feeling a moment of happiness. I’m so glad that wasn’t my life. Every day I fight to make my life a story of survival and overcoming my battles and being happy despite everything because I’m not going to allow the evils of the world to win. I deserve to be happy.",6,2025-04-14 18:39:12
mmxfltc,1jyamss,depression,Did they not place you on a 51/50 hold?,6,2025-04-13 17:38:06
mmynpxv,1jyamss,depression,"I have woken up from an OD where I was unconscious and died, my mother was in the chapel for 13 hours. Guilt and shame is healthy however not in this case. You're suffering my friend; and you don't want to die. You just want relief. Same as us all with this affliction.",5,2025-04-13 21:33:37
