comment_id,post_id,subreddit,body,score,created_utc
oa8lzul,1rsojvy,JEENEETards,"some die of thirst, while others drown...",8,2026-03-13 15:21:00
oa8am12,1rsojvy,JEENEETards,Never thought about it in that perspective damn. Must be difficult ,5,2026-03-13 14:25:07
oa8lhb5,1rsojvy,JEENEETards,fr man i love my father so much like if i say i want any book he doesnt even bother about price 😭😭 like he says padhai ke maamle me koi chinta mat krna paiso ki ,6,2026-03-13 15:18:31
oa935gz,1rsojvy,JEENEETards,"Sometime i thought strict parents are also needed
Because sometimes its not about being pressured or possessive its about support, a feeling of someone is with us not freedom with loneliness 

And its a bit selfishness but pressurised student not easily self guilt they blame their parents so they are free not us",5,2026-03-13 16:42:25
oa8be9d,1rsojvy,JEENEETards,"My life.
Literally.",5,2026-03-13 14:29:02
oa8m5jf,1rsojvy,JEENEETards,SO TRUEEEE!!!! ,3,2026-03-13 15:21:45
oa9i2rn,1rsojvy,JEENEETards,Brother its so fukin real....i feel so sad for me and my parents that i am not able to fulfill their expectations ....and still they do so much for me and my studies....i hope one day i will become successful fs. 😔🥰☝️   ,3,2026-03-13 17:52:21
oa8akbp,1rsojvy,JEENEETards,istggg,2,2026-03-13 14:24:53
oa8kk07,1rsojvy,JEENEETards,this is extremely true man ,2,2026-03-13 15:14:02
oa8nter,1rsojvy,JEENEETards,I didn't know some reddit post would make me broken from Inside because its so relatable,2,2026-03-13 15:29:42
oa8nv0p,1rsojvy,JEENEETards,"me:(

",2,2026-03-13 15:29:55
oa8rs4c,1rsojvy,JEENEETards,Ahh this vid f***3d my head. won't be able to sleep tonight,2,2026-03-13 15:48:40
oa8wwwz,1rsojvy,JEENEETards,"I can soo relate to this. Well such parents are a blessing and if you really want to shed this heavy weight, just ask them would u be ohk if I do anything I like just I'll be happy doing that.

They will priorities your happiness! And you! 

I asked mine and they were like just stay happy and that's it. And I don't come from a financially strong background. Like lower middle class. So I know they know I don't have any financial backing so regardless I will have to work hard af to build the life I want. But I would be doing this from my own will. For myself.

This change in mindset has been life changing, ones you take all the blame and responsibilities on yourself for your own self. You improve. Take smarter decisions and somehow that survival instinct kicks in.",2,2026-03-13 16:12:55
o5zt604,1r7sqv5,JEENEETards,"If you feel like this Post violates the subreddit [rules](https://www.reddit.com/r/JEENEETards/about/rules).

Feel free to report it using the 3 dots or tag any active moderator for removing this post.

Learn how to report any post [here](https://www.reddit.com/r/JEENEETards/comments/1d9ac4i/comment/l7c1q08/)

*I am a bot, and this action was performed automatically. Please [contact the moderators of this subreddit](/message/compose/?to=/r/JEENEETards) if you have any questions or concerns.*",1,2026-02-18 04:01:55
o5ztjyd,1r7sqv5,JEENEETards,SB THORI NA SAKSHAM JINDAL HOTE HAI!!,368,2026-02-18 04:04:24
o5zvc3y,1r7sqv5,JEENEETards,Dance nhi aata ishiye air 1 nhi la raha hu,223,2026-02-18 04:16:04
o5zwonm,1r7sqv5,JEENEETards,"Na to mereko dance ata, na hi meri rank ayi💔",201,2026-02-18 04:25:02
o5zze2s,1r7sqv5,JEENEETards,I think most of us didn't enjoy our lives during JEE....every year when we see these toppers...we know we can't be them...so we just look for a coping mechanisms...hn bhai rank nahi aayi to kya hua...life to enjoy ki...par kya hamne sach me ki hai life enjoy...?,117,2026-02-18 04:43:33
o5zudy7,1r7sqv5,JEENEETards,Meri neet mei ayegi agar achi rank toh mai isse acha dance krunga 😛,42,2026-02-18 04:09:49
o5zwalr,1r7sqv5,JEENEETards,Hrithik ki rank better hai ☝️🤓,18,2026-02-18 04:22:26
o5zzplt,1r7sqv5,JEENEETards,Mujhe to ye tension he ki mujhe apne shaadi me sbke samne nachna pdega 😭,15,2026-02-18 04:45:45
o5zznma,1r7sqv5,JEENEETards,life bhi enjoy ni ki 😂😂🥀🥀🥀,11,2026-02-18 04:45:22
o603bqk,1r7sqv5,JEENEETards,"""He is dead from inside"" 🥺💔💔💔  /s",9,2026-02-18 05:11:14
o60ob43,1r7sqv5,JEENEETards,enjoy bhi nhi Kara marks bhi nhi aaye 😂✌️,7,2026-02-18 08:08:13
o60lapd,1r7sqv5,JEENEETards,BACK FLIPP KYU NAHI MARAAA AIR 1?!!!💢😡🤬,7,2026-02-18 07:40:39
o5zzr05,1r7sqv5,JEENEETards,Ye lodo se khud na dance hua na jee. Hate krte faltu me,5,2026-02-18 04:46:01
o60lnr7,1r7sqv5,JEENEETards,Ppl do everything to cope instead of studying,4,2026-02-18 07:43:57
o60mxbl,1r7sqv5,JEENEETards,"yeah bro all these ""dead inside"" posts just read as hard cope",3,2026-02-18 07:55:31
o60tq11,1r7sqv5,JEENEETards,"Nahh bro isse accha yahi krdeta /s

https://i.redd.it/sdh6qcpvw7kg1.gif

",3,2026-02-18 08:58:47
o627791,1r7sqv5,JEENEETards,"Hot take, 90% of people's lives in india, regardless of what grade they scored in any exam, is going to be worse than most people's lives that live abroad",3,2026-02-18 14:45:24
o5zx1du,1r7sqv5,JEENEETards,Exactly in the name of jee we just wanted to prove to everyone but in reality did we really enjoy that thing or just to seek validation from others . ,2,2026-02-18 04:27:26
o603elj,1r7sqv5,JEENEETards,AVI KYA CHAL RHA H IIT BUMBAI MA? 2ND SEM KE PAPERS HUE?,2,2026-02-18 05:11:49
o608ltz,1r7sqv5,JEENEETards,tumne life enjoy krli isiliye to 80 aaye,2,2026-02-18 05:51:31
o5o3l2u,1r67pnw,JEENEETards,"If you feel like this Post violates the subreddit [rules](https://www.reddit.com/r/JEENEETards/about/rules).

Feel free to report it using the 3 dots or tag any active moderator for removing this post.

Learn how to report any post [here](https://www.reddit.com/r/JEENEETards/comments/1d9ac4i/comment/l7c1q08/)

*I am a bot, and this action was performed automatically. Please [contact the moderators of this subreddit](/message/compose/?to=/r/JEENEETards) if you have any questions or concerns.*",1,2026-02-16 11:57:15
o5o3oti,1r67pnw,JEENEETards,Me with 20 marks rn,372,2026-02-16 11:58:04
o5o3mo2,1r67pnw,JEENEETards,excuse me 59 he ,126,2026-02-16 11:57:35
o5o5767,1r67pnw,JEENEETards,"Broo ts frying me i havent even slept in 48h and this just made me fuckin laugh so hard

![gif](giphy|IfPE0x5gfa5ctKpph6)

",80,2026-02-16 12:09:50
o5o3y9d,1r67pnw,JEENEETards,excuse me 45 banre he fck off,46,2026-02-16 12:00:09
o5o5ln4,1r67pnw,JEENEETards,-7 bann rhe hai,42,2026-02-16 12:12:51
o5o3pxj,1r67pnw,JEENEETards,Exactly 54 🤪,24,2026-02-16 11:58:19
o5o575u,1r67pnw,JEENEETards,"55 marks hai 😡😡😡

Izzat se",26,2026-02-16 12:09:50
o5o3w7v,1r67pnw,JEENEETards,🗿🗿🗿😂😂mere 57 aaye hai😂🗿🗿🗿🗿🗿🔥🔥🔥🔥😂😂😅😅😅🗿🗿🗿🗿🗿🔥🔥🔥🔥🔥🔥🔥🔥🔥💅🏻💅🏻💅🏻💅🏻💅🏻💅🏻💅🏻💅🏻,19,2026-02-16 11:59:42
o5o3rke,1r67pnw,JEENEETards,6😖,20,2026-02-16 11:58:40
o5o45k9,1r67pnw,JEENEETards,![gif](giphy|y7npGrJAyRuBulzq4d),14,2026-02-16 12:01:43
o5o5bv6,1r67pnw,JEENEETards,Me with 5 🥀,11,2026-02-16 12:10:49
o5o4662,1r67pnw,JEENEETards,raat ko aayega din me daala to inke server hi chud jjayenge,8,2026-02-16 12:01:52
o5o6l3n,1r67pnw,JEENEETards,Marks pe bhi rasicm?? 👽👽,7,2026-02-16 12:20:15
o5o79yb,1r67pnw,JEENEETards,-2 22s2,7,2026-02-16 12:25:25
o5o53hr,1r67pnw,JEENEETards,116 valo ki jagah khali karo🗿,7,2026-02-16 12:09:05
o5o40sw,1r67pnw,JEENEETards,Me with 57 (kaash 67) hota,5,2026-02-16 12:00:41
o5o4yi2,1r67pnw,JEENEETards,55 milgaya ✌️✌️,3,2026-02-16 12:08:00
o5o5g9n,1r67pnw,JEENEETards,Literally people's asking for percentile at 30 marks 😭,5,2026-02-16 12:11:44
mrkyyy3,1kj9mwg,JEENEETards,Fake. He forgot to thank Thala,428,2025-05-10 12:59:21
mrkzbuv,1kj9mwg,JEENEETards,jeeneetards vale bahut khatarnaak hai,174,2025-05-10 13:01:42
mrl0ywj,1kj9mwg,JEENEETards,"https://preview.redd.it/gusajoqbfyze1.png?width=639&format=png&auto=webp&s=4ce94706b35ff23fb70b0368eff664abfa165938

No way this came true![img](emote|t5_311ttu|49429)",166,2025-05-10 13:12:15
mrkyp0a,1kj9mwg,JEENEETards,Jee advanced ki wajah se war postpone ho gaya ![img](emote|t5_311ttu|32193)![img](emote|t5_311ttu|49427),51,2025-05-10 12:57:31
mrkytjz,1kj9mwg,JEENEETards,Secret member ![img](emote|t5_311ttu|30367),46,2025-05-10 12:58:22
mrkzhou,1kj9mwg,JEENEETards,Bola tha na.... IITians ka ek poora network hai,41,2025-05-10 13:02:45
mrkyy4g,1kj9mwg,JEENEETards,alec pendi 🦡,40,2025-05-10 12:59:12
mrkz8wj,1kj9mwg,JEENEETards,"https://preview.redd.it/3l0rftg9dyze1.png?width=320&format=png&auto=webp&s=7398c63b9e16fd792ecfb29e6e199de3ab3fb4e8

🤣🤣🤣🤣🤣",26,2025-05-10 13:01:10
mrkzq3g,1kj9mwg,JEENEETards,"fake video hai, asli me aankh se lasers nikal rhe the and slowed reverb punjabi music bhi",21,2025-05-10 13:04:16
mrl0eoq,1kj9mwg,JEENEETards,NTA ne war rukwa di paw paw 🥺🥺,20,2025-05-10 13:08:42
mrkzwap,1kj9mwg,JEENEETards,@.grok is this real ?,17,2025-05-10 13:05:24
mrl1stj,1kj9mwg,JEENEETards,https://preview.redd.it/7mk2rl96gyze1.png?width=224&format=png&auto=webp&s=0e6568190d9f9794debd44d1a4a838a80740ad81,18,2025-05-10 13:17:27
mrkzkra,1kj9mwg,JEENEETards,allec penty sir ne war rukwa di![img](emote|t5_311ttu|49455),13,2025-05-10 13:03:17
mrl7cnt,1kj9mwg,JEENEETards,Power of iit aluminum,10,2025-05-10 13:51:47
mrkzqag,1kj9mwg,JEENEETards,"https://preview.redd.it/pz5dtbqtdyze1.png?width=995&format=png&auto=webp&s=32314fe81ac53ea630dba87ea29e8d5dfdc38e82

Credit goes to thala 🫡🫡![img](emote|t5_311ttu|30180)",9,2025-05-10 13:04:18
mrkz6f3,1kj9mwg,JEENEETards,aye aye tea power not mentioned?,6,2025-05-10 13:00:42
mrm1m6q,1kj9mwg,JEENEETards,"Donaldd-7 letters


Trumppp-7 letters


Maहेndra-7 letters


Sinnggh-7 letters


Dhoniii-7 letters


THALA FOR A REASON",4,2025-05-10 16:40:14
mrl0n5e,1kj9mwg,JEENEETards,"IIT K se ultimatum aaya tha ceasefire ka.

Orange man ko itna bhi nahi pata kya president banega",5,2025-05-10 13:10:12
mrkzqmq,1kj9mwg,JEENEETards,Ay ay te aluminium pawar 🔥💪💪😈,3,2025-05-10 13:04:22
mnpvkzs,1k1y9sm,JEENEETards,"If you feel like this Post violates the subreddit [rules](https://www.reddit.com/r/JEENEETards/about/rules).

Feel free to report it using the 3 dots or tag any active moderator for removing this post.

Learn how to report any post [here](https://www.reddit.com/r/JEENEETards/comments/1d9ac4i/comment/l7c1q08/)

*I am a bot, and this action was performed automatically. Please [contact the moderators of this subreddit](/message/compose/?to=/r/JEENEETards) if you have any questions or concerns.*",1,2025-04-18 06:27:35
mnpw73e,1k1y9sm,JEENEETards,"Bhai ka NTA bhi kuch nahi ukhaad sakta, bhai AMAR hai",493,2025-04-18 06:33:45
mnq00fc,1k1y9sm,JEENEETards,https://preview.redd.it/8aiijhh0njve1.png?width=1080&format=png&auto=webp&s=1482d8b6fb3cea56820c17665bdd895c6640fc14,337,2025-04-18 07:12:31
mnpxiub,1k1y9sm,JEENEETards,Bhai galiyon ke beech me kuch words hai,279,2025-04-18 06:47:05
mnpxcqb,1k1y9sm,JEENEETards,Least angry JEE apirant rn :,192,2025-04-18 06:45:24
mnq0b55,1k1y9sm,JEENEETards,Amarjeet said calmly.,101,2025-04-18 07:15:41
mnpz9ss,1k1y9sm,JEENEETards,Do they really announce ts on twitter?😨 (sorry i have no clue),48,2025-04-18 07:04:53
mnq58r2,1k1y9sm,JEENEETards,100% feelings 0% control 10000% support from every aspirant,31,2025-04-18 08:07:25
mnqisry,1k1y9sm,JEENEETards,"Have u guys ever noticed all the abuses are directed towards mother , sister or women in general , can't u guys be mindful of the words? ever heard Baapchod ? Is this what we boil down to ? And how without thinking twice we use it ?",24,2025-04-18 10:27:38
mnq79v6,1k1y9sm,JEENEETards,Bhai ke naam me hi jee hai!!!,18,2025-04-18 08:29:09
mnpwnxk,1k1y9sm,JEENEETards,![gif](giphy|l4pMattUYTTM7qpIk),16,2025-04-18 06:38:28
mnq6qj0,1k1y9sm,JEENEETards,Collective thoughts of whole JEE community,14,2025-04-18 08:23:27
mnq12gv,1k1y9sm,JEENEETards,Shaant ho jao Amarjeet bhai,10,2025-04-18 07:23:41
mnq83w7,1k1y9sm,JEENEETards,At that moment he wasn't amarjeet but the voice of all jeetards across universe,11,2025-04-18 08:37:59
mnq3wqk,1k1y9sm,JEENEETards,"https://i.redd.it/ika261yaujve1.gif

Hridaysaprshi",6,2025-04-18 07:53:23
mnqou0i,1k1y9sm,JEENEETards,https://preview.redd.it/y1hzr075vkve1.jpeg?width=320&format=pjpg&auto=webp&s=cb006cf0649dacb404223df799f0d24c27a03443,3,2025-04-18 11:19:52
mnq45xm,1k1y9sm,JEENEETards,inke waje se hajaar bachhonki air1 nhi ayegi,3,2025-04-18 07:55:59
mnqc3ha,1k1y9sm,JEENEETards,amarjeet is definitely not happy,3,2025-04-18 09:19:51
mnqck1v,1k1y9sm,JEENEETards,Reasonable Crashout,3,2025-04-18 09:24:48
ocqolir,1s3z0mv,JEENEETards,"Thank you for submitting to r/JEENEETards. Unfortunately, your submission has been removed for the following reason(s):

---
- Your submission doesn't align with our JEE/NEET focus mandated in our subreddit.

- Your submission does not add any kind of value in our subreddit.
---
Resubmitting a removed post without prior moderator approval can result in a ban. Deleting a post may cause any appeals to be denied.",1,2026-03-27 09:22:40
ocj5tlg,1s3z0mv,JEENEETards,"I am so happy that this issue got international , ab ye viral hoga aur tab jake ye matter seriously liya jayega",650,2026-03-26 05:44:54
ocj6nev,1s3z0mv,JEENEETards,Bhai international paunch gyi baat IITR walon tak nhi paunchi??,198,2026-03-26 05:52:12
ocj6x2p,1s3z0mv,JEENEETards, 🗣️ 🗣️ professor pandi🔥🔥,153,2026-03-26 05:54:33
ocj61tx,1s3z0mv,JEENEETards,"nice pretty sure nothing will happen but these things should be raised

",56,2026-03-26 05:46:53
ocj9fhe,1s3z0mv,JEENEETards,"W OP

esse teenindia sub me bhi daloooo  
and IITR ke sub me",47,2026-03-26 06:17:13
ocj82fn,1s3z0mv,JEENEETards,Revender pendy 🔥 ,29,2026-03-26 06:04:48
ocjaplm,1s3z0mv,JEENEETards,"Learning : don't believe in uncs/ aunts ( except parents obviously) these days these millenials and gen X are becoming kinda desparate and know way more methods to scam you. No matter how educated the person if he/she is an asshole , will always be an asshole


Learning 2) : some jokers say government doesn't care about innovation 🤡🤡. See this is what people of this nation treat money received I bet if government funds someone raxpayer money 90% will fill pockets ",23,2026-03-26 06:29:04
ocj9n7t,1s3z0mv,JEENEETards,Saw a guy commenting they scam eachother now 😭,16,2026-03-26 06:19:13
ocj92t3,1s3z0mv,JEENEETards,"Pandey❌️
Pandiii✅️🇺🇸",12,2026-03-26 06:13:56
ocj9js8,1s3z0mv,JEENEETards,panduu ji ki feilding set haiii ,12,2026-03-26 06:18:20
ocj80nj,1s3z0mv,JEENEETards,what is this guys name,10,2026-03-26 06:04:22
ocjaqgr,1s3z0mv,JEENEETards,"Chlo bdia hai, maybe internarional image ka dhyan rkhte hue sarkar kch kre, chance are less cause current sikhsha mantri is shit, but hope pr dunia kayam hai 🥀🥀



",10,2026-03-26 06:29:17
ocj9m4l,1s3z0mv,JEENEETards,Bro i used to watch this guy a lot no way he made on this 🤣 I saw some small yter make video how he missed harvard because he didn't check gmail and he also made on it. Seems like we both have same feed,8,2026-03-26 06:18:56
ocj7ujf,1s3z0mv,JEENEETards,From alecc panty we went to professor panty... The downfall is real ,6,2026-03-26 06:02:48
ocjh8kd,1s3z0mv,JEENEETards,"Accha hua h1t1 jaise chootiye ne cover nahi kiya warna racist remarks deta


This ytber is gold ",8,2026-03-26 07:29:20
ocj6gdm,1s3z0mv,JEENEETards,pretty sure foreign peeps find it shocking news but its sad how common it is in our country. ,5,2026-03-26 05:50:29
ocjq372,1s3z0mv,JEENEETards,"all these international people are looking for their own benefits (they will get more attention and shii), but seeing positive side hope that guy gets credit for his work",2,2026-03-26 08:53:35
ocj6a45,1s3z0mv,JEENEETards,this is embarassing for india and that professor but deservedt.,2,2026-03-26 05:48:56
mta60gp,1kr35zr,JEENEETards,"If you feel like this Post violates the subreddit [rules](https://www.reddit.com/r/JEENEETards/about/rules).

Feel free to report it using the 3 dots or tag any active moderator for removing this post.

Learn how to report any post [here](https://www.reddit.com/r/JEENEETards/comments/1d9ac4i/comment/l7c1q08/)

*I am a bot, and this action was performed automatically. Please [contact the moderators of this subreddit](/message/compose/?to=/r/JEENEETards) if you have any questions or concerns.*",1,2025-05-20 12:04:43
mta7heb,1kr35zr,JEENEETards,bhai take care of yourself... fuck cancer...![img](emote|t5_311ttu|53370)![img](emote|t5_311ttu|53370)![img](emote|t5_311ttu|53370),560,2025-05-20 12:14:39
mta745m,1kr35zr,JEENEETards,"Bro dont worry take care of yourself

R.I.P Prajal",257,2025-05-20 12:12:11
mta9g6q,1kr35zr,JEENEETards,"Virtual hug to you 😭💗 ""life should be beautiful not luxurious""",140,2025-05-20 12:27:51
mtaazdn,1kr35zr,JEENEETards,"I just ruined 2 drop years and NEET. You have no idea what effect this post had on me. It's true, we should be grateful for what we have. 

I hope you'll recover soon. I'll keep you in my prayers bud. 
RIP Prajal.",101,2025-05-20 12:37:50
mta769l,1kr35zr,JEENEETards,Om Shanti,80,2025-05-20 12:12:34
mta8zkd,1kr35zr,JEENEETards,"Rip prajal


Take care of yourself op",33,2025-05-20 12:24:44
mta9dbm,1kr35zr,JEENEETards,"i hope the odds are always in your favour man 

jai shree krishna",28,2025-05-20 12:27:20
mta9x5e,1kr35zr,JEENEETards,"i wish the best for you OP, get well soon. Honestly i am very sorry to myself and the people who are fighting for their lives ,i was in such a bad condition i wished to die everyday , wished to get diagnosed with some life threatening disease but after reading your message i feel so sorry i took all of this for granted. RIP PRAJAL",19,2025-05-20 12:30:56
mtaaa09,1kr35zr,JEENEETards,"RIP prajal. Another beautiful soul gone too soon. Bhai khayal rakh apna. You and people like you teach me a lot about life. You've helped thousands of kids here, just by sharing your story. So find happiness in that, you've already impacted a lot of people and keep sharing. Prayers🙏",20,2025-05-20 12:33:16
mtaawhh,1kr35zr,JEENEETards,"Fuck cancer even my girlfriend has it, may God give you strength",24,2025-05-20 12:37:19
mta92yi,1kr35zr,JEENEETards,"R.i.p. Prajal.
May you rest in peace.
And OP please get well soon and take care of yourself.",18,2025-05-20 12:25:22
mta96h9,1kr35zr,JEENEETards,always waiting for your recovery post man. Om Shanti 🕉,18,2025-05-20 12:26:03
mtacpa8,1kr35zr,JEENEETards,"I'm yearning to live, which you're doing. So donot with full enthusiasm. Once you face something like cancer, you wouldn't dare making exams your entire personality. 

  
\~ ![img](emote|t5_311ttu|32193)",17,2025-05-20 12:48:49
mtaa9ga,1kr35zr,JEENEETards,Rip prajal,15,2025-05-20 12:33:10
mtaajje,1kr35zr,JEENEETards,"Are bhai tu dhyan rakhna, bhai pura sub tere sath he, badhiya se theek hoja, aur phir theek hone good news share kar. Rip prajal🙏",14,2025-05-20 12:35:00
mtaicxg,1kr35zr,JEENEETards,"Cried half the day wondering why i got this shitass life. And now this? It hurts like hell. Why does life have to be so hard? Hope you get better soon, and may your friend rest in peace.",13,2025-05-20 13:22:40
o5onl6t,1r6aii4,JEENEETards,"If you feel like this Post violates the subreddit [rules](https://www.reddit.com/r/JEENEETards/about/rules).

Feel free to report it using the 3 dots or tag any active moderator for removing this post.

Learn how to report any post [here](https://www.reddit.com/r/JEENEETards/comments/1d9ac4i/comment/l7c1q08/)

*I am a bot, and this action was performed automatically. Please [contact the moderators of this subreddit](/message/compose/?to=/r/JEENEETards) if you have any questions or concerns.*",1,2026-02-16 14:06:24
o5onpha,1r6aii4,JEENEETards,Itne jldi kaise bhai,493,2026-02-16 14:07:02
o5oqd29,1r6aii4,JEENEETards,99.12 but not taking any gift from parents [ taking expensive gifts in middle class family fills with guilt ] 🥀,252,2026-02-16 14:21:13
o5oxj7w,1r6aii4,JEENEETards,"https://preview.redd.it/imc97xsbfvjg1.jpeg?width=1080&format=pjpg&auto=webp&s=ec7caf6e920654cb252846338dfe89cc0ceeb964

Two sides of the same coin 🥀",235,2026-02-16 14:58:53
o5oo2n5,1r6aii4,JEENEETards,you deserve it gang ,214,2026-02-16 14:09:01
o5oprsj,1r6aii4,JEENEETards,99.579 all i got is a 250rs timer clock lmao anyways congratss,127,2026-02-16 14:18:05
o5opzu2,1r6aii4,JEENEETards,"CONGRATSSSS  
my dad let me buy whatever i want with 6k refund from mathongo (99.13) 😍  
lifes good rn",46,2026-02-16 14:19:16
o5oq6be,1r6aii4,JEENEETards,Mere paas pehle se he fir bhee sirf 97%ile,36,2026-02-16 14:20:14
o5otztt,1r6aii4,JEENEETards,"Dad bought this after I scored 58 %centile

https://preview.redd.it/dusg3ff1cvjg1.jpeg?width=390&format=pjpg&auto=webp&s=6dd5666a8e936b844cde24cd521719fbacc55b4c",33,2026-02-16 14:40:27
o5ot7u2,1r6aii4,JEENEETards,My mom got me ferrero rocher for getting 99.42 lmao 😭 enjoy ur ipad W,32,2026-02-16 14:36:18
o5oo8dm,1r6aii4,JEENEETards,Congratulations 🥳 bas Ipad per games mat khelna ab ,16,2026-02-16 14:09:52
o5ossn4,1r6aii4,JEENEETards,https://preview.redd.it/kp52e4bwavjg1.png?width=1080&format=png&auto=webp&s=49007976ab92e416030a6746701cb78798b97b18,10,2026-02-16 14:34:04
o5ony4r,1r6aii4,JEENEETards,Itne mai lata toh SUV dedete mere papa congrats champ,5,2026-02-16 14:08:20
o5onom1,1r6aii4,JEENEETards,good for you,5,2026-02-16 14:06:55
o5ool84,1r6aii4,JEENEETards,Congratulations 🙌,3,2026-02-16 14:11:48
o5oq480,1r6aii4,JEENEETards,"Wah bhai congrats 😀

Mere to 🤐😔😮‍💨",3,2026-02-16 14:19:56
o5oqf9x,1r6aii4,JEENEETards,congrats meri phi itni aayi thi pichle saal advance c\*ud gaya tha mera advance acche se dena tum,3,2026-02-16 14:21:32
o5os7bw,1r6aii4,JEENEETards,I got 99.86 pr no gifts rn kyuki advance tk padhai krni hai.....wrna muje pta hai agr hath mai gaming laptop aagya toh padhai ke laale pad jayenge,3,2026-02-16 14:30:55
o5qi8tz,1r6aii4,JEENEETards,"Congrats bhai...
Isme RDR2 khelna... mere phone mein to nhi chalta..review likhna pls",3,2026-02-16 19:24:15
nwq3sf2,1pzhrv0,JEENEETards,"If you feel like this Post violates the subreddit [rules](https://www.reddit.com/r/JEENEETards/about/rules).

Feel free to report it using the 3 dots or tag any active moderator for removing this post.

Learn how to report any post [here](https://www.reddit.com/r/JEENEETards/comments/1d9ac4i/comment/l7c1q08/)

*I am a bot, and this action was performed automatically. Please [contact the moderators of this subreddit](/message/compose/?to=/r/JEENEETards) if you have any questions or concerns.*",1,2025-12-30 13:11:54
nwq5sog,1pzhrv0,JEENEETards,W parents wese op try some other exam don't quit now no use if jee doesn't work out go for other exam and enjoy ur life in clg,620,2025-12-30 13:24:26
nwq5v41,1pzhrv0,JEENEETards,Mere mocks me kam aaye toh cheer nhi seedha chair maarte hai mere upar 😭🙏,133,2025-12-30 13:24:51
nwq463j,1pzhrv0,JEENEETards,bhai ye pizza thoda sa...,77,2025-12-30 13:14:19
nwq85mj,1pzhrv0,JEENEETards,"W parents, when I got 284/720 in NEET, main apne maa ke pairon mein roi thi whilst she told yeh mere paapon ki den hai 🙃🙃🙃",59,2025-12-30 13:38:42
nwq9zp1,1pzhrv0,JEENEETards,"Who knew it was extraordinary to stand by your loved ones, especially ur child, in their tough times. Narcissism in this country has really set the bar too low",60,2025-12-30 13:49:27
nwq7ud0,1pzhrv0,JEENEETards,W parents,23,2025-12-30 13:36:50
nwq7l2u,1pzhrv0,JEENEETards,"Koi baat nhi bs mehnat kro aur consistent raho , jee ke alawa bhi bahot raste h parents ko proud feel krwane ka ",13,2025-12-30 13:35:16
nwqckwu,1pzhrv0,JEENEETards,Only a machine will count its worth by productivity,13,2025-12-30 14:04:26
nwq9qj6,1pzhrv0,JEENEETards,"Dude, well idk which year you are in, so see if you are giving jee in 26, just saying it's not the end of the world if your Jan attempt doesn't go well, you still have April attempt in your hands and if you can focus a bit more on why is your marks less(like test analysis type) I am sure you will improve very well


If you are giving jee in 27, just saying that you still have 1 year to do hardwork and success will follow you


I am hoping you are giving it in 26 so, just do what you can do, try to improve it, you will be amazing 


Your parents support you as well, they know you can do it, so just for that, get the motivation to not let them down, it's sufficient to keep you moving",10,2025-12-30 13:47:57
nwq7hkg,1pzhrv0,JEENEETards,Bhai merese to attempt bhi ni ho rha 🥀,8,2025-12-30 13:34:41
nwq7zi5,1pzhrv0,JEENEETards,mere 100-130 pe baat ni kre fml,5,2025-12-30 13:37:42
nwqaoxi,1pzhrv0,JEENEETards,"then become the child they deserve, dont cry online, no ones coming to help you",6,2025-12-30 13:53:31
nwqckt3,1pzhrv0,JEENEETards,They want you alive,4,2025-12-30 14:04:25
nwqdl50,1pzhrv0,JEENEETards,https://preview.redd.it/g7g1nk1wmcag1.jpeg?width=320&format=pjpg&auto=webp&s=0007e241df7b4e8efe293a25598dcea57bce3496,5,2025-12-30 14:10:13
nwqe12c,1pzhrv0,JEENEETards,khana bhi 76/300 hi lag rha hai bhai 🤦‍♂️,5,2025-12-30 14:12:45
nwqam9q,1pzhrv0,JEENEETards,Bhai apne pass bohot time hai tu tension mat le karte rhe bas mai bhi same hi situation mei hu last mock 35 marks aaye the ye mock 100+ aaye hai shit gets better we can do it. 20 days is a lifetime ,5,2025-12-30 13:53:06
nwqar4k,1pzhrv0,JEENEETards,us twin🥀 unhone mujhe hazaar baar bola hai ki if im getting too stressed i can just leave this jee shit and tht they wouldnt have any problem with me getting into a priv college either 🥀💔 but since im a lifeless masochistic loser chud mujhe toh g mrwane mein khushi milti hai so here I am😍🥀,3,2025-12-30 13:53:53
