comment_id,post_id,subreddit,body,score,created_utc
mqk1xyg,1kenkvc,JEENEETards,"If you feel like this Post violates the subreddit [rules](https://www.reddit.com/r/JEENEETards/about/rules).

Feel free to report it using the 3 dots or tag any active moderator for removing this post.

Learn how to report any post [here](https://www.reddit.com/r/JEENEETards/comments/1d9ac4i/comment/l7c1q08/)

*I am a bot, and this action was performed automatically. Please [contact the moderators of this subreddit](/message/compose/?to=/r/JEENEETards) if you have any questions or concerns.*",1,2025-05-04 16:15:09
mqk47wj,1kenkvc,JEENEETards,"W dad, mere dost ko toh itni daant padi ki ghar se bhagkr mama ghar bhag gya. Udhar se mama ne daanta toh abhi mere ghar m sone aaya h....",1820,2025-05-04 16:26:56
mqk2an6,1kenkvc,JEENEETards,W dad 🗿❤️,600,2025-05-04 16:16:59
mqk2nqw,1kenkvc,JEENEETards,tumhara naam Farhaan hoga fir,122,2025-05-04 16:18:53
mqkaz8o,1kenkvc,JEENEETards,"Bakre ko halal krne se phele bohut acha acha khilate hain

Just saying, not related 


Btw

W dad",99,2025-05-04 17:01:10
mqk2msw,1kenkvc,JEENEETards,enjoy kar le bhai yaaha toh kaadu baana hai,65,2025-05-04 16:18:45
mqk6280,1kenkvc,JEENEETards,Mere parents ne do baar raste mei car roka pizza khilane ke liye..but mere mei himmat nhi thi bhai pizza khane ke liye ppr kharab kar ke😓,56,2025-05-04 16:36:29
mqk75oh,1kenkvc,JEENEETards,My dad treated me with Samosa and Chutney 🥺,43,2025-05-04 16:42:08
mqk31pd,1kenkvc,JEENEETards,"W dad 
But ain't gonna lie dominos is absolute shit 
Like their pizzas seriously taste so chemical-ly , so artificial , it's like we are eating this only for mental gratification",38,2025-05-04 16:20:53
mqkbmgq,1kenkvc,JEENEETards,"bhai same last year mene neet diya tha aur ghar aake mujhe pizza ka surprise mila. mujhe yaad h mene rote rote khaya tha, taste pe to dhyan bhi nhi gaya bas ese hi thus rhi thi",21,2025-05-04 17:04:21
mqk732m,1kenkvc,JEENEETards,Parents' love is unconditional,18,2025-05-04 16:41:45
mqk22t7,1kenkvc,JEENEETards,W dad,15,2025-05-04 16:15:51
mqkc6it,1kenkvc,JEENEETards,Mera centre Darjeeling me pada papa chal nhi paa rhe the i thought itna sacrifice k baad i will prove today par nhi kar paya fir bhi papa bole koi baat nhi next year tum nikl loge aur tumko Jo fav car chaiye dila denge i felt so bad ki yaar kabhi kush nhi krta hu srif dukh Diya h,12,2025-05-04 17:07:07
mqk5ekj,1kenkvc,JEENEETards,"Mere papa ne bhi chili chicken khilaya , bole agli baar dekh lena",9,2025-05-04 16:33:05
mqn1mzj,1kenkvc,JEENEETards,Bro I got failed in 9th class and was really feeling down and it was kinda rock bottom for me and my parents but surprisingly my dad took me out for dinner which I wasn’t expecting because of typical dad and son relationship but he didn’t said a single word about results or any other stuff related to studies at that point I got to know dad’s might not be good at expressing but they will do anything that makes you happy and uplift your spirits and later on I scored 81% in 10th and 91% in 12th and got into DU and now gonna be pilot.  Unfortunately my dad is no more but still I’m very grateful for everything he did,9,2025-05-05 02:03:16
mqkc2q0,1kenkvc,JEENEETards,Rickshaw dilwane se pehle ki party 🎉🥳 (jk),10,2025-05-04 17:06:36
mqk8h91,1kenkvc,JEENEETards,"Pehle khana, fir kutana",6,2025-05-04 16:48:46
mqk7olq,1kenkvc,JEENEETards,good for you bhai merko to abhi bhi yadd h in jan attempt meri 98%ile aai thi and they were like we dont give a fuck ''aae h to aae h sabke aate h '' like wtf?  ts pmo icl 💔,4,2025-05-04 16:44:46
mqkfvix,1kenkvc,JEENEETards,"Congratulations Op !!

Even After getting 98 Percentile, it was night my father said bas itne hi , kya hi karliye itna laake itna toh Bina padhe aajata hain , hamari saari mehnat barbaad kardi and whole night I was sad and thinking hamari Mehnat? Wasn't it mine too?",6,2025-05-04 17:25:27
nw1nb4e,1pw6dzt,JEENEETards,"Hello, people from r/popular.

NEET(National Eligibility cum Entrance Test) is India's nationwide exam for students seeking admission to medical courses in various medical colleges in India. 

This sub is all about students preparing for such exams and having a community to be with, from help to shitposts.",1,2025-12-26 16:38:32
nw17vog,1pw6dzt,JEENEETards,shadi is family decision but baccha is your,2966,2025-12-26 15:14:21
nw16vo4,1pw6dzt,JEENEETards,"just a weird question, is your child gonna continue your legacy? if yes, please enrol him into neet 2040 batch exclusive for 50000, that will give him a special seat in the competition",1707,2025-12-26 15:08:32
nw17nlu,1pw6dzt,JEENEETards,Bro tere shadi ke 2saal hue hain aur tera beta 2 saal ka hone wala hain🙂,819,2025-12-26 15:13:05
nw1cx9c,1pw6dzt,JEENEETards,2 years of marriage and child is going to turn 2? Well it's my theory ig he got the girl preg before the marriage which forced him to get married,459,2025-12-26 15:42:47
nw18bby,1pw6dzt,JEENEETards,"i get that you had to forcefully get married but if you can't manage studies alongside parenting, why did you have a child?",251,2025-12-26 15:16:51
nw181lp,1pw6dzt,JEENEETards,"personally i think the only realistic 'option' would be to sacrifice your sleep because your kid needs attention too

that being said, are you entirely sure you want to be a doctor THIS bad? you can try to do great in other aspects of your life too you know?

plus doctors themselves barely get time for family (or even themselves) so what about that?",236,2025-12-26 15:15:19
nw19inz,1pw6dzt,JEENEETards,"I'm sorry to say this bro but NEET at 24 years old and being a parent is not a good choice for you at this situation 🙏 even if you get selected for any medical college.., you will face a lot of difficulties there at your current situation...., better go for something which will get you employed within a year or something..., just think of yourself when you will be completing MBBS, you will be around 28-29.., and at that age ,starting the carrier is a bad choice ofcourse...

And my one more question for you is what did you do after 12th? That too 4 years till you turn 22?",221,2025-12-26 15:23:43
nw1b84s,1pw6dzt,JEENEETards,"Bro be like

https://preview.redd.it/4znvo692ik9g1.png?width=1200&format=png&auto=webp&s=dd4cc76daa92c4d26360a780db1f0f1d27066d91",65,2025-12-26 15:33:21
nw17c5y,1pw6dzt,JEENEETards,Why do some parents feel the need to have so much control over their children’s lives? Sorry brother and All the best..,62,2025-12-26 15:11:14
nw18hm6,1pw6dzt,JEENEETards,"shaadi ke 9 mahine pehle hi sax sux shuru kardiya tha kya

also how tf are you managing financially? if youre dependent on your parents then please drop the idea, if your spouse or you are earning then you can try",54,2025-12-26 15:17:52
nw19sqg,1pw6dzt,JEENEETards,"why you had a kid tho ?? if you were not mentally ready for a marriage at 22 what were you thinking before becoming a parent at 22 ? 

it's actually crazy to read this because i am 22 myself and i cannot even think about marrying right now even though i am madly in love with someone, forget about kids

i will just say all the best because your post made me feel privileged",54,2025-12-26 15:25:18
nw18fp8,1pw6dzt,JEENEETards,baby to cutu hai,51,2025-12-26 15:17:34
nw1bmwb,1pw6dzt,JEENEETards,This may not be the best sub for guidance.,43,2025-12-26 15:35:39
nw1calz,1pw6dzt,JEENEETards,What? Why are you preparing for neet even and what is your prior education. Would suggest you to take SSC or other govt job exams. Mbbs is brutal. I am in mbbs rn and i can tell that medical field takes your soul. There is a reason majority of doctors marry in their 30s or dont marry.,40,2025-12-26 15:39:17
nw19ck6,1pw6dzt,JEENEETards,bro when you be a full fleged doc like pg MD residency won't your Kid be ready to give neet by then?,36,2025-12-26 15:22:45
nw1afuc,1pw6dzt,JEENEETards,"for genuine suggestions, go on medicotard or indianmedschool sub",29,2025-12-26 15:28:56
nw1n8m1,1pw6dzt,JEENEETards,"Wait. 
You married at 22. Now you're 24. Your baby is 2 years old. That means he was born when you were 22 years old. ""Forced"" into marriage means, you impregnated a girl and was forced to get married right? That's the only conclusion I come into.",28,2025-12-26 16:38:10
nw17g8x,1pw6dzt,JEENEETards,![gif](giphy|uiUm7hG26a6bAGppO6),24,2025-12-26 15:11:53
o0ai9f9,1qg9eby,JEENEETards,"If you feel like this Post violates the subreddit [rules](https://www.reddit.com/r/JEENEETards/about/rules).

Feel free to report it using the 3 dots or tag any active moderator for removing this post.

Learn how to report any post [here](https://www.reddit.com/r/JEENEETards/comments/1d9ac4i/comment/l7c1q08/)

*I am a bot, and this action was performed automatically. Please [contact the moderators of this subreddit](/message/compose/?to=/r/JEENEETards) if you have any questions or concerns.*",1,2026-01-18 14:04:48
o0akug5,1qg9eby,JEENEETards,"and then they say beti bachao beti padhao , beti padha toh denge bachayenge kaise",327,2026-01-18 14:19:29
o0aljt9,1qg9eby,JEENEETards,No one is safe in this country. Everything is corrupted here. There are literally people who protest in favor of r@pists.,241,2026-01-18 14:23:27
o0ao4x6,1qg9eby,JEENEETards,my hate for my own country is increasing day by day...how can i live peacefully in a country as a girl where r@pe and mu\*der is justified and criminals are defended by police and politicians....we are doomed.,134,2026-01-18 14:37:42
o0ajvk8,1qg9eby,JEENEETards,"*This post was mass deleted and anonymized with [Redact](https://redact.dev/home)*

elderly aspiring spotted offer decide carpenter pause voracious test vanish",94,2026-01-18 14:14:04
o0al1mo,1qg9eby,JEENEETards,"I think law should be changed 


Under 18 boys who are involved in rape like crime should be treated as adults 


And pegging should be done by heated metal to such rapist 


And death for death, if someone is involved in murder or death of someone, he should also be sentenced death penalty ",94,2026-01-18 14:20:36
o0ao4wg,1qg9eby,JEENEETards,yaha jee main ko 'saraswati puja' ke vajh se postpone kar rhe hai aur yaha saraswati ke sath kya kiya jara hai diabolical shit,47,2026-01-18 14:37:42
o0amkcd,1qg9eby,JEENEETards,"padh leta hu warna kisi din main bhi gutter me milunga...  
This country is doomed. Kuch nahi ho sakta",32,2026-01-18 14:29:03
o0auitc,1qg9eby,JEENEETards,Alakh sir kuchh kehlo bhadiya admi toh hain,32,2026-01-18 15:11:27
o0am6pc,1qg9eby,JEENEETards,"Itne gawar bhare pade hai 
Itne corrupt leaders 
Ganda mindset / crab mentality
And what not",30,2026-01-18 14:27:00
o0akvq6,1qg9eby,JEENEETards,"This country is absolutely rotten to its core. Reservation everywhere, people can't control themselves when they look at girls. If you say something for girls , not against them, they say ""nahi degi bhai"" . 
Mentality is shit, there are several stupid stereotypes",23,2026-01-18 14:19:41
o0alood,1qg9eby,JEENEETards,Kuch khunga toh fir ye reddit wle warn ya ban dedenge.. ,18,2026-01-18 14:24:13
o0apzlh,1qg9eby,JEENEETards,"https://preview.redd.it/p11z9dase4eg1.jpeg?width=1170&format=pjpg&auto=webp&s=a0a55d7b757f53b518b34190e6a930813b8796fb

Just see the comment",19,2026-01-18 14:47:41
o0azgrx,1qg9eby,JEENEETards,"For those who don't know, there is a pi*p in patna who supplies girls to top min*sters, officers and rich old perv*rts. 
I know this, bcuz, my friend's cousin who stays in patna knows that guy. These old fu*ks are monsters and assault them.",15,2026-01-18 15:36:08
o0arae9,1qg9eby,JEENEETards,"Someone said it correctly once - soch galat mard ki and pardah karen hum - itna andhar se gire hue hai kuch mard that they can't control themselves seeing a girl.  
And even worse I've personally seen the growth in such crappy mentality in boys of our ex-school as well, agar kuch ladkiyan se baat kro ""simp kahin ka"" ""nahi degi bhai""

Somehow crimes against women kamne ke jagah with awareness, its just increasing exponentially  
It's sad really, tbh agar apne liye nahi apne baccho ke liye bahar jana zaruri sa ho chuka hai  
Bro it's funny that when such incidents occur, there are some backward minded people who say ""taali kabhi ek haath se nahi bajti, do haath se bajta hai"" wtf?  
Horrendous cases, kids under 5, rg kar, nirbhaya.... beti padha loge bachaoge kese?",13,2026-01-18 14:54:34
o0alc00,1qg9eby,JEENEETards,"Now in India , Criminal don’t afraid to do crimes at all.",11,2026-01-18 14:22:14
o0an7d7,1qg9eby,JEENEETards,poolice bale bahut maderchod hote hain aram se bikjate,12,2026-01-18 14:32:33
mn11exb,1jytkur,JEENEETards,"If you feel like this Post violates the subreddit [rules](https://www.reddit.com/r/JEENEETards/about/rules).

Feel free to report it using the 3 dots or tag any active moderator for removing this post.

Learn how to report any post [here](https://www.reddit.com/r/JEENEETards/comments/1d9ac4i/comment/l7c1q08/)

*I am a bot, and this action was performed automatically. Please [contact the moderators of this subreddit](/message/compose/?to=/r/JEENEETards) if you have any questions or concerns.*",1,2025-04-14 08:03:38
mn124ka,1jytkur,JEENEETards,"top 10 things that didnt happen  
1. this  
2. you getting bitches",3020,2025-04-14 08:11:17
mn11r64,1jytkur,JEENEETards,riyal(main hi papa hu),587,2025-04-14 08:07:21
mn12jpn,1jytkur,JEENEETards,"Bhai dost ko papa naam se save karke logo ko convince nhi kiya jaata

https://preview.redd.it/cxwte8bnerue1.png?width=383&format=png&auto=webp&s=5faeb2729277a302f9380938d906cda2c6fcae57",350,2025-04-14 08:15:47
mn15jee,1jytkur,JEENEETards,"racial glorious childlike memory attraction mountainous ancient disarm dolls numerous

 *This post was mass deleted and anonymized with [Redact](https://redact.dev/home)*",169,2025-04-14 08:48:18
mn11m3z,1jytkur,JEENEETards,News me aane ki koshish![img](emote|t5_311ttu|30168),156,2025-04-14 08:05:49
mn13qkg,1jytkur,JEENEETards,This is us as parents 😋😂,61,2025-04-14 08:28:43
mn12alz,1jytkur,JEENEETards,Bc ye kaunse papa hn? 20 ke papa 18 ka baccha hn ![img](emote|t5_311ttu|49429),40,2025-04-14 08:13:04
mn12df5,1jytkur,JEENEETards,lgta h uncle n bhi JEE dia h,34,2025-04-14 08:13:55
mn11mh3,1jytkur,JEENEETards,"bhai ye real nahi ho sakta 😭😭 me marjaunga agr ye real hai tho

where can i find father like him bruh 🙏",27,2025-04-14 08:05:56
mn11oq0,1jytkur,JEENEETards,"Maana ki dimaag khud chuka hai, lekin itna bhi nhi khuda ki real world se escape hi kar jaaye![img](emote|t5_311ttu|52289)",26,2025-04-14 08:06:36
mn12h95,1jytkur,JEENEETards,Papa is from the hood,27,2025-04-14 08:15:03
mn12ehw,1jytkur,JEENEETards,aapke papa bilkul mere tarah ke soch rkhte hain ( kahin wo main to nahi)?,12,2025-04-14 08:14:14
mn1amxf,1jytkur,JEENEETards,"Upcoming news article:  
Teen sends his father an emotional message stating that he won't be able to clear JEE, his father's reply will...",11,2025-04-14 09:43:43
mn11hfr,1jytkur,JEENEETards,apke pitaji ko mera namaskar ![img](emote|t5_311ttu|52289) W father,10,2025-04-14 08:04:23
mn162o9,1jytkur,JEENEETards,"when your friend says, ""mai papa hu tera"" and you take it seriously",10,2025-04-14 08:54:06
mn1wcg1,1jytkur,JEENEETards,https://preview.redd.it/ir7v7h16qsue1.jpeg?width=640&format=pjpg&auto=webp&s=81bc40945287ec096576874fdd2427be941e63c7,7,2025-04-14 12:42:07
mn18hxr,1jytkur,JEENEETards,https://preview.redd.it/7iw5jem7qrue1.png?width=327&format=png&auto=webp&s=c48b6bc25fedc2f52641151319fb592292f7a454,5,2025-04-14 09:20:37
mn12kfc,1jytkur,JEENEETards,kya papa aur beta dono genz hai?,5,2025-04-14 08:16:00
nbmtqib,1n4pzt4,JEENEETards,"If you feel like this Post violates the subreddit [rules](https://www.reddit.com/r/JEENEETards/about/rules).

Feel free to report it using the 3 dots or tag any active moderator for removing this post.

Learn how to report any post [here](https://www.reddit.com/r/JEENEETards/comments/1d9ac4i/comment/l7c1q08/)

*I am a bot, and this action was performed automatically. Please [contact the moderators of this subreddit](/message/compose/?to=/r/JEENEETards) if you have any questions or concerns.*",1,2025-08-31 09:04:01
nbmuhaz,1n4pzt4,JEENEETards,UPSC AIR 1 LEVEL SHIT 🥀🥀,1406,2025-08-31 09:11:28
nbmu2qo,1n4pzt4,JEENEETards,road to iit,415,2025-08-31 09:07:27
nbmut6n,1n4pzt4,JEENEETards,"koi dusra ""chaara"" nahi hai?",282,2025-08-31 09:14:46
nbmttji,1n4pzt4,JEENEETards,Damn bro kya gaming chair hai. ,265,2025-08-31 09:04:53
nbmujoe,1n4pzt4,JEENEETards,"""I studied under kerosene lamp at night"" ahh setup.",146,2025-08-31 09:12:07
nbmudgo,1n4pzt4,JEENEETards,AIR 1 spotted,110,2025-08-31 09:10:25
nbmv2s6,1n4pzt4,JEENEETards,"""jinko padhna hota hai woh kahi bhi padhlete hain"" ahh setup",99,2025-08-31 09:17:25
nbmu15m,1n4pzt4,JEENEETards,"Lighting set karlo bhai, eyes strain honge if you study in that lighting, beside that it's a good setup",88,2025-08-31 09:07:01
nbmv1yh,1n4pzt4,JEENEETards,Bhai question book se karte ho ya wo bhi khud banake karte ho,72,2025-08-31 09:17:12
nbmur49,1n4pzt4,JEENEETards,Macchar 📈📈,35,2025-08-31 09:14:12
nbmv0j4,1n4pzt4,JEENEETards,Zero distraction ka mahool...😭😭😭,16,2025-08-31 09:16:49
nbmupz7,1n4pzt4,JEENEETards,Bhai aab mujhe aapne pr sharam aa rahi h,16,2025-08-31 09:13:52
nbmv5xb,1n4pzt4,JEENEETards,Gaon ke ladke ne mare sheher ke ladkon ke gand type shi,14,2025-08-31 09:18:17
nbn15fu,1n4pzt4,JEENEETards,Bhai salute hai yaar tujhe...humlog ke pass itni saari facility or study material hone ke bawujud humlog nhi padhte...lekin tu yaar voh banda hai jo har chij mei opportunity dhundke apne aapko success ki raah pe le jayega....,12,2025-08-31 10:17:16
nbmu0jz,1n4pzt4,JEENEETards,Anxiety 📈📈📈,8,2025-08-31 09:06:51
nbmuq34,1n4pzt4,JEENEETards,kitna doodh deti hai,8,2025-08-31 09:13:54
nbmwrtu,1n4pzt4,JEENEETards,"Struggle ki story ready h 

Bs success ka intezar hai",9,2025-08-31 09:34:30
nbmtuqk,1n4pzt4,JEENEETards,10/10 bhai 🥰,7,2025-08-31 09:05:14
nbmujpc,1n4pzt4,JEENEETards,Upsc toppers ka study setup,7,2025-08-31 09:12:08
mxdlq7x,1l9mgfa,JEENEETards,"If you feel like this Post violates the subreddit [rules](https://www.reddit.com/r/JEENEETards/about/rules).

Feel free to report it using the 3 dots or tag any active moderator for removing this post.

Learn how to report any post [here](https://www.reddit.com/r/JEENEETards/comments/1d9ac4i/comment/l7c1q08/)

*I am a bot, and this action was performed automatically. Please [contact the moderators of this subreddit](/message/compose/?to=/r/JEENEETards) if you have any questions or concerns.*",1,2025-06-12 13:27:14
mxdmi34,1l9mgfa,JEENEETards,"https://preview.redd.it/v1v6q06r0i6f1.png?width=282&format=png&auto=webp&s=59331e9bdc203d958b68cbae0906ae0ae5c89ebb

thats some wwe stuff",827,2025-06-12 13:31:33
mxdnkyt,1l9mgfa,JEENEETards,Saaf bathroom dekha nahi jaa rha tha logon se,513,2025-06-12 13:37:34
mxdnlxa,1l9mgfa,JEENEETards,"bruh it was 50/50 until the other guy got up too fast and then bro got cooked 

high diff fight tbh

also atleast bas sax sux toh nhi kre kam se kam kuch toh punches lagaye dono ne",503,2025-06-12 13:37:43
mxdqjuw,1l9mgfa,JEENEETards,The last few kicks could've seriously injured the slim guy and landed the kicker in jail...,314,2025-06-12 13:53:25
mxdojia,1l9mgfa,JEENEETards,"Mood fresh ho gya

https://preview.redd.it/wrorgymr2i6f1.jpeg?width=902&format=pjpg&auto=webp&s=8fdb1508d7a89804ead76cfc064ef376dfdc4187",200,2025-06-12 13:42:44
mxdqstb,1l9mgfa,JEENEETards,"i dont get why these fools enjoy these fights, its all fun until you get beaten badly and end up ijured, parents padhne ke liye bheje hai ladne nahi, also inko encourage krne nahi (angry alec emoji)",133,2025-06-12 13:54:43
mxdq6nm,1l9mgfa,JEENEETards,https://preview.redd.it/aopiahtb4i6f1.jpeg?width=1170&format=pjpg&auto=webp&s=6d846fcd5e6d9708534f98c71933cfb4834f342a,112,2025-06-12 13:51:29
mxdpgfg,1l9mgfa,JEENEETards,Allen hai to mumkin hai 🤩🥳🙏🎉🎊,109,2025-06-12 13:47:38
mxdomsu,1l9mgfa,JEENEETards,"Mza aya bhai mza aya

https://i.redd.it/lll39eku2i6f1.gif

u/BirjuAllen bhai confirm and verify this",75,2025-06-12 13:43:13
mxdmvpv,1l9mgfa,JEENEETards,""" ankh me mara'

ah ah finger, finger",59,2025-06-12 13:33:41
mxduaad,1l9mgfa,JEENEETards,Why the fuck is the person recording just standing?? And why the fuck even let those two boys fight so badly??? What the fuck is wrong with these people and what the fuck is wrong with y'all who are watching this like it's some entertainment?,48,2025-06-12 14:12:27
mxdn8wh,1l9mgfa,JEENEETards,Bhai kuch bhi kaho lekin 0:33 par bande ne wwe level ka submission move lagaya. But after that he got wrecked,40,2025-06-12 13:35:43
mxdqotl,1l9mgfa,JEENEETards,"https://preview.redd.it/15tspkds4i6f1.png?width=720&format=png&auto=webp&s=e53f4af1af067fdcb2160beacfd8b23ff4f56b05

The only solution",35,2025-06-12 13:54:08
mxdqwie,1l9mgfa,JEENEETards,What lookism fights looks like:,32,2025-06-12 13:55:14
mxdre4j,1l9mgfa,JEENEETards,https://preview.redd.it/3ja2fe8g5i6f1.jpeg?width=640&format=pjpg&auto=webp&s=0b3822640b4e122bd27981cc25937634a2f05499,20,2025-06-12 13:57:46
mxdqj3w,1l9mgfa,JEENEETards,I thought they were making out 💀,24,2025-06-12 13:53:18
mxdqsdy,1l9mgfa,JEENEETards,"Hey, why y'all keep filming this situations? Why don't you try to stop it, or call someone. They'll beat eachother badly.",16,2025-06-12 13:54:39
mxdqxd8,1l9mgfa,JEENEETards,https://i.redd.it/544v0y6z4i6f1.gif,13,2025-06-12 13:55:21
nnwefam,1osdp2u,JEENEETards,"If you feel like this Post violates the subreddit [rules](https://www.reddit.com/r/JEENEETards/about/rules).

Feel free to report it using the 3 dots or tag any active moderator for removing this post.

Learn how to report any post [here](https://www.reddit.com/r/JEENEETards/comments/1d9ac4i/comment/l7c1q08/)

*I am a bot, and this action was performed automatically. Please [contact the moderators of this subreddit](/message/compose/?to=/r/JEENEETards) if you have any questions or concerns.*",1,2025-11-09 08:00:59
nnwfh8z,1osdp2u,JEENEETards,"Aakash deserves it more for ts

https://preview.redd.it/7zntf86ew60g1.jpeg?width=1072&format=pjpg&auto=webp&s=077250da52f7bf70f7ddb0e0a9ae5aa9b37299a6",364,2025-11-09 08:11:27
nnwg4eo,1osdp2u,JEENEETards,Bc jab mujhe victory celebration mein jaana tha tab hi kyun downfall ho raha inka...,110,2025-11-09 08:17:46
nnwnv7y,1osdp2u,JEENEETards,https://preview.redd.it/hfr7j72nb70g1.jpeg?width=960&format=pjpg&auto=webp&s=1b801f5a32ca45c5853bdaef96e225b8775ddaa7,107,2025-11-09 09:37:22
nnwj1yk,1osdp2u,JEENEETards,https://preview.redd.it/ofgh1a9v270g1.png?width=1080&format=png&auto=webp&s=b2a3a9533bfafc4864314c9bd7d2b13bedf2b2fc,68,2025-11-09 08:47:45
nnwhew6,1osdp2u,JEENEETards,"Fiitjee xhud gaya, allen bhi xhud raha hai, pw kaab xhudega 🥀",46,2025-11-09 08:30:48
nnwkxuw,1osdp2u,JEENEETards,"https://i.redd.it/4ym626ab670g1.gif

Are lala expansion kar rahe hai wo log .

Allen is Eternal .

Kuch nahi bigdega unka ..",32,2025-11-09 09:07:03
nnxxjcv,1osdp2u,JEENEETards,https://preview.redd.it/ulinb6to190g1.jpeg?width=640&format=pjpg&auto=webp&s=9b7803ad550240da122fb25a512fd542ce68cdaa,16,2025-11-09 15:24:44
nnwkl0y,1osdp2u,JEENEETards,Motion bots on there way 🥸,14,2025-11-09 09:03:22
nnwnfsn,1osdp2u,JEENEETards,Bas meri Test Series finish ho jaane do Advanced tak. Phir ALLEN k हड्डियों से डांडिया खेलूंगा और उसके अस्थिओं से पूरा सुब  दन्त मंजन करेगा,14,2025-11-09 09:32:55
nnx0er0,1osdp2u,JEENEETards,"A diddy to Allen

https://preview.redd.it/15to4e85y70g1.jpeg?width=1080&format=pjpg&auto=webp&s=44cf11531f45168272d1ecc9ec8c966b867810fb",10,2025-11-09 11:43:03
nnwml9i,1osdp2u,JEENEETards,"https://preview.redd.it/bet5cvic970g1.png?width=1200&format=png&auto=webp&s=f76e567de6e23af75011c31f96165eb1ff79e436

😍💪😈",8,2025-11-09 09:24:05
nnwvmrg,1osdp2u,JEENEETards,Bhai aj hain kal firse dhanda chalu ho jayega. Ab hum downfall ke baad revival dekhne se pehle thik se select ho jaye toh acha hain,8,2025-11-09 10:56:33
nnwoq89,1osdp2u,JEENEETards,yeh Industry ka 'Don' the na? Teachers ko nacha dete the?,5,2025-11-09 09:46:22
nnwlf3d,1osdp2u,JEENEETards,"i swear this is like watching a glitchy old TV on a bad signaljust keep your fingers away and watch the whole thing fall apart, lol",3,2025-11-09 09:12:02
nnwq80r,1osdp2u,JEENEETards,https://preview.redd.it/xseibpv2g70g1.jpeg?width=652&format=pjpg&auto=webp&s=5415fc53f2eb4be7a60a418841b9ab55804415a6,3,2025-11-09 10:01:48
nnxkzne,1osdp2u,JEENEETards,Not this kinda person but personally happy on this,4,2025-11-09 14:13:08
nnwv9ev,1osdp2u,JEENEETards,Quality better than all institutes btw,2,2025-11-09 10:52:51
nnwobq3,1osdp2u,JEENEETards,K/D ratio,1,2025-11-09 09:42:13
mrdb5vn,1ki9x86,JEENEETards,Power of eye eye tea aluminium and agent 247 ![img](emote|t5_311ttu|52289),359,2025-05-09 04:41:37
mrdak12,1ki9x86,JEENEETards,https://preview.redd.it/d2xeu2vbqoze1.png?width=1080&format=png&auto=webp&s=a06683be699f83d9954e75ca0d739ee3547e5826,261,2025-05-09 04:36:39
mrdbxx8,1ki9x86,JEENEETards,Papa alecc daddy ne war rukwa di papa,102,2025-05-09 04:48:06
mrdbqre,1ki9x86,JEENEETards,bhai in reality it would be great ki war ruk jaaye and advanced ho jaaye,75,2025-05-09 04:46:27
mrddw6i,1ki9x86,JEENEETards,|cinema|,43,2025-05-09 05:04:31
mrdca7u,1ki9x86,JEENEETards,The chances of this happening is more than actual advance being postponed isi liye hopium chodo aur padh lo sab,36,2025-05-09 04:50:56
mrda20t,1ki9x86,JEENEETards,Je Baat ![img](emote|t5_311ttu|32180),21,2025-05-09 04:32:35
mrdh1ux,1ki9x86,JEENEETards,"Alecc Daddy ne war rukwa di papa

https://preview.redd.it/c0dx9su50pze1.jpeg?width=828&format=pjpg&auto=webp&s=9742f44482691eb1caa9e760d07641017879eb06",19,2025-05-09 05:31:42
mrde8p4,1ki9x86,JEENEETards,IIT ne war rukwa di papa,13,2025-05-09 05:07:33
