comment_id,post_id,subreddit,body,score,created_utc
mfycsyo,1j30pyn,JEENEETards,"Bhai everywhere I go i saw this...

aside from joke.... WHAT ABOUT THIS COLLEGE..... IS THIS GOOD...OR... JUST FOR TROLL..?( Seriously puch raha hu![img](emote|t5_311ttu|30367))",1,2025-03-04 13:06:42
mfyeo3p,1j30pyn,JEENEETards,Can someone explain the meme/?,1,2025-03-04 13:18:25
hn1m8rg,r7tk5y,JEENEETards,how the turns have tabled,590,2021-12-03 08:06:35
hn1myzc,r7tk5y,JEENEETards,"Fuck, bachpan me iska bohot mazak udaya, ab vohi mujh par beet rahi hai, lagta hai science ka tha yeh bhi",247,2021-12-03 08:16:21
hn1l162,r7tk5y,JEENEETards,Yondro,188,2021-12-03 07:50:32
hn1nih0,r7tk5y,JEENEETards,"Being a dropper, i feel so sorry that i laughed at him.",126,2021-12-03 08:23:36
hn1ozam,r7tk5y,JEENEETards,Also the guy in Kiteretsu who wore white circular glasses jo kata hua pyaaz jaisa dikhta tha,123,2021-12-03 08:43:29
hn1ls8s,r7tk5y,JEENEETards,"Yonro, mera maafi naama sweekar kijie",78,2021-12-03 08:00:29
hn1mop2,r7tk5y,JEENEETards,Now we are yondro,72,2021-12-03 08:12:29
hn1po52,r7tk5y,JEENEETards,This portrays that it's not just india where students have to suffer like us,74,2021-12-03 08:52:49
hn1szws,r7tk5y,JEENEETards,"he is literally me. sitting in the same fucking room on the same chair reading the same books since march 2020, after passing school. can literally see myself in him. sorry man, i thought of him as a pathetic loser but times changed lol",50,2021-12-03 09:39:33
hn1opbj,r7tk5y,JEENEETards,"I am proud that i NEVER laughed at him. Always sympathised  with him.

Also mandatory thank you to Yoshito Usui for creating Shinchan",30,2021-12-03 08:39:47
hn1z97a,r7tk5y,JEENEETards,Bhaiya books konse use krte ho? PW ki Dropper batch me ho na?,21,2021-12-03 11:07:06
hn1ouus,r7tk5y,JEENEETards,Ek kiteretsu me bhi tha na jo exam nhi clear kar pa rha tha? Kuch relate hua bc?,14,2021-12-03 08:41:51
hn24hlv,r7tk5y,JEENEETards,Bruh iss sub pr sbko personal attack lga h yeh. Oof atleast Yonro dedicated tha humari Tarah reddit nhi chlata rha XD,14,2021-12-03 12:11:58
hn1m6sd,r7tk5y,JEENEETards,yonro,15,2021-12-03 08:05:51
hn1mm02,r7tk5y,JEENEETards,Bruh💀,11,2021-12-03 08:11:31
hn27bj2,r7tk5y,JEENEETards,Atleast he passed his exam in the end,11,2021-12-03 12:42:55
hn1jn69,r7tk5y,JEENEETards,kondro?,8,2021-12-03 07:32:30
hn1y6jn,r7tk5y,JEENEETards,we all grew up from laughing at him to being like him,8,2021-12-03 10:52:41
hn20msb,r7tk5y,JEENEETards,One of the rare memes which are actually good. Well done OP.,7,2021-12-03 11:25:09
ipkj4vp,xlpwvy,JEENEETards,smooth,458,2022-09-23 06:43:47
ipkngdl,xlpwvy,JEENEETards,Samarth gareeb,284,2022-09-23 07:48:15
ipklzmc,xlpwvy,JEENEETards,Chad parag🗿,275,2022-09-23 07:25:21
ipkmume,xlpwvy,JEENEETards,"gaze weary brave fall literate heavy imagine lavish growth lip

 *This post was mass deleted and anonymized with [Redact](https://redact.dev/home)*",77,2022-09-23 07:38:47
ipknjfu,xlpwvy,JEENEETards,14 pro max bhi aa jaayega bhai itne me toh,77,2022-09-23 07:49:33
ipkjgve,xlpwvy,JEENEETards,Wrong where ?,50,2022-09-23 06:48:22
ipkko5a,xlpwvy,JEENEETards,abhi wait kar sid diwali sale ayegi,46,2022-09-23 07:05:25
ipkqo1v,xlpwvy,JEENEETards,Also a one year aakash program T-T,17,2022-09-23 08:39:56
ipkqrzi,xlpwvy,JEENEETards,Instagram wale meme,13,2022-09-23 08:41:40
ipkmepc,xlpwvy,JEENEETards,Parag jain the ultimate chad,9,2022-09-23 07:31:52
ipks6w3,xlpwvy,JEENEETards,KTM bhi mil jayegi.,6,2022-09-23 09:04:22
ipktw1m,xlpwvy,JEENEETards,Ek Rassi aur khurchi bhi mil javegi,5,2022-09-23 09:31:17
ipksc1l,xlpwvy,JEENEETards,"1,60,000 rank pe ""Apple park Institute of technology"" me direct admission milega🤡",4,2022-09-23 09:06:40
ipley71,xlpwvy,JEENEETards,"""Saale, woh rank ki baat kar rha tha""  
\-🤓",2,2022-09-23 13:28:58
ipmm335,xlpwvy,JEENEETards,"pls upvote do, 11th tard kota me ek flaw ke regarding post karna hai

thanks",2,2022-09-23 18:54:01
ipngs05,xlpwvy,JEENEETards,160000 par ek stool or rope milti hai waise,2,2022-09-23 22:44:06
l2dvwh5,xlpwvy,JEENEETards,I'm genuinely crying man,1,2024-05-03 11:58:59
lg4v8tt,xlpwvy,JEENEETards,![img](emote|t5_311ttu|30164)![img](emote|t5_311ttu|49429),1,2024-08-02 13:09:47
jeeu0fx,127m0ac,JEENEETards,This is the one time where I wish OP is actually trolling,1053,2023-03-31 14:30:56
jeevi1o,127m0ac,JEENEETards,हनुमानजी मेरे भाई को जलद से जलद ये बिमारी से जीत दिलाए,654,2023-03-31 14:40:54
jeeqs8g,127m0ac,JEENEETards,get well soon bud!! i’m sure you’ll come out of it stronger than ever❤️‍🩹❤️‍🩹❤️‍🩹,470,2023-03-31 14:08:57
jeeya1v,127m0ac,JEENEETards,"A family friend of ours was also diagnosed with Leukemia in a very similar age. Her father broke down and the whole family was mentally broken. But she was a true fighter,and after a year of battling ,she kicked Leukemia's ass and now she is doing well in her life. 
I am sure you are gonna kick the shit out of that motherfucker leukemia. You got this👑👑",449,2023-03-31 14:59:19
jfm0i98,127m0ac,JEENEETards,Update: u/thewickedkarma is no longer with us. Jee is indeed not everything.,134,2023-04-09 20:10:41
jeeqi8n,127m0ac,JEENEETards,"Get well soon buddy! ""जीतेंगे definitely""",115,2023-03-31 14:07:01
jeequnq,127m0ac,JEENEETards,"Sorry to hear, please take care of yourself.
Hope you recover <3",109,2023-03-31 14:09:25
jeeusgd,127m0ac,JEENEETards,"are bhai jeetard ko kuch nhi hota....

apna dhyaan rakhna or fight marna jaise marta aya h bas",102,2023-03-31 14:36:10
jeey5ie,127m0ac,JEENEETards,PS - [His Story + Donation Link](https://www.reddit.com/r/Charity/comments/124t2ty/help_me_with_fundraising_for_my_blood_cancer/),105,2023-03-31 14:58:30
jeetqo7,127m0ac,JEENEETards,"Fuck jee bro rest le exam toh aate rhynege
Get well soon buddy",65,2023-03-31 14:29:06
jeermwn,127m0ac,JEENEETards,Bro which stage? Hopefully 1,45,2023-03-31 14:14:51
jeeulmm,127m0ac,JEENEETards,"Nooooo

![gif](giphy|QMlktVzeDRkH5qqKpJ)

Come on mate, you'll beat it! We're all with you! 🙏",46,2023-03-31 14:34:55
jeeucyp,127m0ac,JEENEETards,Maachudaye cancer bc,43,2023-03-31 14:33:18
jeeuwad,127m0ac,JEENEETards,r/fuckcancer get well soon,41,2023-03-31 14:36:51
jef1wuw,127m0ac,JEENEETards,"Roman Reign ko bhi tha,Aaj wo biggest superstar ha

Tu bhi banjayega,recover kar",31,2023-03-31 15:23:11
jeertnh,127m0ac,JEENEETards,Subah jaldi utha Karo sab thik hojayega,30,2023-03-31 14:16:06
jeequ4c,127m0ac,JEENEETards,Get well soon buddy !!!! Hope You defeat it,26,2023-03-31 14:09:18
kc8u30f,127m0ac,JEENEETards,"i come back here every once in a while to remind myself that my life isnt in my hands, and to appreciate the small things. i lost a friend this year to leukemia too.",26,2023-12-06 16:39:43
jeexo0h,127m0ac,JEENEETards,"If its legit than get well soon..
You got this


And i hope somewhere it's an April's fool joke

 Edit : sorry bhai i got to know that you're really going through this my prayers are with you 🙏",27,2023-03-31 14:55:16
jm9agtz,13w1zit,JEENEETards,"kitna jalaoge bhencho, thode din mai kuch log apna advance ka result flex karenge smh",1011,2023-05-30 21:43:48
jm9kmd0,13w1zit,JEENEETards,"firstly congratulations 

&#x200B;

secondly, roughly, what does it actually take to make it to harvard ? just curious.",371,2023-05-30 22:53:27
jma0j56,13w1zit,JEENEETards,"bro harvard jaake avanti nagral jaise mat banna, btw congrats",231,2023-05-31 00:49:25
jm9g0gy,13w1zit,JEENEETards,"Crazy man , saw your post history ... Luckiest mf alive Ong (I mean u did have achievements and had put in a lot of work... But Harvard is accepting and on top of that financial aid too)",231,2023-05-30 22:21:31
jma7r7z,13w1zit,JEENEETards,Bhaisaab log Harvard phod rhe hai or Mai chutiyon ki Tarah Bartha hoon,140,2023-05-31 01:44:01
jmaie0z,13w1zit,JEENEETards,"Congratulations,  you have been employed as akhand bharat agent  . We suggest you to infiltrate a big corporate as their ceo  ( Nvidia or coca cola ) and share their information like our greatest agent sundar .",127,2023-05-31 03:08:50
jm96lsj,13w1zit,JEENEETards,"Hearty congrats, kisi tarike se agar amrika jaana hua to milenge!",91,2023-05-30 21:17:52
jm95bgq,13w1zit,JEENEETards,Damnnn congrats bhai![img](emote|t5_311ttu|30367),68,2023-05-30 21:09:07
jm95id7,13w1zit,JEENEETards,Baap ke paas bahut paisa hai,61,2023-05-30 21:10:24
jm9ajxi,13w1zit,JEENEETards,Can you share your qualifications or resume? Congrats btw,32,2023-05-30 21:44:24
jm9bm9w,13w1zit,JEENEETards,mudi ji says kongrats.,28,2023-05-30 21:51:31
jmanbbp,13w1zit,JEENEETards,"Bhay ye Harvard kya hai aur isme mei kitna Paisa pdta hai, ye Dilli mei he haina?",29,2023-05-31 03:51:47
jm9ae63,13w1zit,JEENEETards,Congratulations...btw 2027 kyu?,28,2023-05-30 21:43:19
jm9xbky,13w1zit,JEENEETards,I don't know why but I'm pheeling proud of my fellow jeetard.,16,2023-05-31 00:25:36
jm9pq79,13w1zit,JEENEETards,Congratulations Harvatard ![img](emote|t5_311ttu|30180),8,2023-05-30 23:29:56
jmagsms,13w1zit,JEENEETards,Did you give jee if yes how much did you score??,10,2023-05-31 02:55:36
jm975f8,13w1zit,JEENEETards,Congrats on Hardward bhai ![img](emote|t5_311ttu|30367),8,2023-05-30 21:21:31
jmaz2up,13w1zit,JEENEETards,Bro says AMA and ghosts us in the comment section😒,7,2023-05-31 05:53:04
ibpizvr,v8bcs4,JEENEETards,Bc itne mera aa gaya toh sehar k har gareeb ko khana khilaunga.... 4 baar,396,2022-06-09 07:59:00
ibpldrb,v8bcs4,JEENEETards,NoT bAd SuNiTa,394,2022-06-09 08:37:01
ibplace,v8bcs4,JEENEETards,"Chalo koi na sunita, drop lelo.",391,2022-06-09 08:35:32
ibpn69l,v8bcs4,JEENEETards,I don't like Sunita,119,2022-06-09 09:05:38
ibpjuz0,v8bcs4,JEENEETards,Mere agar 80% aagae to me to party dunga sab dosto ko 🗿,101,2022-06-09 08:12:46
ibpkibr,v8bcs4,JEENEETards,"I hate these kind of people.




Like wtf man.




What are you expecting 100%",92,2022-06-09 08:23:15
ibplrrf,v8bcs4,JEENEETards,Randi Rona nahi karenge to thumbnail aur views kaha se milenge...,85,2022-06-09 08:43:12
ibpmmo5,v8bcs4,JEENEETards,acting dekho chai ka cup fekna ka man kar raha hai,86,2022-06-09 08:56:56
ibpmc9r,v8bcs4,JEENEETards,"Bc 96.8% aaya hai aur itne asaan calculation ke liye calculator use kar rhi hai

women☕",62,2022-06-09 08:52:15
ibq6m1s,v8bcs4,JEENEETards,"Lol I remember my sister crying after getting 94 percent in 12 boards but fell short by 2-3 percent of the cutoff of her dream college, she was crying so bad and i was not able to stop my laugh and was trashed by everyone for that lol.",57,2022-06-09 13:01:49
ibpmdgi,v8bcs4,JEENEETards,Agar mereko itna miljaye boards mei toh I would post my nsfw materials 🥵,51,2022-06-09 08:52:48
ibprhpm,v8bcs4,JEENEETards,"The fact that ye ladki covid batch ki hai makes its even more funnier.. 
Sala exam diya nahi aur 96.8 percent ayee, aur agar exam diya hota then it would have been 69.8 percent. 
No disrespect to all womens but no respect to covid batch too so 




Ye lo L",47,2022-06-09 10:11:27
ibpikh9,v8bcs4,JEENEETards,Women ☕,28,2022-06-09 07:52:17
ibplpvo,v8bcs4,JEENEETards,bhai jab me 10th me tah to itne calculation kiye the result ke pehle ki 456 dekh ke 1 sec me pta chal gya ki 91.2 aya hai,9,2022-06-09 08:42:22
ibpklov,v8bcs4,JEENEETards,percentile hogi?,6,2022-06-09 08:24:47
ibptkso,v8bcs4,JEENEETards,"96.8% aaye hai aur ye calculate karne ke liye calculator use karna pad raha hai. Kisi kaam ke nhi hai 96.8%.

also Women☕",6,2022-06-09 10:40:45
ibpnaj4,v8bcs4,JEENEETards,Kuch college ka cutoff 100% hota hai for general category. can understand her reaction,6,2022-06-09 09:07:30
ibpl4ft,v8bcs4,JEENEETards,ye last wala template share krna bro,3,2022-06-09 08:32:59
le6rps8,1e8f1vc,JEENEETards,"If you feel like this Post violates the subreddit [rules](https://www.reddit.com/r/JEENEETards/about/rules).

Feel free to report it using the 3 dots or tag any active moderator for removing this post.

Learn how to report any post [here](https://www.reddit.com/r/JEENEETards/comments/1d9ac4i/comment/l7c1q08/)

*I am a bot, and this action was performed automatically. Please [contact the moderators of this subreddit](/message/compose/?to=/r/JEENEETards) if you have any questions or concerns.*",1,2024-07-21 05:28:21
le6wabm,1e8f1vc,JEENEETards,rare indian media W,720,2024-07-21 06:15:31
le6svmn,1e8f1vc,JEENEETards,"R Prasad is a menance 💀

Lmao 🤣",323,2024-07-21 05:40:02
le6x1qe,1e8f1vc,JEENEETards,""" pdf milegi? ""

*get's the hardcopy*",269,2024-07-21 06:23:36
le6xadd,1e8f1vc,JEENEETards,From PYQs to CYQs lmao,114,2024-07-21 06:26:11
le6xkg8,1e8f1vc,JEENEETards,"Nobody:- jain Saab to government

https://preview.redd.it/s2tda7y8gtdd1.jpeg?width=1080&format=pjpg&auto=webp&s=67e769cb80df60c52b6a039c9d957539247a79aa",99,2024-07-21 06:29:10
le6tqcc,1e8f1vc,JEENEETards,"Sanjeev Raj jain,Woke up and Chose VIOLENCE!!!🙌🏻🔥",84,2024-07-21 05:48:49
le6tw5j,1e8f1vc,JEENEETards,Out of 42069 languages bro chose to speak facts 🗣️🗣️🔥‼️‼️,51,2024-07-21 05:50:26
le6v2ft,1e8f1vc,JEENEETards,2025 canon event ![img](emote|t5_311ttu|32180),30,2024-07-21 06:02:37
le6tgxo,1e8f1vc,JEENEETards,Lmao,24,2024-07-21 05:46:07
le6v7o5,1e8f1vc,JEENEETards,just one of topper's many secrets /s,23,2024-07-21 06:04:08
le6xeqx,1e8f1vc,JEENEETards,https://preview.redd.it/k658kyyxftdd1.jpeg?width=706&format=pjpg&auto=webp&s=e661156c57690d67cb4f8839f01e85ae7675aa76,21,2024-07-21 06:27:29
le733k1,1e8f1vc,JEENEETards,https://preview.redd.it/x4ss4ny1rtdd1.jpeg?width=1080&format=pjpg&auto=webp&s=8d19557c40414142c405bc24868d94b3ac729c05,20,2024-07-21 07:29:48
le6yhcx,1e8f1vc,JEENEETards,"https://preview.redd.it/ui3k85w0itdd1.jpeg?width=1170&format=pjpg&auto=webp&s=b7c7ae4544a323e583479bfd36f421fc35ea7779

bro cooked",8,2024-07-21 06:39:08
le6w9pl,1e8f1vc,JEENEETards,Exactly! Its so simple!![img](emote|t5_311ttu|50130),6,2024-07-21 06:15:20
le6xcdf,1e8f1vc,JEENEETards,The perfect representation of overthinking.,5,2024-07-21 06:26:47
le71lzo,1e8f1vc,JEENEETards,bro cooked a mischelin star meal![img](emote|t5_311ttu|49455),5,2024-07-21 07:13:03
le95s9q,1e8f1vc,JEENEETards,"2026 aspirants watching this ![img](emote|t5_311ttu|50130)![img](emote|t5_311ttu|30176)

https://preview.redd.it/69zpbfrdqwdd1.jpeg?width=1080&format=pjpg&auto=webp&s=406ea02879ac9814b27485d41f31926df8eef767",6,2024-07-21 17:31:20
le6xoae,1e8f1vc,JEENEETards,Bro cooked so hard that imma cum,4,2024-07-21 06:30:22
irduzwc,xxsvxm,JEENEETards,Meko toh 12th mei bhi 92 aa gye par bencho mains bhi qualify nhi kiya,315,2022-10-07 08:55:16
irdvyx0,xxsvxm,JEENEETards,"Nigga dont think of yourself as some  fucking genius whose rejecting the ratrace. You are a midwit(100-110)IQ at best nigga. If you think mugging  NCERT has any affect on JEE you are a genuine fucking retard. Jee's theory question is highly conceptual and need high level books not NCERT. 
What according to u is life? Fapping 9 hours to tentacle hentai and blowing your dads money on gayming PC?
You will prolly end up doing IT coolie job for 3 LPA. Tub dekhenge who has life. Im IIT G CSE 2nd year student btw. I will end up working in google or amazon or even starting my own startup while you will be a bottom feeder leach. I will pay more in tax than you will earn in 5 years. Have fun eating shit retard",111,2022-10-07 09:11:27
irdz3km,xxsvxm,JEENEETards,Mai to tenth me 88% (12th me 89%(technically 91%)) aaye aur abhi IIT Jaa rha hoon 🗿🗿,72,2022-10-07 10:01:12
irdvo46,xxsvxm,JEENEETards,bhai mere me to 75% hai 10th me,71,2022-10-07 09:06:36
ire7dvc,xxsvxm,JEENEETards,bruh purani id ka password bhul gaya.......new banayi......karma dedo,41,2022-10-07 11:49:46
irdrx7z,xxsvxm,JEENEETards,Lmao true,26,2022-10-07 08:03:24
irf319m,xxsvxm,JEENEETards,"Na 10th mei 90% aaye, Na 12th mei. JEE mei 1 lakh paar rank aayi. I am a software engineer in Google right now.",17,2022-10-07 16:14:22
ire5y1e,xxsvxm,JEENEETards,Science and commerce students when they think competition in humanities is very less:,5,2022-10-07 11:33:26
ired2n9,xxsvxm,JEENEETards,98 to 89 to Drop(s) = Clown,7,2022-10-07 12:47:52
iredka8,xxsvxm,JEENEETards,#weakest wolf gupta,5,2022-10-07 12:52:22
iretmw3,xxsvxm,JEENEETards,Quota walo pe laagu nhi hota,3,2022-10-07 15:03:44
ire1f7v,xxsvxm,JEENEETards,u/savevideo,1,2022-10-07 10:35:02
irevle8,xxsvxm,JEENEETards,"10th mei 98.6%
12th mei 97%

Fir Bhi Adv Qualify nhi hua💀",1,2022-10-07 15:18:33
lo8g3wc,xxsvxm,JEENEETards,lmfao the delusion be real.,1,2024-09-21 17:06:35
mkdmd9m,xxsvxm,JEENEETards,u/savevideo,1,2025-03-29 16:37:38
ire1dz9,xxsvxm,JEENEETards,Sad,1,2022-10-07 10:34:32
ire4byu,xxsvxm,JEENEETards,Mera dost toh clown nikla,1,2022-10-07 11:13:30
ire5bqr,xxsvxm,JEENEETards,u/savevideobot,1,2022-10-07 11:25:56
lm2sewe,1fbrq78,JEENEETards,"If you feel like this Post violates the subreddit [rules](https://www.reddit.com/r/JEENEETards/about/rules).

Feel free to report it using the 3 dots or tag any active moderator for removing this post.

Learn how to report any post [here](https://www.reddit.com/r/JEENEETards/comments/1d9ac4i/comment/l7c1q08/)

*I am a bot, and this action was performed automatically. Please [contact the moderators of this subreddit](/message/compose/?to=/r/JEENEETards) if you have any questions or concerns.*",1,2024-09-08 06:53:10
lm2u61g,1fbrq78,JEENEETards,Imagine Walter Lewin himself had to reply that IIT dickrider ![img](emote|t5_311ttu|32179) second hand embarrassment,1972,2024-09-08 07:11:52
lm2telf,1fbrq78,JEENEETards,Ese bkl kuch padhte bhi nai he bas baate banate or science liye he to superiority complex he,459,2024-09-08 07:03:52
lm2vham,1fbrq78,JEENEETards,Yaar Walter Lewin sir se puri desh ki beizzati karwadi iss bsdwale ne![img](emote|t5_311ttu|53370)![img](emote|t5_311ttu|53370),347,2024-09-08 07:26:07
lm2xhue,1fbrq78,JEENEETards,"ha bc toh 2nd year in highschool mai isko padke kya ukaad liya, aisa bol raha hai ki poora desh ka education top notch hai but reality mai concept sai zyada pyq karne mai baith the hai",304,2024-09-08 07:48:10
lm2v3uq,1fbrq78,JEENEETards,Walter Lewin when 26tard![img](emote|t5_311ttu|49429)![img](emote|t5_311ttu|32179)![img](emote|t5_311ttu|50067)![img](emote|t5_311ttu|53370),296,2024-09-08 07:22:02
lm2zeug,1fbrq78,JEENEETards,"https://preview.redd.it/bozn4nknmjnd1.jpeg?width=320&format=pjpg&auto=webp&s=ffd062a3dfbb5f6d40e154416ccc33c3552a3d7d

Internationally bezzati kr rha h bkl",183,2024-09-08 08:08:58
lm2ywxq,1fbrq78,JEENEETards,"I'm legit tired of seeing these type of comments ""we studied this in India when we were 2 years old"" just stfu. Nobody cares.",164,2024-09-08 08:03:36
lm2x3vu,1fbrq78,JEENEETards,"Wow. That's 98 more than all the IITs combined. 
Probably because MIT doesn't have 60-70 percent reservations.",145,2024-09-08 07:43:48
lm2zzdd,1fbrq78,JEENEETards,https://preview.redd.it/dq6odedunjnd1.jpeg?width=412&format=pjpg&auto=webp&s=f2ecdeb850a3b032c8136c979d49cba43cf22a11,109,2024-09-08 08:15:16
lm2xtjv,1fbrq78,JEENEETards,IIT'S bhi bs 98 piche hai🤓,93,2024-09-08 07:51:51
lm32yp3,1fbrq78,JEENEETards,"I have an neighbor who's an IITian ,currently working in a major US company, I talked to the guy for a week and never did he mention that he was an IIT graduate. 
I don't know what these scums on internet think of themselves by embarrassing us",77,2024-09-08 08:47:56
lm2ygpb,1fbrq78,JEENEETards,"https://preview.redd.it/psx35ymwkjnd1.png?width=720&format=pjpg&auto=webp&s=3b2741baf21d757ecccbb8089bf005bf16d56e5c

Just for fun",71,2024-09-08 07:58:49
lm2xtug,1fbrq78,JEENEETards,no wonder why world hates indians so much,55,2024-09-08 07:51:56
lm363j6,1fbrq78,JEENEETards,"I am still studying linear algebra which I encountered first in 12th , now I am in masters second year at iisc. The point is that these things get deeper and deeper with more you know. So first encounter with a concept is not a badge of knowing it completely.",50,2024-09-08 09:23:20
lm2zslo,1fbrq78,JEENEETards,"they learn for exploring the subject, we learn to get into AYE AYE TE bumbay, alumni power![img](emote|t5_311ttu|32180), hookah bar ![img](emote|t5_311ttu|50130)",31,2024-09-08 08:13:08
lm2yv6a,1fbrq78,JEENEETards,"When I first read this comment a year ago, I was so embarrassed, I wanted to dig a hole and bury myself in it",31,2024-09-08 08:03:05
lm2z6vf,1fbrq78,JEENEETards,So our education system sucks so much that even though we are ahead of their curriculum still the brightest minds come from MIT and not IIT?,21,2024-09-08 08:06:39
lm2zxyb,1fbrq78,JEENEETards,Aise hi bkl desh ka naam duba rahe hai har jagah ![img](emote|t5_311ttu|53370)![img](emote|t5_311ttu|53370)![img](emote|t5_311ttu|53370),17,2024-09-08 08:14:48
lqhprvb,1fwwhse,JEENEETards,"If you feel like this Post violates the subreddit [rules](https://www.reddit.com/r/JEENEETards/about/rules).

Feel free to report it using the 3 dots or tag any active moderator for removing this post.

Learn how to report any post [here](https://www.reddit.com/r/JEENEETards/comments/1d9ac4i/comment/l7c1q08/)

*I am a bot, and this action was performed automatically. Please [contact the moderators of this subreddit](/message/compose/?to=/r/JEENEETards) if you have any questions or concerns.*",1,2024-10-05 18:08:30
lqhrnw6,1fwwhse,JEENEETards,https://preview.redd.it/z204vq34czsd1.png?width=235&format=png&auto=webp&s=6cb371e93529378f5fca1b6ecc1b9e1c7a20b88a,485,2024-10-05 18:18:43
lqhra9k,1fwwhse,JEENEETards,Ye cis tales ki meme h ky lgta wo konse clg me h,150,2024-10-05 18:16:41
lqht05b,1fwwhse,JEENEETards,joke's on you I HAVE BOTH,137,2024-10-05 18:25:51
lqhzobe,1fwwhse,JEENEETards,This guy thinks Allen students are getting dates ![img](emote|t5_311ttu|49466)![img](emote|t5_311ttu|49466)![img](emote|t5_311ttu|49466)![img](emote|t5_311ttu|49466),131,2024-10-05 19:01:33
lqhwsr9,1fwwhse,JEENEETards,https://preview.redd.it/uvfrrfxygzsd1.png?width=1024&format=png&auto=webp&s=94710768be4bee62dbb226ec79bc599f5e3a25a8,84,2024-10-05 18:46:06
lqhxyk5,1fwwhse,JEENEETards,https://preview.redd.it/em73b3v3izsd1.jpeg?width=512&format=pjpg&auto=webp&s=59ac41732e37869381ca5045e2c298a7ea30dbd8,62,2024-10-05 18:52:19
lqhtfkz,1fwwhse,JEENEETards,https://preview.redd.it/zkqfdursdzsd1.png?width=467&format=pjpg&auto=webp&s=7d856dd4c1258ec52de01dda4ef8a8da580afd66,55,2024-10-05 18:28:09
lqi4i8z,1fwwhse,JEENEETards,https://preview.redd.it/5tbbxtxdozsd1.png?width=416&format=png&auto=webp&s=0a95dd682ea5343bc0e314bddce9f7dd3e34c04d,32,2024-10-05 19:27:30
lqkocrm,1fwwhse,JEENEETards,"https://preview.redd.it/c9x3e4g1k2td1.png?width=899&format=png&auto=webp&s=30b4de79f7d3dcb3fb777253007b102e4383ee0c

Le meri shirt zyada mehengi hai![img](emote|t5_311ttu|53370)![img](emote|t5_311ttu|53370)",29,2024-10-06 05:09:01
lqi93lv,1fwwhse,JEENEETards,Alecc daddy used t shirt 🥵🥵>>>>>>>>>,17,2024-10-05 19:52:17
lqkupqv,1fwwhse,JEENEETards,Imagine going on a date and the girl criticises you for not having a Netflix/Amazon prime subscription  but you're still smiling cuz you  have a 1 lac subscription for a year on Allen App  ![img](emote|t5_311ttu|30367),12,2024-10-06 06:10:20
lqij3b6,1fwwhse,JEENEETards,"1.2L ki Tshirt pehen lu, fir agle saal 4k ke notepad bhi lene hai",8,2024-10-05 20:46:23
lql7rmp,1fwwhse,JEENEETards,"Sala main ye meme Allen ki tshirt pehen kar dekh raha hu

https://preview.redd.it/t05ieojhk3td1.jpeg?width=2160&format=pjpg&auto=webp&s=e2798923a693928dbcc59714c19fdec5a799d5cc

Aur mera toh aaj round 2 councelling ka result h bc![img](emote|t5_311ttu|32180)![img](emote|t5_311ttu|32193)![img](emote|t5_311ttu|32193)![img](emote|t5_311ttu|32193)![img](emote|t5_311ttu|32193)![img](emote|t5_311ttu|30176)",5,2024-10-06 08:32:48
lqjuoq8,1fwwhse,JEENEETards,https://preview.redd.it/fc5zc2pvg1td1.png?width=320&format=pjpg&auto=webp&s=b451e1015e002674c951c7e0eac18c541b62d3c7,4,2024-10-06 01:28:59
lqkc94p,1fwwhse,JEENEETards,T shirt free ki hai 120k padhai ke hai,5,2024-10-06 03:30:39
lqkt9rl,1fwwhse,JEENEETards,"1,20,000 ek saal ka hein ya 2",3,2024-10-06 05:55:42
lqkcgrh,1fwwhse,JEENEETards,Bold of you to assume,2,2024-10-06 03:32:09
lqlfzfi,1fwwhse,JEENEETards,Ye dress pehen ne wali ladki kabhi dost tak nhi bani,2,2024-10-06 10:08:18
mfrevtn,1j2fxvc,JEENEETards,"If you feel like this Post violates the subreddit [rules](https://www.reddit.com/r/JEENEETards/about/rules).

Feel free to report it using the 3 dots or tag any active moderator for removing this post.

Learn how to report any post [here](https://www.reddit.com/r/JEENEETards/comments/1d9ac4i/comment/l7c1q08/)

*I am a bot, and this action was performed automatically. Please [contact the moderators of this subreddit](/message/compose/?to=/r/JEENEETards) if you have any questions or concerns.*",1,2025-03-03 10:44:00
mfrfanc,1j2fxvc,JEENEETards,"As a fellow Reyansh , I can confirm what he has spoken is a 100% fax 🗣️🔥",639,2025-03-03 10:48:07
mfrfe4b,1j2fxvc,JEENEETards,"As a ex- reyanshite , I'm currently working in Amazon Sales department....


( Chaprasi hu )",260,2025-03-03 10:49:05
mfrftqn,1j2fxvc,JEENEETards,Reyansh college aluminium >>>>> IIT boomba  aluminium,220,2025-03-03 10:53:24
mfrfv2f,1j2fxvc,JEENEETards,the R in renyansh college stands for reyansh. hence he is spitting fax,169,2025-03-03 10:53:46
mfrg6eo,1j2fxvc,JEENEETards,Air 100 mei isko reyand college of hotel management milgaya.....quota hoga,97,2025-03-03 10:56:54
mfrh7w6,1j2fxvc,JEENEETards,Sarasar jhoot hai. Air 100 pe reyansh college ka cutoff clear hi nahi hota,57,2025-03-03 11:07:09
mfrfk45,1j2fxvc,JEENEETards,"Reyansh college is tru lub 
How did you even think of comparing iit b with Reyansh college😡😡😡😡😡😡😡🤬🤬
Atleast I will use bottle flipping technique to impress my crush🎀🎀🎀",39,2025-03-03 10:50:45
mfrfu58,1j2fxvc,JEENEETards,as a Reyansh College alumni i can confirm he made a right worthy decision,26,2025-03-03 10:53:30
