comment_id,post_id,subreddit,body,score,created_utc
o7chavp,1regb93,JEENEETards,"Frr who tf starts studying for this shit that early...the only proper way to get a decent to good college no matter the exam is 11th class...just lock in for 2-3 years of ur life and thats good...ik that system also sucks but it's best way to actually have a life but also being good in academics...

But most of the time people who start that early isnt their own decisions...the parents and relatives are the ones doing this shit...lets hope that the next gen dont end up like them",39,2026-02-25 16:04:14
o7ctc1t,1regb93,JEENEETards,"People need to realize we don't criticize the toppers (maybe some do, but they are idiots so ignore them)


We criticize what toppers represent, the system behind all of it.


You got children not even in 6th std who preparing a competition 6 years later, sure some of them top, some get decentish marks but qualify. Did they sacrifice their childhood? Probably, but it doesn't matter (in most cases) as their future is secure now.



But no one talks about children who fail in this system, they are too thousands and thousands of them who got robbed of their childhood and still get nothing in return.



I personally know one such person, gone to Kota since 6th, burned out in 10th, didn't even qualify jee. And the most sad part is, this guy could actually have achieved it if he went normal 11th and 12th way.



Just my 2 cents....",23,2026-02-25 16:58:51
o7cej7l,1regb93,JEENEETards,"Plus like yaar jee mains and NEET and Advanced is very HIGH LEVEL for very BAD colleges. IITs don't even rank top 10 yet it's easier to get into harvard than IITs

Edit :
SATs ke cutoff se jyada cheezei lagti hai ik but but but Boht se jo bachhe IITs nikalte ho vo unn cheezo ko already kar chuke hote hai like competetive exam credibility and yk Good CGPA etc etc Bas Essay bachta hai i think jitna rigour ye Advanced me laga rahe utna essay me laga de mahina bhar toh Boht badhiya nikal ke ayega.",20,2026-02-25 15:51:39
o7ci6el,1regb93,JEENEETards,Honestly it's good if they are genuinely interested in pcm for such students jee coaching is actually a boon. Haan if they aren't interested but forced by parents then it gets problematic,12,2026-02-25 16:08:15
o7cs6gg,1regb93,JEENEETards,Few ppl from telugu states start it from 6th grade,12,2026-02-25 16:53:35
o7ckysa,1regb93,JEENEETards,It's just a rat race bro,9,2026-02-25 16:20:55
o7ffuvl,1regb93,JEENEETards,"https://preview.redd.it/6x7x5u4xhqlg1.png?width=200&format=png&auto=webp&s=10260465710ce5768da5d1065b99fe2374973adc

Mujhe toh 6th class se hi FIITJEE bhej diya tha mere mammi papa ne. Ho gya ghee khatam   
",9,2026-02-26 00:32:48
o7coc9g,1regb93,JEENEETards,"I am about to write about this in my college newsletter. Drop in some points you would want me to cover there.

Please don;t make it anti-system or anti-coachings pls.",6,2026-02-25 16:36:13
o7jkgv9,1regb93,JEENEETards,It's not a systematic failure. It's a population control failure.,7,2026-02-26 16:55:55
o7cgm1k,1regb93,JEENEETards,My biggest guilt is that i didn't prepared for jee from 8th-9th,2,2026-02-25 16:01:03
o7cr70o,1regb93,JEENEETards,"not everyone have privileges or strong financial background so they can't take a risk to follow their passion they need to earn something before following their passion 

ab only education is easy way to earn money as a middle class ab ye bata agar koi apna passion or buisness kholenge usme paise lagte hai aur usme bhi successful ho uski probability kam aahe as compared to education education me atleast probability toh jyada hai ki kisi chiz me lagjayga

lekin pressurize karna ye galt bat hai",4,2026-02-25 16:49:07
o7gbgq7,1regb93,JEENEETards,Class 7th se le raha hun bhaai...kitne tane mare the yaad bhi nahi ...agar tabiyat kharap ho jati thi fir bhi...le jate the class miss nah ho during Covid mere fever aye huyee the fir bhi online class karne k liye force karte the,4,2026-02-26 03:33:25
o7gtzg6,1regb93,JEENEETards,"It’s not about starting early, it’s about why you had to start early.......",3,2026-02-26 05:39:33
o7ck2sb,1regb93,JEENEETards,"In ninth currently. I'm a FIITJEE victim rn, and tbh, I agree w OP, but then college toh milna padega. So its better to just start the prep early, and try to crack JEE, and follow the crazy system.  
Although FIITJEE is shit and doesn't help much :DDD",2,2026-02-25 16:16:52
o7cluua,1regb93,JEENEETards,"Mujhe to nda karna tha lekin gharwalo ne mana kar diya 
(Unhe lagta hai sabko karodo ka package milta hai 🤡)
Mana karne ka reason tha bahar bohot Paisa hai government job ke liye mat try kar nahi to gareeb reh jayega (lmao) and the hypocrisy ki B tech ke baad IAS ke liye bhi try kar (Apparently ek baar sabko try karna chahiye I'm so done with this bs) then out of anger I said ki arts lelu fir, dimaag kharab mat karo mera and then they said to me behes mat kiya kar 💔",2,2026-02-25 16:24:57
o7clvdy,1regb93,JEENEETards,"🙃🙃10% selection vs 1% selection se hi judge karte hai log 

nobody sees the 100th rank vs 1st ",2,2026-02-25 16:25:02
mt36yzo,1kq69sj,JEENEETards,"If you feel like this Post violates the subreddit [rules](https://www.reddit.com/r/JEENEETards/about/rules).

Feel free to report it using the 3 dots or tag any active moderator for removing this post.

Learn how to report any post [here](https://www.reddit.com/r/JEENEETards/comments/1d9ac4i/comment/l7c1q08/)

*I am a bot, and this action was performed automatically. Please [contact the moderators of this subreddit](/message/compose/?to=/r/JEENEETards) if you have any questions or concerns.*",1,2025-05-19 08:05:48
mt37h5v,1kq69sj,JEENEETards,insert < aaj ro gaya badmash >![img](emote|t5_311ttu|32193),155,2025-05-19 08:11:14
mt37jax,1kq69sj,JEENEETards,Give me some sunshine,137,2025-05-19 08:11:53
mt37j1t,1kq69sj,JEENEETards,bhai vo gaana mil jaata toh ..........,81,2025-05-19 08:11:49
mt39bft,1kq69sj,JEENEETards,"https://preview.redd.it/qpa3qyfb9p1f1.jpeg?width=320&format=pjpg&auto=webp&s=82b34c86d8327e0d7f930237b5083d7e3fbce072

Wanna die peacefully now 💐",55,2025-05-19 08:31:16
mt37jqz,1kq69sj,JEENEETards,https://preview.redd.it/gizw8arv5p1f1.jpeg?width=682&format=pjpg&auto=webp&s=b9490223ebc4cfc6eff8ba2a5d8457f03f9ba07b,51,2025-05-19 08:12:00
mt384kf,1kq69sj,JEENEETards,Bhai ne mujhe personally call out kar diya . Mai to drop bhi le raha. hu ab . Will be lonely asf .,46,2025-05-19 08:18:16
mt37bde,1kq69sj,JEENEETards,"True bhaii.... 
Manzil mili naa..... Pyaar na paya.......",35,2025-05-19 08:09:31
mt3vrod,1kq69sj,JEENEETards,"Hey guys, 27M here. This sub keeps on getting suggested to me because of how often I relate to your feelings back to when I was going through the same. Have always lurked but never engaged, but this post got to me.

Just wanted to say this - it’ll get better. But it’ll get worse before it gets better.
But it gets better, I promise :)
Just always listen to your heart, and don’t underestimate the power of connections. Because after all that’s all we truly ever have in this terrible world.",29,2025-05-19 11:56:53
mt38ing,1kq69sj,JEENEETards,"https://preview.redd.it/fnbmu9br7p1f1.png?width=643&format=png&auto=webp&s=8dd835baaa8e84f7abe4c06946be35bbeed20384

IIT dream is over![img](emote|t5_311ttu|32193)",27,2025-05-19 08:22:31
mt37eq0,1kq69sj,JEENEETards,+1 bhai +1,20,2025-05-19 08:10:30
mt38wgm,1kq69sj,JEENEETards,Bhai Mera to NIT bhi nahi hua![img](emote|t5_311ttu|32193),20,2025-05-19 08:26:42
mt38p84,1kq69sj,JEENEETards,Jaarha saare ex dosto ko bhejne kya pata kisi se conversation start hojaye,13,2025-05-19 08:24:31
mt396uc,1kq69sj,JEENEETards,i really wanna go back in time mann ![img](emote|t5_311ttu|32193),12,2025-05-19 08:29:50
mt3jcuk,1kq69sj,JEENEETards,"This happened exactly with me 12 years ago, School, Dost, Bandi sb chodh k Kota gya tha, 3 sal gand mrvai & missed IIT by a few marks...still hurts.🥲",9,2025-05-19 10:15:18
mt3nzwt,1kq69sj,JEENEETards,"From Topper to dropper 
From 95.6to 65.6

It's end",7,2025-05-19 10:56:50
mt3dcdc,1kq69sj,JEENEETards,Hota hai op.. It's just a page of your story.. turn it and write a great one ahead..,5,2025-05-19 09:14:16
mt48ox5,1kq69sj,JEENEETards,Me when MBBS,4,2025-05-19 13:20:45
mt37zpi,1kq69sj,JEENEETards,"Idk life kaafi khali-khali se lag rahi hai, kuch kaam nahi hai ab ![img](emote|t5_311ttu|32179)",3,2025-05-19 08:16:47
n24jsit,1lvb07j,JEENEETards,"If you feel like this Post violates the subreddit [rules](https://www.reddit.com/r/JEENEETards/about/rules).

Feel free to report it using the 3 dots or tag any active moderator for removing this post.

Learn how to report any post [here](https://www.reddit.com/r/JEENEETards/comments/1d9ac4i/comment/l7c1q08/)

*I am a bot, and this action was performed automatically. Please [contact the moderators of this subreddit](/message/compose/?to=/r/JEENEETards) if you have any questions or concerns.*",1,2025-07-09 05:44:22
n24k87c,1lvb07j,JEENEETards,Bro wtf wo girte girte bacha!!!,578,2025-07-09 05:47:57
n24prlr,1lvb07j,JEENEETards,Respect for the work they do 🫡,196,2025-07-09 06:35:46
n24y7qy,1lvb07j,JEENEETards,"Nothing is easy bro, if it was then everyone be doing that",186,2025-07-09 07:53:34
n253qgb,1lvb07j,JEENEETards,"the only thing that is easy is posting shit online masked as ""thought out opinions"" for clout.",149,2025-07-09 08:46:30
n24xiqv,1lvb07j,JEENEETards,Yaar mujhe apne  didi ke shaddi ke din yad a gaye aese hi majdoori krta tha us time laga ki padhna aasan h 😭😭,56,2025-07-09 07:47:03
n24qv74,1lvb07j,JEENEETards,Studying requires mental exertion and physical labour requires physical exertion. There's no mental stress plaguing when your entire job is to lift and transport heavy stuff. Studying will damage your mental and physical health in the long run if you don't deal with stress or exercise. Physical labour on the other hand is not as stressful and will keep you in good overall health as it is what humans are biologically designed to do.,49,2025-07-09 06:45:34
n24ncwk,1lvb07j,JEENEETards,"If the reservation system removed 😞

![gif](giphy|qQdL532ZANbjy)",43,2025-07-09 06:14:26
n252e47,1lvb07j,JEENEETards,"So i was at hospital and there a young construction worker was admitted,  he fell from  6th floor while doing something,  his one ear drum was ruptured and bleeding from head, right hand fractured,  he was  barely conscious and his manager was telling his mom,  this is normal. Kuch nahi hua isko, gaav  lekker jao isko, app bhi jao mai aap dono ka ticket kara deta hua, and that mother was profusely thanking that manager. Everyone is not privileged and if you have the means don't  make fun of anybody profession. Whatsoever it may be.",35,2025-07-09 08:33:24
n24uhja,1lvb07j,JEENEETards,i'd rather do this physical labour shi if it would have paid me the amount which i'm obliged to get after putting my assoff efforts in studying.. so don't say shit like studying is easy life ain't equal for everyone buddy.,23,2025-07-09 07:18:15
n26ti0e,1lvb07j,JEENEETards,"If studying was that easy then everyone would be getting 250+ in jee mains lol 



when you indulge in a routine for 2 years of school pressure, social pressure, a jump from 10th to 11th, hormonal changes in body, coaching pressure, parental kalesh and expectations continuously for 2 years it’s obviously very tough to stay consistent so dont shit on people who are prepping for their competition by saying sugarcoated shit like “studying is the easiest thing you can do 🤡🤡🤡” the easiest thing to probably do is getting online on reddit and posting ts on a sub where only academic talks and doubts must be discussed. Good night 🙏",10,2025-07-09 15:14:46
n25vspo,1lvb07j,JEENEETards,"If studying was the easiest thing, you would have been doing that.",6,2025-07-09 12:22:39
n2500zx,1lvb07j,JEENEETards,"It's not about studying and all.

Greed and capital*sm has failed this world.

Minimum wage workers with no insurance and safety is the new norm.",3,2025-07-09 08:10:43
n26e8uv,1lvb07j,JEENEETards,Studying is in fact the easiest thing to do... But qualifying or topping exams is not,4,2025-07-09 14:02:38
n26unld,1lvb07j,JEENEETards,Civil Engineering interns,4,2025-07-09 15:20:03
n24t9cd,1lvb07j,JEENEETards,Studying is not only the easiest but the most reliable and least competitive field.,2,2025-07-09 07:07:00
n24xdxn,1lvb07j,JEENEETards,Squid Game ?,3,2025-07-09 07:45:46
n24zxa0,1lvb07j,JEENEETards,Only studying won’t fill your stomach,3,2025-07-09 08:09:44
n250233,1lvb07j,JEENEETards,"Respect for the boys!

Thank god I'm privileged enough to study.

I have seen guys my age or even younger, loading bricks onto their backs and going to the roof of a 3 storey building.

Nothing but respect, these guys work so hard to provide for their families.",2,2025-07-09 08:11:00
n0cxeiu,1ln68hf,JEENEETards,"If you feel like this Post violates the subreddit [rules](https://www.reddit.com/r/JEENEETards/about/rules).

Feel free to report it using the 3 dots or tag any active moderator for removing this post.

Learn how to report any post [here](https://www.reddit.com/r/JEENEETards/comments/1d9ac4i/comment/l7c1q08/)

*I am a bot, and this action was performed automatically. Please [contact the moderators of this subreddit](/message/compose/?to=/r/JEENEETards) if you have any questions or concerns.*",1,2025-06-29 04:44:50
n0czo1a,1ln68hf,JEENEETards,https://preview.redd.it/e0w9jw4its9f1.jpeg?width=1220&format=pjpg&auto=webp&s=9eac2cecfa4ad49320dd2c234d05ae39568ba02a,392,2025-06-29 05:02:49
n0d0nnz,1ln68hf,JEENEETards,https://preview.redd.it/68gemgvxus9f1.jpeg?width=1170&format=pjpg&auto=webp&s=269dce015c5ec71591ebd4df4588483c595261fb,250,2025-06-29 05:10:53
n0cxpev,1ln68hf,JEENEETards,https://preview.redd.it/nze6jo7qqs9f1.jpeg?width=640&format=pjpg&auto=webp&s=c1aee16072dca596f9b5cf3ef71b6c5f800666b3,89,2025-06-29 04:47:16
n0d1t7z,1ln68hf,JEENEETards,Ye meme is sub pe hi discover kiya tha mene toh,67,2025-06-29 05:20:30
n0d14tp,1ln68hf,JEENEETards,https://preview.redd.it/d57qw97nvs9f1.jpeg?width=2972&format=pjpg&auto=webp&s=cc62e6efcc5c96047a014278dee4140bb5b36fa0,25,2025-06-29 05:14:49
n0d0vvr,1ln68hf,JEENEETards,Alec daddy meme where...,13,2025-06-29 05:12:45
n0def9y,1ln68hf,JEENEETards,this sub is slowly turning into another indianmemers,12,2025-06-29 07:16:18
n0dexlu,1ln68hf,JEENEETards,https://preview.redd.it/i5ffwi27it9f1.png?width=900&format=png&auto=webp&s=208d618105b9f90daea8a4ce9160f479c1b64440,9,2025-06-29 07:21:20
n0dn99n,1ln68hf,JEENEETards,https://i.redd.it/1epgsfbaxt9f1.gif,7,2025-06-29 08:45:48
n0dvcu5,1ln68hf,JEENEETards,https://preview.redd.it/vpmxt1r1cu9f1.jpeg?width=1080&format=pjpg&auto=webp&s=29257bcc9ad08c3ffdde144b54c59af4e9c539ca,7,2025-06-29 10:08:32
n0d9ysb,1ln68hf,JEENEETards,Don't make this Instagram 🥀,6,2025-06-29 06:33:46
n0dmwnd,1ln68hf,JEENEETards,jeeneetards mainstream horela lala,3,2025-06-29 08:42:13
n0e53su,1ln68hf,JEENEETards,"Damn, dis sub is jus all about memes now, crazy shi.",3,2025-06-29 11:38:00
n0fecmz,1ln68hf,JEENEETards,"amateurs, Amazon Prime is always uncensored!!",2,2025-06-29 16:11:32
n0d3pbz,1ln68hf,JEENEETards,har jaegh yhi chal rha hai bhai bad karo ye post krna,1,2025-06-29 05:36:43
n0d5kuh,1ln68hf,JEENEETards,Big company brainrot is peak,1,2025-06-29 05:53:16
n0d94vp,1ln68hf,JEENEETards,https://preview.redd.it/s2wvexzb8t9f1.jpeg?width=406&format=pjpg&auto=webp&s=978b1471bdcc1c0c81d5a1884697bc20faf59c6b,1,2025-06-29 06:25:55
n0de5fl,1ln68hf,JEENEETards,Future employees inhe yahi se to milenge,1,2025-06-29 07:13:40
o0u7fsh,1qivo5j,JEENEETards,"If you feel like this Post violates the subreddit [rules](https://www.reddit.com/r/JEENEETards/about/rules).

Feel free to report it using the 3 dots or tag any active moderator for removing this post.

Learn how to report any post [here](https://www.reddit.com/r/JEENEETards/comments/1d9ac4i/comment/l7c1q08/)

*I am a bot, and this action was performed automatically. Please [contact the moderators of this subreddit](/message/compose/?to=/r/JEENEETards) if you have any questions or concerns.*",1,2026-01-21 11:41:03
o0u7y9p,1qivo5j,JEENEETards,Bakre ki bali chadhaane se pehle usko bohot khilaate hai.......just saying,1625,2026-01-21 11:45:01
o0u7laq,1qivo5j,JEENEETards,"Ya rab teri alag leela hai , kisi pe karam meherban , to koi gadha pehelwan :) 

Happy for you mate :)",402,2026-01-21 11:42:15
o0u9po2,1qivo5j,JEENEETards,Mere papa khe rhe ha ki AI ha,144,2026-01-21 11:58:06
o0u82av,1qivo5j,JEENEETards,"Best of luck (: pakka pichle janm me acche karm kiye honge, aapko bade acche parents mile hai, cherish them (:",73,2026-01-21 11:45:51
o0u7sft,1qivo5j,JEENEETards,nd  somehow we both live in the same world ? ,60,2026-01-21 11:43:45
o0ubjur,1qivo5j,JEENEETards,"I come from two Indias 🥲
                                     ~Vir Das",43,2026-01-21 12:11:39
o0u8bqg,1qivo5j,JEENEETards,"https://preview.redd.it/m4zq58jjxoeg1.jpeg?width=681&format=pjpg&auto=webp&s=3460ae4ff425831dcc884ada7a3aaf4518a40dc4

Happy for you😔🙏",36,2026-01-21 11:47:50
o0u7vad,1qivo5j,JEENEETards,Tera sahi hai,27,2026-01-21 11:44:23
o0ue6e4,1qivo5j,JEENEETards,"Lucky guy, some ppl couldn't even know what's dad love is ..",27,2026-01-21 12:30:11
o0u9pmc,1qivo5j,JEENEETards,https://preview.redd.it/2yoet2cdzoeg1.png?width=1053&format=png&auto=webp&s=e6f4cc20ea9b8d6cf9e096e9192d212004a88b85,23,2026-01-21 11:58:05
o0u9b58,1qivo5j,JEENEETards,"Sab ko sab nhi milta

![gif](giphy|mi4ec226vjAkehSLk0)",15,2026-01-21 11:55:08
o0ua9rx,1qivo5j,JEENEETards,kaidi ki aakhri wish aur khana type shit,13,2026-01-21 12:02:13
o0uc84b,1qivo5j,JEENEETards,"Some are going as customers (op) while some are gonna be placed in dominos (me, as a cashier)",13,2026-01-21 12:16:31
o0ubwrk,1qivo5j,JEENEETards,🥲Bro my father told don't worry about it if you don't get jee this time we will try again for other exams and april attempt.Just try your best.,10,2026-01-21 12:14:16
o0uaxd0,1qivo5j,JEENEETards,"Bhai mt dekh vo movie, exam accha nhi jayega",7,2026-01-21 12:07:05
o0udhry,1qivo5j,JEENEETards,Always believed life is unfair and it never got proved wrong:),5,2026-01-21 12:25:28
o0umroy,1qivo5j,JEENEETards,Bhai aap movie dekh lete phir dalte nazar lg gyi aapki movie plan ko,6,2026-01-21 13:24:09
o0utv0c,1qivo5j,JEENEETards,Essa sach mai bhi hota hai?😍🥀💔,6,2026-01-21 14:03:08
o0u9q8n,1qivo5j,JEENEETards,Manifesting this next year except with the best marks in NEET,4,2026-01-21 11:58:13
ncvj9g5,1naodun,JEENEETards,"If you feel like this Post violates the subreddit [rules](https://www.reddit.com/r/JEENEETards/about/rules).

Feel free to report it using the 3 dots or tag any active moderator for removing this post.

Learn how to report any post [here](https://www.reddit.com/r/JEENEETards/comments/1d9ac4i/comment/l7c1q08/)

*I am a bot, and this action was performed automatically. Please [contact the moderators of this subreddit](/message/compose/?to=/r/JEENEETards) if you have any questions or concerns.*",1,2025-09-07 08:58:38
ncvk8mg,1naodun,JEENEETards,"currently I am facing this fukin issue on a daily basis I want to study I want to work hard myself but I can't I can't 😭 I don't know why what the fuk is wrong with me exactly It's just a constant cycle of not studying then regretting 😮‍💨🥺😔

https://preview.redd.it/mlho45d0lpnf1.jpeg?width=640&format=pjpg&auto=webp&s=db9a38279b2e308f50ad9025555641c78814a9f0",114,2025-09-07 09:07:57
ncvlj3v,1naodun,JEENEETards,"Bhaiiii fking trueee
Mene September bhar ka study plan bana liya haii aur agr follow hogya tooo damnnnnn
Butt follow hi nhi ho rha
I want to be discipline but ho nhi rha😭",28,2025-09-07 09:20:16
ncvnk9r,1naodun,JEENEETards,Phone dede parents ko. Coaching me jao sir se doubt pucho,17,2025-09-07 09:39:58
ncvmfuo,1naodun,JEENEETards,Ah... Another one of these posts 😐,14,2025-09-07 09:29:04
ncvywne,1naodun,JEENEETards,"Set small target, if failed set even smaller , reading 5 exception a day , solving 3 examples anything like that will work . Now build this habit and increase bit by bit , you will not to be disciplined in a day , it will take time .This method helps me a lot.

If you think you don't have time , see your phone use , insta , whatsapp, ask your friends and family if you have time or you are just lying ?

There are some books which explains this concept of knowing right but not doing right , I won't recommend to read them.
If you are failing again and again, need someone to force you , find a study partner, there is also a subreddit for this.

Only if you are extremely serious for study, feel free do dm for doubts.",13,2025-09-07 11:26:14
ncw1whx,1naodun,JEENEETards,The very first thing to do is use your mobile ( for entertainment) in evening and night only so to not have dopamine crash. Second make timetable ( how many hrs ur gonna study) based on your capacity and keep increasing it every week.,11,2025-09-07 11:50:27
ncvk9ll,1naodun,JEENEETards,Same Situation jaanta hu galti kar raha but fir agle din wahi kar jaata hu,8,2025-09-07 09:08:13
ncvlmrd,1naodun,JEENEETards,Aalaas bich mei aa jawee🥀🥀,7,2025-09-07 09:21:14
ncvqel2,1naodun,JEENEETards,😂😂😂😂 so true ..... I guess almost everyone is self aware ...... The second point is the issue,5,2025-09-07 10:07:53
ncvrvyx,1naodun,JEENEETards,Bhai tu thik toh hai na?...bde time se aisi post dalrha...🤧😢kuch zarurat ho toh btana,3,2025-09-07 10:22:25
ncvtbuh,1naodun,JEENEETards,bhai sacchi mai har raat guilty feel hota h... idk man i hate myself now. all i feel is disgust when I look at myself yet I don't take any action,4,2025-09-07 10:36:19
ncwrhna,1naodun,JEENEETards,"Everyone is self aware lmao the 2nd part is difficult, karoge to banoge!",4,2025-09-07 14:27:24
ncvucqz,1naodun,JEENEETards,Which anime ?,2,2025-09-07 10:46:01
ncvya88,1naodun,JEENEETards,There's no trick or shortcut to discipline,2,2025-09-07 11:20:59
ncwb0fv,1naodun,JEENEETards,"Believe me or not, delete reddit.",2,2025-09-07 12:54:12
ncvtwlo,1naodun,JEENEETards,"Hehe, overkaam karne se hona hi tha burnout :(",1,2025-09-07 10:41:51
ncvuwci,1naodun,JEENEETards,real,1,2025-09-07 10:51:01
o8znc8b,1rmio51,JEENEETards,"If you feel like this Post violates the subreddit [rules](https://www.reddit.com/r/JEENEETards/about/rules).

Feel free to report it using the 3 dots or tag any active moderator for removing this post.

Learn how to report any post [here](https://www.reddit.com/r/JEENEETards/comments/1d9ac4i/comment/l7c1q08/)

*I am a bot, and this action was performed automatically. Please [contact the moderators of this subreddit](/message/compose/?to=/r/JEENEETards) if you have any questions or concerns.*",1,2026-03-06 16:29:57
o8zpiuu,1rmio51,JEENEETards,"https://preview.redd.it/s437gsisdgng1.jpeg?width=1080&format=pjpg&auto=webp&s=24e96e7dbdf7cfa4bf05608d15f416ab18e249f7

Love yall🫶",885,2026-03-06 16:40:06
o8zsy46,1rmio51,JEENEETards,"https://preview.redd.it/tpg0vo1dggng1.jpeg?width=3000&format=pjpg&auto=webp&s=75e398f72bb7727cc08cc9cbd6a0571c682d6377

Bhai yaar reddit mention maat kro . Let sir feel ki bache kahi se AA Gaye he might think that unka hardwork hai . Reddit or subs mention nhi krenge toh sir ko feel ayega ki bache aye or smje ",380,2026-03-06 16:55:54
o8znke2,1rmio51,JEENEETards,I did write a good comment and the way he smiled and cherished the moment broke the funny part of the comments man,269,2026-03-06 16:31:00
o8zqo62,1rmio51,JEENEETards,"https://preview.redd.it/vqbe4q3qegng1.jpeg?width=1080&format=pjpg&auto=webp&s=68d25ee4577c116a52fb31c69964cb6a20828ffb

Its his first time interacting with these many students😭🫶🫶🫶 thank you so much ppl i didnt think yall would show up lyall🫶🫶🫶🫶🫶🫶",224,2026-03-06 16:45:23
o8zosto,1rmio51,JEENEETards,Update:- thank yall for showing on his livestream and the comments 😭😭😭 hes truly happy😭,115,2026-03-06 16:36:45
o8zrugy,1rmio51,JEENEETards,"https://preview.redd.it/8ehwf20pfgng1.jpeg?width=1080&format=pjpg&auto=webp&s=1b74ab5ab7e26821c6a5308a8a9fc27d9146a94e

41 PEOPLEEE LETSS GOOO!! THANK YOU ALL FOR MAKING HIS DAY😭🫶",103,2026-03-06 16:50:48
o8zt34p,1rmio51,JEENEETards,"https://preview.redd.it/ntnambupggng1.png?width=303&format=png&auto=webp&s=8747165291eeb5a67bea22205a2b8bf95440e886

really?",81,2026-03-06 16:56:33
o8zsgfv,1rmio51,JEENEETards,"The people on the livestream now, after this post is so wholesome  
Sometimes I love being a human  
Y'all are good people!  
Thank you!",68,2026-03-06 16:53:38
o8zr1e4,1rmio51,JEENEETards,"https://preview.redd.it/r2uncpg1fgng1.jpeg?width=1080&format=pjpg&auto=webp&s=ad91bf963306c2d2408e60326ae46462e49731c1

YALL SOO CRAZY WE GOT 25 PEOPLE FOR THE MAN WHO WAS ALONE 10 MINUTES AGO WITH HATE NOW FILLED WITH LOVE AND SMILE I LOVE YALL🫶🫶🫶🫶🫶🫶🫶",68,2026-03-06 16:47:04
o8zulap,1rmio51,JEENEETards,Update:- stream ended gang BUT THE MASSIVE SUPPORT HE GOT 100 LIKES AND 50 WATCHING AND DONATIONS FROM US AND LUCK BHAI AND HE ENDED THE STREAM WITH A BIG SMILE UNLIKE THE SADNESS WHEN I JOINED I LOVE THIS SUB🫶,56,2026-03-06 17:03:36
o8zstz8,1rmio51,JEENEETards,"https://preview.redd.it/3uyrp4niggng1.jpeg?width=1263&format=pjpg&auto=webp&s=2df8befdde6d1f4ba1ff0a71e14e8893d1664cc2

😭😭😭😭",47,2026-03-06 16:55:22
o8zrc7t,1rmio51,JEENEETards,Bhai wo Banda kitna khush nazar aa rha hai chat padhke 😭,40,2026-03-06 16:48:27
o8zr0vi,1rmio51,JEENEETards,He genuinely got so happy 3 to 20+ students !!!!!,30,2026-03-06 16:47:01
o8ztemp,1rmio51,JEENEETards,"https://preview.redd.it/ijel8iszggng1.jpeg?width=1080&format=pjpg&auto=webp&s=dcc90f271fa97032f85dafdaf0e5fbed2fe2cb11

Luck5485 MAN ILY😭🫶 45 PEOPLE AND ALL WHOLESOME YALL ARE WONDERFUL I LOVE YOU JEENEET TARDSSSS",29,2026-03-06 16:58:02
