post_id,subreddit,title,body,score,upvote_ratio,num_comments,created_utc,time_filter,permalink,is_self
1jxa0y0,mumbai,Hypocrisy ki bhi koi seema hoti hai,"No personal hate towards Gujarati people but the recent narrative built by multiple instagrammers are that they are peaceful towards other communities. First of all most(not all) gujarati communities in Maharashtra are not even inclusive, they might have friendly relations with other communities but most of them are closed community. There are many examples like in Mumbai where societies don't allow anyone except Guijjus and or Jains. Just saying ""to stay peaceful with someone first you have include them and then accept them"". Even in my locality there are multiple societies that are exclusive to Gujjus or Jains.

From now on any video found on ""Come to Gujarat"" will be shared on North Indian subs (you know which ones)

P.S. don't add sugar in Poha ever

ગુજરાતી લોકો પ્રત્યે કોઈ વ્યક્તિગત દ્વેષ નથી. પરંતુ તાજેતરમાં ઘણા ઇન્સ્ટાગ્રામર્સ દ્વારા બનાવવામાં આવેલી વાર્તા એ છે કે તેઓ અન્ય સમુદાયો પ્રત્યે શાંતિપૂર્ણ છે. સૌ પ્રથમ, મહારાષ્ટ્રમાં મોટાભાગના (બધા નહીં) ગુજરાતી સમુદાયો સમાવિષ્ટ પણ નથી, તેમના અન્ય સમુદાયો સાથે મૈત્રીપૂર્ણ સંબંધો હોઈ શકે છે પરંતુ તેમાંથી મોટાભાગના બંધ સમુદાયના છે. મુંબઈ જેવા ઘણા ઉદાહરણો છે જ્યાં સમાજ ગુજ્જુઓ અને જૈનો સિવાય કોઈને પણ મંજૂરી આપતો નથી. ફક્ત એમ કહીને કે ""કોઈની સાથે શાંતિપૂર્ણ રહેવા માટે પહેલા તેમને સામેલ કરો અને પછી તેમને સ્વીકારો"". મારા વિસ્તારમાં પણ એવા અનેક સમાજો છે જે ફક્ત ગુજ્જુઓ અથવા જૈનો માટે જ છે.

હવેથી ""ગુજરાત આવો"" પર મળતો કોઈપણ વિડિઓ ઉત્તર ભારતીય સબ્સ પર શેર કરવામાં આવશે (તમે જાણો છો કે કયા છે)

ક્યારેય પોહામાં ખાંડ ના નાખો.",9580,0.92,149,2025-04-12 05:23:33,year,https://reddit.com/r/mumbai/comments/1jxa0y0/hypocrisy_ki_bhi_koi_seema_hoti_hai/,False
1r61oys,mumbai,One more metro slab is about to fall,,9503,0.99,358,2026-02-16 06:02:04,year,https://reddit.com/r/mumbai/comments/1r61oys/one_more_metro_slab_is_about_to_fall/,False
1o6bntb,mumbai,My friend Sanskruti Amin was killed by a falling concrete block in Jogeshwari — please help us get justice,"I don’t even know how to write this properly, but my friend Sanskruti Amin is gone. She was just 22. A few days ago, while she was walking to work in Jogeshwari East, a huge concrete block fell from an under-construction building and hit her on the head. She died on the spot.


She had just started working at RBL Bank after finishing her hotel management degree. She lived with her parents and grandmother — their only child. I still can’t believe she’s not here anymore.


The block apparently fell from one of the top floors of a redevelopment project near Majaswadi / Thakur Road. Locals have been saying for a while that materials kept falling from that site and nobody did anything. There were no proper safety nets, no barricades — nothing. This wasn’t an “accident.” It was pure negligence.


Her father filed a police complaint, and Meghwadi Police have arrested a site engineer and a site manager. But that’s not enough. The builder and the company (Shraddha Life / Shraddha Construction / Shraddha Lifestyle, as reported) are responsible too. They should be arrested — not just some staff who were following orders.


We’re all broken. Her family is devastated. And all I can think is how easily this could’ve been avoided if people had just done their jobs.


Please, if you’re reading this — share her story everywhere you can. Tweet about it, post it on Instagram, tag @MumbaiPolice, @mybmc, and news outlets. The more people know, the harder it will be for them to bury this case quietly.


She didn’t deserve this. Nobody does. Let’s not let them get away with it.


#JusticeForSanskrutiAmin",8861,0.98,354,2025-10-14 10:20:08,year,https://reddit.com/r/mumbai/comments/1o6bntb/my_friend_sanskruti_amin_was_killed_by_a_falling/,False
1rbdtv8,mumbai,Too late to regret,,7456,0.94,333,2026-02-22 05:49:37,year,https://reddit.com/r/mumbai/comments/1rbdtv8/too_late_to_regret/,False
1kpe5rc,mumbai,Saw the worst of humanity at Ishaara,"Went to Ishaara today a beautiful restaurant where the staff are hearing and speech impaired, and you place your orders through sign language. It’s a place that truly celebrates inclusivity and gives you a unique and humbling experience.
But today, I witnessed something that left a bad taste in my mouth and it wasn’t the food.

A group of three walked in, already loud and obnoxious. From the get-go, they seemed amused by the concept of the place. One guy, in particular, started mocking the signs shown by the servers  exaggerating the hand gestures, laughing, and turning them into some kind of joke. He kept saying stuff like, “Bro, I think he just cursed at me” and “How do you even work here if you can’t hear ‘burger’?” His friends laughed along like it was some comedy show.

The staff, in their patience and professionalism, just kept doing their job with calm smiles. But I could see it in their eyes. They noticed. They always notice. One server momentarily paused, then turned around to compose himself before returning to take the table’s order like nothing happened. That crushed me.

What’s worse? No one from the group apologized. They walked out laughing.

If you ever visit Ishaara, I beg you come with respect. Come with humility. The people working there are doing something incredible. They don’t need your pity  just your humanity.

And to that guy: You may have thought you were being funny. But really, you were just showing the world how loud ignorance can be.",6691,0.96,455,2025-05-18 07:14:29,year,https://reddit.com/r/mumbai/comments/1kpe5rc/saw_the_worst_of_humanity_at_ishaara/,False
1m4prs5,mumbai,"Indians Abroad, Please stop embarrassing us.","Changi Airport Terminal 3 (Singapore): Was waiting there for my flight back to Mumbai.  Suddenly I saw group of 20 people. They were Gujarati ( as they were conversing in Gujarati). They were sitting and talking very loudly. Laughing like they got some seizures or something . Most of them sitting down on floor. Then one of them opened a huge packet of Namkeen. They all  starting eating it. Most of it was spilled on the floor. They really made a mess of it. Everyone was pointing at them and making faces. One of the Australian/British Couple who were behind me said ""These must be Indian Mate "". After boarding got started, the Girl on the computer was announcing which seats to be boarded. These group of people were cutting line and trying to forcefully enter. There seats were not even announced. These people created quite a ruckus. And after creating ruckus, the main guy was laughing in pride as he have done something really great. 

Why cannt people conduct themselves in a decent manner when abroad ? ",6506,0.96,344,2025-07-20 14:06:09,year,https://reddit.com/r/mumbai/comments/1m4prs5/indians_abroad_please_stop_embarrassing_us/,True
1qycetu,mumbai,Suspected crack on Metro 4 pillar (Mulund),Spotted this while traveling from Thane to Bhandup. I could not see the pillar number nor did I know any landmark but thankfully I had enabled Geotagging photos. I have sent a complaint to MMRDA. Are there any other authorities that I should reach out to? Better be safe than sorry.,6195,0.99,638,2026-02-07 12:20:15,year,https://reddit.com/r/mumbai/comments/1qycetu/suspected_crack_on_metro_4_pillar_mulund/,False
1rgskf6,mumbai,Is this even Mumbai ?,This area is much cleaner and highly developed than  other indian cities ,6188,0.99,228,2026-02-28 04:02:32,year,https://reddit.com/r/mumbai/comments/1rgskf6/is_this_even_mumbai/,False
1rm6xi8,mumbai,Mumbai deserved to host ICC finals,Whats the point in organising it in Ahmedabad which is such a dull city and does not even have any sporting culture. The 32k Wankhede crowd in yesterday’s match made more noise then 1.25 lakh Ahmedabad crowd,6132,0.93,503,2026-03-06 06:53:55,year,https://reddit.com/r/mumbai/comments/1rm6xi8/mumbai_deserved_to_host_icc_finals/,False
1l5euc0,mumbai,texts with my dad while i travelled in a crowded local (alone) for the first time😭🙏🏽,i just found it cute for no reason😭,6097,0.96,450,2025-06-07 07:10:37,year,https://reddit.com/r/mumbai/comments/1l5euc0/texts_with_my_dad_while_i_travelled_in_a_crowded/,False
1mb9bt5,mumbai,Biggest concern 😭,,5988,0.98,148,2025-07-28 06:59:50,year,https://reddit.com/r/mumbai/comments/1mb9bt5/biggest_concern/,False
1n2ck0p,mumbai,"Passenger Caught Indulging in Indecent Act on Harbour Line Train (Thane–Vashi) on 26th Aug, 1:30 PM – Outrage Grows Over Women’s Safety in Mumbai Locals",,5975,0.88,1616,2025-08-28 13:41:39,year,https://reddit.com/r/mumbai/comments/1n2ck0p/passenger_caught_indulging_in_indecent_act_on/,False
1kvpaji,mumbai,Newly inaugurated Aqual Line gets flooded after heavy rains.,Sad to see that this line was barely launched 15 days ago and the platform is filled with water. Looks like the only station affected is Acharya atre Chowk which has been temporarily closed. Stay safe guys.,5683,0.96,507,2025-05-26 08:26:37,year,https://reddit.com/r/mumbai/comments/1kvpaji/newly_inaugurated_aqual_line_gets_flooded_after/,False
1sacqaa,mumbai,Breathtaking view of Mumbai,[Source](https://x.com/i/status/2039308747760427163) ,5560,0.98,106,2026-04-02 09:37:03,year,https://reddit.com/r/mumbai/comments/1sacqaa/breathtaking_view_of_mumbai/,False
1pqcyft,mumbai,Leopard spotted in Bhayander today.,,5510,0.98,458,2025-12-19 05:23:33,year,https://reddit.com/r/mumbai/comments/1pqcyft/leopard_spotted_in_bhayander_today/,False
1nq8h7v,mumbai,What is this? 🤨,,5439,0.99,260,2025-09-25 14:36:26,year,https://reddit.com/r/mumbai/comments/1nq8h7v/what_is_this/,False
1n8bjmx,mumbai,She is getting unnecessary hate. Can't people limit prayer sounds to themselves.,"I have heard this in jagrata , people saying zor se bolo, jo log apne ghar me baithe hai un tk bhi awaz phauchni chayea
",5429,0.87,886,2025-09-04 14:22:00,year,https://reddit.com/r/mumbai/comments/1n8bjmx/she_is_getting_unnecessary_hate_cant_people_limit/,False
1nt8af5,mumbai,Mumbai being flooded with cats.,"Having lived in Mumbai for the past five years, one striking observation I've made is the sheer density of cats seemingly flooding every corner of the city. While this abundance is undeniably cute, it raises concerns regarding the potential for disease transmission. Furthermore, I can't help but feel a deep sense of pity for the plight of these stray animals.",5250,0.99,312,2025-09-29 03:57:21,year,https://reddit.com/r/mumbai/comments/1nt8af5/mumbai_being_flooded_with_cats/,False
1mizfz8,mumbai,When pigeons matter more than people: The hypocrisy of modern Jainism in Mumbai.,"Due to pigeons, their feathers, and the germs and fungus in their droppings, humans can suffer lung damage such as fibrosis and serious respiratory illnesses caused by infections. Their droppings also harm the structural integrity of buildings. It is only after proving this scientifically that the Supreme Court ordered the closure of pigeon-feeding zones (Kabutarkhanas) in crowded areas.

Is it wrong to expect the Jain community to value human life? If people who avoid eating root vegetables (because they believe microbes cling to them underground) are willing to let humans suffer or even die just to keep Kabutarkhanas running and to earn ""religious merit"" by feeding pigeons — then can they truly be called non-violent Jains?

The Jain temple at Dadar fiercely protestingfor pigeons’ right to be fed at Kabutarkhana  but not near their own doorstep, where nets are put up to keep them away. Priorities, right?",5240,0.94,507,2025-08-06 08:51:06,year,https://reddit.com/r/mumbai/comments/1mizfz8/when_pigeons_matter_more_than_people_the/,False
1r2omf6,mumbai,Begger’s legs start working as soon as train stops!,,5187,0.98,143,2026-02-12 09:02:29,year,https://reddit.com/r/mumbai/comments/1r2omf6/beggers_legs_start_working_as_soon_as_train_stops/,False
1kj7h54,mumbai,Hats off to the Mumbai ATC nd the entire Airport support staff guys🫡,Imagine the stress nd fatigue they must be going through rn due to this much traffic. ,5174,0.99,96,2025-05-10 10:50:34,year,https://reddit.com/r/mumbai/comments/1kj7h54/hats_off_to_the_mumbai_atc_nd_the_entire_airport/,False
1mcah7z,mumbai,Customer travel experience at its peak!!,Spotted at Ghatkopar East.,5159,1.0,104,2025-07-29 12:46:14,year,https://reddit.com/r/mumbai/comments/1mcah7z/customer_travel_experience_at_its_peak/,False
1p8s5cx,mumbai,One thing I genuinely love about Mumbai is how nobody treats celebrities like gods anymore,"Something I’ve realised about Mumbai and honestly our whole generation is that people genuinely don’t lose it over celebrities anymore. Not in a rude way, just in a normal “they’re people like us” way.

I’ve run into a bunch of actors at airports, lounges and restaurants. No one crowds them, no one acts like a fanboy. Everyone just goes on with their life.

When I was flying back from Dubai, Kapil Sharma was in business class. I didn’t even notice him at first. My friend pointed him out and that was literally it. Nobody tried to run to him or anything.

Even outside India it’s the same for me. In LA I’ve seen rappers walking around. And once I was right next to two Real Madrid players in Beverly Hills: Bellingham and Trent. I’m a Madrid supporter so I just casually asked “How’s the break going? Ready for the season?” and they replied like completely regular guys. No ego, no weird energy, nothing. Just normal conversation.

That’s when it really clicked for me. Our parents grew up in that era where celebrities were put on pedestals. Posters on bedroom walls, gossip magazines, interviews where stars were treated like royalty. Back then celebrities had this whole mystique.

Now that curtain is gone. We’ve seen their behind-the-scenes, we’ve seen the PR, the posing, the staged candids, the filtered Instagram life. A lot of it looks pretentious when you see it up close.

And let’s be real… the industry is full of people living way beyond their actual means. Borrowed cars, borrowed clothes, borrowed lifestyle. Half of the “luxury life” is credit cards, sponsorships and PR smoke. Once you realise that, it’s even harder to worship anyone.

Honestly I prefer this version of the world. No pedestals. No worshipping. Everyone’s just human.

Do you guys feel the same or do people still get starstruck and I’ve just been around the chillest crowds?",5104,0.93,455,2025-11-28 11:02:18,year,https://reddit.com/r/mumbai/comments/1p8s5cx/one_thing_i_genuinely_love_about_mumbai_is_how/,False
1k2nykn,mumbai,1964 Mumbai (Bombay),,5088,0.99,257,2025-04-19 04:17:40,year,https://reddit.com/r/mumbai/comments/1k2nykn/1964_mumbai_bombay/,False
1pmgxp4,mumbai,Thank You Mumbai Police Chants,Felt happy that people appreciated the police. The face of the policemen at the end said it all.,4913,0.99,82,2025-12-14 15:38:06,year,https://reddit.com/r/mumbai/comments/1pmgxp4/thank_you_mumbai_police_chants/,False
1k7lvfh,mumbai,"In Dombivali, people were outraging on streets against the security failure of Modi govt.

“They keep doing Hindu muslim and they only know how to topple the govt by buying MPs and MLAs”.",Source: https://x.com/Chaotic_mind99/status/1915473766647320773,4902,0.92,403,2025-04-25 14:09:28,year,https://reddit.com/r/mumbai/comments/1k7lvfh/in_dombivali_people_were_outraging_on_streets/,False
1kvrq65,mumbai,See how they try to prevent the filming of this shit show.,Millions of taxpayer dollars literally gone down the drain 🤡,4868,0.99,328,2025-05-26 11:10:28,year,https://reddit.com/r/mumbai/comments/1kvrq65/see_how_they_try_to_prevent_the_filming_of_this/,False
1ks15wg,mumbai,Karnatakafication of Maharashtra needs to be studies,"This happened in ghatkopar. Threatening to beat the man up, to shut down his shop over not speaking a particular language while recording everything. Horrible",4732,0.93,1357,2025-05-21 15:46:50,year,https://reddit.com/r/mumbai/comments/1ks15wg/karnatakafication_of_maharashtra_needs_to_be/,False
1n3rj5q,mumbai,How many more years until people develop basic civic sense in India?,"This video was shot at 9pm on 29th August, 2025 in Mira Road under Cordis Hospital.

This continued until 11pm by some or the other group.
Do we really have to explain to these grown adults that this isn't the right thing to do?
Bursting loud crackers, rockets at 11pm right  below hospitals? Really?
I felt so helpless as my grandfather was just trying to get some sleep knowing that I can't even call cops on a situation like this knowing they would put me only in jail instead for a situation like this.

Not just this, Following morning when I went to sit in my car it was spat on (someone ate paan and decided to shoot it on my car post consumption) and no it wasn't in a no Parking or whatever.",4709,0.95,689,2025-08-30 03:34:22,year,https://reddit.com/r/mumbai/comments/1n3rj5q/how_many_more_years_until_people_develop_basic/,False
1ruyj9h,mumbai,Is this how you propose a mumbaikar,,4694,0.97,276,2026-03-16 03:23:17,year,https://reddit.com/r/mumbai/comments/1ruyj9h/is_this_how_you_propose_a_mumbaikar/,False
1orjdmt,mumbai,Colaba-ration with confidence 😌,,4677,0.97,225,2025-11-08 07:34:35,year,https://reddit.com/r/mumbai/comments/1orjdmt/colabaration_with_confidence/,False
1lebf3b,mumbai,"In Mumbai monsoons, whether it's Antilia or Slum both needs a plastic cover to stop leakage",,4670,0.92,104,2025-06-18 07:58:32,year,https://reddit.com/r/mumbai/comments/1lebf3b/in_mumbai_monsoons_whether_its_antilia_or_slum/,False
1r0cnjp,mumbai,"How many more people have to be killed before reckless driving, and the lives of common people are taken seriously? Welcome to India!","Another case. Same pattern. Underage boys driving recklessly. Innocent people paying the price.

This time in Ghatkopar.

A husband and wife were hit. Both are fighting for their lives.

The husband is on ventilator. Chances of survival are even beyond surgeries and miracles now.

The wife is also in critical condition and it would take 1-1.5 years of continuous operations, minimum even if she survives.

✅️ Now the predictable part.

The driver (Uttam Patel) was underage. His family is well-off.

He and his father (Valji Raja Bhushan Patel) even got bail in less than 24 hours. They’re free.

Police support is… you know what to expect 🙃

What angers me even more is that this wasn’t some one-off mistake. The kid already had a history. Reckless riding/driving. Stunt videos on Instagram (now deactivated after they were exposed). Showing off stupidity like it’s a badge of honour. 

And then we pretend to be shocked.

This is not just about one accident.

This is about a broken system where money softens everything.

It’s about a mindset where parents hand over vehicles like toys.

It’s about zero civic sense, no fear of law, no respect for life, no accountability.

We’ve seen this before. Pune. An essay for dead lives. And we still act surprised when it happens again.

And deep down, everyone knows the script. A few days of outrage. Then silence. Then repeat.

Sometimes it genuinely feels pointless.

Sometimes it feels like the safest option is to just leave this country if you ever get the chance, not out of hate, but out of fear that one random day, you or your family could be in the same place, you wouldn't be able to do anything and it still won’t matter, it is out of frustration that even after working so hard, paying taxes, being a good citizen gets you this in return.

If you’re reading this, don’t scroll past it.

Talk about it. Share it. Remember it.

Because this isn’t rare anymore.

It’s routine.",4664,0.99,277,2026-02-09 18:45:41,year,https://reddit.com/r/mumbai/comments/1r0cnjp/how_many_more_people_have_to_be_killed_before/,False
1pnfwy2,mumbai,India’s AQI compared to the world is terrifying,"I came across this AQI map from the AQI app and it really hit me.

This isn’t just bad air quality, this is India standing out globally for all the wrong reasons.

What’s scary is not even how bad it is, but how normal we’ve made it. Masks during winters, burning eyes, constant cough. it’s just part of life now. We only realise how cooked we are when India is placed next to other countries and you see how abnormal this actually is.

And this made me think, air quality is just one visible symptom.

The same acceptance applies to:

	•	broken roads and infrastructure 
	•	pathetic public transport in most cities
	•	unsafe footpaths (if they exist at all)
	•	zero urban planning
	•	“adjust kar lo” attitude to everything

Somehow we’ve internalised that this is just how things are supposed to be. Like expecting clean air, functional infrastructure or efficient public transport is being entitled.

What worries me more is that AQI isn’t something abstract, it’s literally shortening lives. And yet there’s no urgency, no outrage proportional to the damage being done.

If this is what we’ve normalised for air, something we breathe. 

what else have we quietly accepted that we shouldn’t have?

Curious to hear what others think",4633,0.99,243,2025-12-15 19:03:25,year,https://reddit.com/r/mumbai/comments/1pnfwy2/indias_aqi_compared_to_the_world_is_terrifying/,False
1loxu6g,mumbai,MNS Workers Booked For Assaulting Sweet Shop Owner Over Marathi in Mumbai,source : [https://news.abplive.com/cities/mns-workers-booked-for-assaulting-sweet-shop-owner-over-marathi-on-mira-road-1784348](https://news.abplive.com/cities/mns-workers-booked-for-assaulting-sweet-shop-owner-over-marathi-on-mira-road-1784348) ,4615,0.93,663,2025-07-01 10:08:45,year,https://reddit.com/r/mumbai/comments/1loxu6g/mns_workers_booked_for_assaulting_sweet_shop/,False
1lo7bt9,mumbai,"₹ 55,000 crore Mumbai-Nagpur Samruddhi Expressway turned into a river just 30 days after its opening.","This is how our money via taxes, goes down the drain. 

",4471,0.99,337,2025-06-30 13:19:22,year,https://reddit.com/r/mumbai/comments/1lo7bt9/55000_crore_mumbainagpur_samruddhi_expressway/,False
1mcdps0,mumbai,Now MNS goons beating coaching centres for fees? Who gave them this power?,"Saw a video today where MNS guys are beating up someone from a coaching centre. Reason? Because they are charging high fees.

Like bro who gave them that power? Are they government now? Police? Court? If fees are high, go complain to proper people. Not go and slap someone like a local goon.

First they were behind common people for speaking Hindi, now they are entering education too? Tomorrow they will decide what food we eat or what clothes to wear?

And don't give that excuse “they are fighting for students” ,  this is not help, this is gundagiri. Real people who want to help, don’t beat others on camera.

It’s like they only want to show power to people who can’t fight back. That’s not bravery, that’s coward stuff.",4444,0.91,769,2025-07-29 14:59:11,year,https://reddit.com/r/mumbai/comments/1mcdps0/now_mns_goons_beating_coaching_centres_for_fees/,False
1r4fjmh,mumbai,Metro slab falls (Mulund),"As per news 4 people have been injured, even after pointing out the Mmrda has done nothing! A bigger tragedy waiting to happen here.",4430,0.98,428,2026-02-14 08:35:51,year,https://reddit.com/r/mumbai/comments/1r4fjmh/metro_slab_falls_mulund/,False
1mywys0,mumbai,Lalbaug Cha Raja 2025 First Look,Lalbaug Cha Raja 2025 🙏🏻,4406,0.98,85,2025-08-24 14:25:29,year,https://reddit.com/r/mumbai/comments/1mywys0/lalbaug_cha_raja_2025_first_look/,False
1mj0eyp,mumbai,Your thoughts on this?,,4312,0.99,234,2025-08-06 09:53:20,year,https://reddit.com/r/mumbai/comments/1mj0eyp/your_thoughts_on_this/,False
1oaly9d,mumbai,What is this Clusterf*ck of a Machine is this.,He was blowing off the dust previously just when he saw me recording he did something that dust was contained. The whole area is filled with dust what are they trying to achieve!,4313,0.98,426,2025-10-19 10:08:54,year,https://reddit.com/r/mumbai/comments/1oaly9d/what_is_this_clusterfck_of_a_machine_is_this/,False
1rhkt8w,mumbai,mumbai with same camera from (2006-2025),,4300,0.99,168,2026-03-01 02:01:07,year,https://reddit.com/r/mumbai/comments/1rhkt8w/mumbai_with_same_camera_from_20062025/,False
1kkxv53,mumbai,Do you think a large scale campaign like this would work to discourage spitting?,"Thought of it while going to work this afternoon, asked Chatgpt to create it. Took 7-8 tries. ",4274,0.99,167,2025-05-12 17:05:31,year,https://reddit.com/r/mumbai/comments/1kkxv53/do_you_think_a_large_scale_campaign_like_this/,False
