post_id,subreddit,title,body,score,upvote_ratio,num_comments,created_utc,time_filter,permalink,is_self
1k99o7w,mumbai,We got suffocated in a Mumbai-Pune shared cab ride today. Nobody really realised what was happening.,"I was travelling today in a shared cab from Mumbai to Pune.
Got the cab at Andheri, near Sahara Hotel. There were four passengers - one guy in the front seat, two women and me in the middle row, and a bunch of parcel boxes stacked on the folded backseat and in the dickey.

We got into traffic not far from Andheri, and the driver switched on the AC.

Soon after, I started feeling uneasy.
My chest felt heavier, breathing was getting harder. At first, I thought maybe it's just the stuffy weather - but within minutes, it started feeling serious.
I was breathing, but it wasn’t helping. It felt heavier and heavier. Like I was slowly suffocating.

I noticed the woman sitting beside me was fanning her face with her hand - even though we were inside an air-conditioned cab.
I quickly pulled out my headphones and asked her if she was feeling uncomfortable. She said yes - she was feeling suffocated too.
The guy in the front seat turned around and said he was feeling it as well.

Without wasting more time, I rolled down my window. The others followed immediately.
As the fresh air came in, it felt so much better.

Turns out even the driver was feeling it.
None of us had realised quickly enough, so no one spoke up till it got serious.

It was terrifying - genuinely felt like if it had gone on for a few more minutes, some of us might have blacked out.

I started suspecting either something was seriously wrong with the AC, or maybe... the parcel boxes behind us.

We decided to test it again - once we were breathing easier, the driver switched the AC back on.
We sat and observed.
And sure enough - after a few minutes, the suffocation feeling returned, slowly creeping in.

At this point, I was sure the problem was the boxes.

We told the driver to call his middleman - the guy who had arranged the parcel delivery.
The driver called him and asked what was in the boxes.
The middleman casually said he didn't know.
We insisted he call the senders and check.
He was reluctant, tried to brush it off, but we pressed him. My gut feeling was getting stronger by the second.

Meanwhile, I turned back, checked the boxes by touch - all packed in thermocol, and cold to touch.
It clicked.

We were travelling with dry ice.
And with the AC on and windows closed, carbon dioxide was filling up the cab.

The realisation hit hard.
These idiots who sent the parcels hadn’t bothered to inform anyone properly. No warning labels. No instructions.
The middleman hadn’t told the driver anything - or worse, didn’t even know himself.

They had put all our lives at serious risk just to save a few bucks.

The middleman never called us back after that - and honestly, we didn’t even care anymore. We were sure of what it was.

We kept all the windows rolled down for the rest of the journey.

Thankfully, I've reached Pune safely now.
But honestly, this was one of the scariest experiences I've ever had while travelling.
I shudder to think what could have happened if none of us had realised in time.

Just wanted to share this — be alert if you're ever travelling with unknown cargo in a closed vehicle.",3212,1.0,111,2025-04-27 17:39:31,year,https://reddit.com/r/mumbai/comments/1k99o7w/we_got_suffocated_in_a_mumbaipune_shared_cab_ride/,True
1o36kq0,mumbai,Got scammed through dating app,"Ik. Dumb acts, dumb outcome.  Met a girl through dating app. Aisle.
It was spontaneous to meet and I didn't have much plan later that night. So thought to hit it up. Went to thane to meet the person. I did have conversations before that just to verify whether the person was what they mentioned.

Had to wait for like an hour for her to come and met near Upvan Lake garden. She asked me to come to place nearby there as she got off there (that was what she mentioned). So I went there just to meet her since I had a vehicle. She was at a place near bar and suggested to let's go there since it was close. Dumb me thought - yea, why not and went inside to a big hall with chairs around, music playing but there were very few people. This should be the first red flag I should've noted and should have left then itself.

Sat and we did have good conversations. As she kept ordering blue label without them asking for how much ml she wants, while I stuck with some beer and later a vodka just to be in the weekend mood. And she kept on ordering blue label until she had 4 and the waiter came for the bill. Turned out it was 24k bill added with 2k service charges and they gave 60ml of it. 

I could see there were more people with the same fate, understood it through the red bull they give with it. Honestly, she didn't ask for a red bull and they gave her that as well. 

I had overall around 2k for myself and the rest just for the blue label. Maan, should've been careful and learnt the lesson than messing myself to end up in this fate.

Ended up paying 10k since there were a lot of waiters who looked like someone who you don't wanna mess. Better to leave than make things worse. And I should've checked the bill before she order it.

She left out saying ""I'm scared to be here rn and I'll leave soon"". Said I'll wait for her auto while she kept her distance away from me to call someone and caught an auto, and left.

The cafe is ""Paablo baar and launch"" as per the bill and sorry guys, I had to take one for myself like this being prey for this fraud. I hope I learn this lesson.

Showing the picture of the person (blurred) as idk if it is someone else's. Bill attached as well (blurred the bill number).

Tldr- scammed to pay money in restaurant cause the  date",3174,0.94,981,2025-10-10 17:01:14,year,https://reddit.com/r/mumbai/comments/1o36kq0/got_scammed_through_dating_app/,False
1n26oc3,mumbai,Ganpati bappa vibes from balcony,,3164,0.98,55,2025-08-28 08:28:11,year,https://reddit.com/r/mumbai/comments/1n26oc3/ganpati_bappa_vibes_from_balcony/,False
1r78n84,mumbai,VIP visit = instant development in Mumbai 😆,"BMC literally removed ALL speed breakers and fixed uneven roads overnight on the stretch from INS Shikra to Taj Colaba because Modi ji and Macron were in town.

Like… imagine that level of efficiency for normal citizens?

We’ve all been driving over the same bumps for YEARS, but apparently they can vanish in a day when a motorcade needs a smooth ride.

Not even angry at this point !! just impressed at how fast things can move when they really want to.🙂‍↔️",3168,1.0,112,2026-02-17 15:14:45,year,https://reddit.com/r/mumbai/comments/1r78n84/vip_visit_instant_development_in_mumbai/,False
1mrp4ax,mumbai,Konkan Nagar Govinda Pathak makes WORLD RECORD,Konkan Nagar Govinda Pathak from Jogeshwari East has made into history books by forming 10 tier human pyramid (10 thar rachle). 2025 is a year of Redemption for everything and everyone. WORLD RECORD.,3141,0.96,184,2025-08-16 08:23:07,year,https://reddit.com/r/mumbai/comments/1mrp4ax/konkan_nagar_govinda_pathak_makes_world_record/,False
1n9ut1c,mumbai,Truck driver makes illegal turn and totals my car,"The guy made an illegal turn without looking at the flyover bridge of Nahur station. By the time I picked my phone off the ground he was already speeding away and the number plate of the truck was concealed in a layer of dirt

My dashcam also didn’t capture his plate number unfortunately ",3071,0.98,287,2025-09-06 09:00:38,year,https://reddit.com/r/mumbai/comments/1n9ut1c/truck_driver_makes_illegal_turn_and_totals_my_car/,False
1ol91o9,mumbai,The New Aqua Line is truly a gamechanger for Mumbai!,Mumbai has lacked quality public transport for a long time. The metro is now addressing this gap.,3061,0.99,145,2025-10-31 23:10:33,year,https://reddit.com/r/mumbai/comments/1ol91o9/the_new_aqua_line_is_truly_a_gamechanger_for/,False
1lqln2r,mumbai,Whiskers And Whiskey,Malad (East),3064,0.99,60,2025-07-03 09:56:42,year,https://reddit.com/r/mumbai/comments/1lqln2r/whiskers_and_whiskey/,False
1o5eg1h,mumbai,"Potholes don’t kill people, corrupt contractors do","Forget airbags. Forget helmets. Our roads now come with **built-in potholes** — guaranteed to flip your bike and maybe your life too.

Courtesy: corruption, zero accountability, and contracts awarded to the lowest bidder’s uncle’s cousin.

Video from today — this man was *lucky* to walk away.",3047,0.99,185,2025-10-13 08:49:06,year,https://reddit.com/r/mumbai/comments/1o5eg1h/potholes_dont_kill_people_corrupt_contractors_do/,False
1rp2gb0,mumbai,Huge blast at chemical factory in Ambernath MIDC this evening,"The flame was huge and kept on going for hour! This kinda burst of flame occured 8 to 9 times!
P.s this was the view from my gym hence the bg music!",3040,1.0,112,2026-03-09 14:57:49,year,https://reddit.com/r/mumbai/comments/1rp2gb0/huge_blast_at_chemical_factory_in_ambernath_midc/,False
1qtvtpg,mumbai,"Came to Mumbai for an interview, why stations have brand name in front of them? I'm so confused, do you say Fevicol instead of Marol for ez?",,3033,0.98,432,2026-02-02 14:01:12,year,https://reddit.com/r/mumbai/comments/1qtvtpg/came_to_mumbai_for_an_interview_why_stations_have/,False
1kozntf,mumbai,Mumbai Pre-monsoon Rains,This timelapse was captured last Thursday afternoon,3018,1.0,63,2025-05-17 18:24:16,year,https://reddit.com/r/mumbai/comments/1kozntf/mumbai_premonsoon_rains/,False
1kutyle,mumbai,Avoid Inox R-city. Traumatizing Experience.,"Went for a late night Mission Impossible show yesterday at Inox R-city in Ghatkopar. Show didn't start for 40 mins from schedule time. Till then the Cinema guys kept on saying it will start in 5 mins, every time asked. 
Around 11.30 (for a 10.50 show) they came and said we can't play the movie due to some technical issues with the movie KDM (reel). When probed it was clear that issue was not with movie but they didn't have any operator to run the projection as even advertisements were not played which have a separate KDM. There were oldies, couples with babies, and around 50 ppl waiting for 40-45 mins on a dead screen. 
The manager simply came and asked ppl to go home and ask refund from booking website. Some ppl requested to cancel their popcorn orders but he rudely said that you can take your popcorns and carry them home. This triggered ppl and they started asking for refund on the spot. One old aunty who came from far got really furious on the stupid and arrogant Manager. Recommend to avoid Inox R-city for any movie plans.. ",2993,0.97,238,2025-05-25 04:20:23,year,https://reddit.com/r/mumbai/comments/1kutyle/avoid_inox_rcity_traumatizing_experience/,False
14uvtt3,mumbai,"Current state of marine drive, people making reels every 20 meters😭😭",,14809,0.91,1051,2023-07-09 11:04:42,all,https://reddit.com/r/mumbai/comments/14uvtt3/current_state_of_marine_drive_people_making_reels/,False
131i98u,mumbai,Automatic doors be like.... bruh,,11995,0.97,778,2023-04-28 05:08:41,all,https://reddit.com/r/mumbai/comments/131i98u/automatic_doors_be_like_bruh/,False
1j69dv1,mumbai,Saw this guy at thane station.,"—it took him 5min to come down the escalator from the moment I started recording. I wonder how long he had been trying before that.

",10705,0.99,1041,2025-03-08 04:39:44,all,https://reddit.com/r/mumbai/comments/1j69dv1/saw_this_guy_at_thane_station/,False
1eq48g4,mumbai,Get ready for celebrations!🎀🧿,,9531,0.96,265,2024-08-12 04:04:26,all,https://reddit.com/r/mumbai/comments/1eq48g4/get_ready_for_celebrations/,False
14qclec,mumbai,Monsoon Lifeline,,9453,0.98,293,2023-07-04 11:23:34,all,https://reddit.com/r/mumbai/comments/14qclec/monsoon_lifeline/,False
1juyy5v,mumbai,Found on LinkedIn,And Piyush Goyal has the audacity to give speeches on start-ups and their ideas! Dukaandaar banane pe majbur kar denge kisi ko ko wo dukaan hi kholega na.,9440,0.99,187,2025-04-09 06:07:04,all,https://reddit.com/r/mumbai/comments/1juyy5v/found_on_linkedin/,False
1h1ohzv,mumbai,The underbelly of Mumbai,"If you’re the head of BMC
How will you tackle this?",9022,0.96,670,2024-11-28 05:08:53,all,https://reddit.com/r/mumbai/comments/1h1ohzv/the_underbelly_of_mumbai/,False
15a0jub,mumbai,Mumbaikar knows how to get down from Train,Guy travels daily seems like 🤣,8795,0.98,248,2023-07-26 09:14:22,all,https://reddit.com/r/mumbai/comments/15a0jub/mumbaikar_knows_how_to_get_down_from_train/,False
1hwek2u,mumbai,Mumbai skyline over the years,,8789,0.99,244,2025-01-08 07:39:43,all,https://reddit.com/r/mumbai/comments/1hwek2u/mumbai_skyline_over_the_years/,False
1g25jpc,mumbai,Saw this in an Auto in Mulund,These Auto quotes always make me laugh 😌,8768,0.99,152,2024-10-12 17:44:34,all,https://reddit.com/r/mumbai/comments/1g25jpc/saw_this_in_an_auto_in_mulund/,False
1bln623,mumbai,"Students of Thakur College had their ids confiscated and forced to attend session of Dhruv Goyal, son of Union Minister Piyush Goyal",,8604,0.91,422,2024-03-23 08:17:15,all,https://reddit.com/r/mumbai/comments/1bln623/students_of_thakur_college_had_their_ids/,False
1gfnilf,mumbai,What a fun day to read Hindi ,Somewhere between SEEPZ to Marol. Which community will do this? 😏,8562,0.99,96,2024-10-30 14:14:05,all,https://reddit.com/r/mumbai/comments/1gfnilf/what_a_fun_day_to_read_hindi/,False
1iniqjg,mumbai,We lose so much of life in commute in Mumbai,,8436,0.98,300,2025-02-12 04:26:47,all,https://reddit.com/r/mumbai/comments/1iniqjg/we_lose_so_much_of_life_in_commute_in_mumbai/,False
1hip9zw,mumbai,Mumbai from UP there,"Gorgeous Mumbai 
OC",7972,0.99,318,2024-12-20 17:44:55,all,https://reddit.com/r/mumbai/comments/1hip9zw/mumbai_from_up_there/,False
12zaw7y,mumbai,Hyperloop between Kalyan to Shilphata,,7697,0.99,146,2023-04-26 08:24:15,all,https://reddit.com/r/mumbai/comments/12zaw7y/hyperloop_between_kalyan_to_shilphata/,False
1c3j061,mumbai,Mumbai City at 4 am. Captured from Dubai-Pune flight.,,7657,0.97,195,2024-04-14 02:34:33,all,https://reddit.com/r/mumbai/comments/1c3j061/mumbai_city_at_4_am_captured_from_dubaipune_flight/,False
1hdy7j6,mumbai,"Mumbai, you've captured my heart.",,7635,0.94,96,2024-12-14 08:04:48,all,https://reddit.com/r/mumbai/comments/1hdy7j6/mumbai_youve_captured_my_heart/,False
1j7zjqg,mumbai,Do you share the same sentiments as Mojorojo?,,7589,0.97,325,2025-03-10 14:12:57,all,https://reddit.com/r/mumbai/comments/1j7zjqg/do_you_share_the_same_sentiments_as_mojorojo/,False
1fai6po,mumbai,Life and Lifeline of Mumbai,,7584,0.98,73,2024-09-06 15:36:06,all,https://reddit.com/r/mumbai/comments/1fai6po/life_and_lifeline_of_mumbai/,False
1fsb9cz,mumbai,Mumbai- clicked in the morning today,,7538,0.99,201,2024-09-29 18:33:45,all,https://reddit.com/r/mumbai/comments/1fsb9cz/mumbai_clicked_in_the_morning_today/,False
14880sa,mumbai,Am I the only one finding this advert a little weird,Near The Bandra Mosque,7542,0.84,2817,2023-06-13 06:04:50,all,https://reddit.com/r/mumbai/comments/14880sa/am_i_the_only_one_finding_this_advert_a_little/,False
1ad9fbn,mumbai,View of Mumbai from the new trans harbour link,,7442,0.99,224,2024-01-28 18:33:15,all,https://reddit.com/r/mumbai/comments/1ad9fbn/view_of_mumbai_from_the_new_trans_harbour_link/,False
14nk6sj,mumbai,Found this on twitter seems true to me,,7168,0.98,291,2023-07-01 03:16:25,all,https://reddit.com/r/mumbai/comments/14nk6sj/found_this_on_twitter_seems_true_to_me/,False
11ouk43,mumbai,a tourist sharing her bad experience in Mumbai,,6955,1.0,505,2023-03-11 20:43:29,all,https://reddit.com/r/mumbai/comments/11ouk43/a_tourist_sharing_her_bad_experience_in_mumbai/,False
1fcshkk,mumbai,Lalbagcha Raja 1943,,6892,0.99,75,2024-09-09 15:40:32,all,https://reddit.com/r/mumbai/comments/1fcshkk/lalbagcha_raja_1943/,False
1dwj4d0,mumbai,Keep paying more and more taxes ,,6846,0.94,690,2024-07-06 06:20:41,all,https://reddit.com/r/mumbai/comments/1dwj4d0/keep_paying_more_and_more_taxes/,False
1c9cpi1,mumbai,Mumbai k autowala,,6822,0.93,368,2024-04-21 08:12:54,all,https://reddit.com/r/mumbai/comments/1c9cpi1/mumbai_k_autowala/,False
14syrji,mumbai,Man sings Kaanta Laga in Mumbai local as passengers dance,,6785,0.97,246,2023-07-07 06:26:07,all,https://reddit.com/r/mumbai/comments/14syrji/man_sings_kaanta_laga_in_mumbai_local_as/,False
1bb5lbs,mumbai,How many of you knew...,"Nowadays, inaugrations blitz are done as if he himself has funded it from his own pocket.......",6708,0.95,114,2024-03-10 08:36:54,all,https://reddit.com/r/mumbai/comments/1bb5lbs/how_many_of_you_knew/,False
1i59lpg,mumbai,cried after coming home from coldplay,"I 24(F), When the coldplay tour dates were announced my colleague forced me to book the standee tickets since I'm not much into listening English songs & she had no company to go along.  I joined a job when I finished my mcom last year at 23 which pays around 19k. being from middle class it felt quite expensive but just did it for the experience. Went for the concert in the local & walked to the venue. Wore a black tee, pants & shoes. Given my height (5'1) I couldn't even look ahead since it was blocked by tall people, people pushing, felt claustrophobic. Saw beautiful women all dressed up in one pieces, drinking cocktails/beer (it was soo expensive) , holding iphones, speaking fluent english, smoking, with their guys enjoying and singing and living their best life - I felt like I'm so behind in life, lonely amidst the crowd. I wish - I could have studied harder, my house felt belonging, had a few close friend, been financially better.. walked back to Nerul station, got down at Kurla, went home and cried in the bathroom..

",6627,0.96,1281,2025-01-19 21:28:23,all,https://reddit.com/r/mumbai/comments/1i59lpg/cried_after_coming_home_from_coldplay/,True
15zajlo,mumbai,Mumbaikars breaking into celebration upon success of Chandrayan. Ganapati bappa morya!,Andheri station ,6400,0.98,159,2023-08-23 17:29:17,all,https://reddit.com/r/mumbai/comments/15zajlo/mumbaikars_breaking_into_celebration_upon_success/,False
16bmfa9,mumbai,I finally caught the seat-scratching culprit! ,,6387,1.0,195,2023-09-06 14:56:27,all,https://reddit.com/r/mumbai/comments/16bmfa9/i_finally_caught_the_seatscratching_culprit/,False
15b5rh4,mumbai,What 1crore can get you in Mumbai,,6384,0.99,353,2023-07-27 16:03:25,all,https://reddit.com/r/mumbai/comments/15b5rh4/what_1crore_can_get_you_in_mumbai/,False
1b33ien,mumbai,Bro had to clarify,,6361,0.96,155,2024-02-29 15:49:43,all,https://reddit.com/r/mumbai/comments/1b33ien/bro_had_to_clarify/,False
12z51l1,mumbai,"A rainy day in Mumbai, 1980",,6281,0.99,142,2023-04-26 03:28:49,all,https://reddit.com/r/mumbai/comments/12z51l1/a_rainy_day_in_mumbai_1980/,False
1ev3202,mumbai,"Found an auto rikshaw driver in Juhu having his very own karaoke setup, plants, decor, carpets, lights and fans in his auto. Bro passed the vibe check!",,6203,0.99,84,2024-08-18 06:51:38,all,https://reddit.com/r/mumbai/comments/1ev3202/found_an_auto_rikshaw_driver_in_juhu_having_his/,False
1jh5asu,mumbai,Some autowala handed over Ghana coin to my grandmother saying it’s a 10 rupee coin,"Probably a new scam in the town. 

Similar thing happened with her a few weeks ago where another autowala gave her a coin from turkey which looks exactly the same as a 5 rupee coin. 

Anyone faced the same issue? ",6153,0.97,265,2025-03-22 10:14:11,all,https://reddit.com/r/mumbai/comments/1jh5asu/some_autowala_handed_over_ghana_coin_to_my/,False
14gzlfa,mumbai,Mumbai skies—straight from a Disney movie.,,6122,0.98,128,2023-06-23 14:10:43,all,https://reddit.com/r/mumbai/comments/14gzlfa/mumbai_skiesstraight_from_a_disney_movie/,False
17u4kc7,mumbai,"Whoever you are, it looks good!",,6118,1.0,202,2023-11-13 06:20:42,all,https://reddit.com/r/mumbai/comments/17u4kc7/whoever_you_are_it_looks_good/,False
1js8bm1,mumbai,A beam of concrete falls on a car in Mira Road from the ongoing metro work. The driver nearly escaped death.,,6102,0.99,288,2025-04-05 17:12:07,all,https://reddit.com/r/mumbai/comments/1js8bm1/a_beam_of_concrete_falls_on_a_car_in_mira_road/,False
1jl81os,mumbai,at least let her explain!!!,saw this during my evening jog 😂,6094,0.99,142,2025-03-27 16:29:52,all,https://reddit.com/r/mumbai/comments/1jl81os/at_least_let_her_explain/,False
1gie86k,mumbai,I just paid for glasses to drink juice.,"Juice Pila do 
Mango ka",6051,0.99,839,2024-11-03 03:39:14,all,https://reddit.com/r/mumbai/comments/1gie86k/i_just_paid_for_glasses_to_drink_juice/,False
1etxej3,mumbai,Cab driver and cops save women from jumping off MTHL!,,6045,0.98,449,2024-08-16 19:17:33,all,https://reddit.com/r/mumbai/comments/1etxej3/cab_driver_and_cops_save_women_from_jumping_off/,False
1e5g07i,mumbai,Stop feeding piegons,,6025,0.95,667,2024-07-17 11:38:24,all,https://reddit.com/r/mumbai/comments/1e5g07i/stop_feeding_piegons/,False
1gsgyzm,mumbai,Described perfectly ,,5899,0.96,229,2024-11-16 06:08:01,all,https://reddit.com/r/mumbai/comments/1gsgyzm/described_perfectly/,False
1jj92mv,mumbai,Kunal Kamra's statement,🛺🛺🛺🛺🛺🛺🛺🛺🛺🛺🛺🛺🛺,5832,0.95,500,2025-03-25 02:25:27,all,https://reddit.com/r/mumbai/comments/1jj92mv/kunal_kamras_statement/,False
1g3fl3x,mumbai,Encounter with a Suspicious Cop Over a Vape in Mumbai,"My sister had a a disturbing experience today, hoping it might help someone else avoid a similar situation here in my city. 

So, here goes:
My sister was on her way back from college, holding her vape, when this guy hops into the auto she’s in. They’re in front of MIDC, and she’s alone. He says he’s a cop and demands ₹50,000 for the offence of having a vape. 

He sits beside her, starts vaping from her vape, and tries to intimidate her with threats. He says if she doesn’t have the cash, she will be taken to the Powai police station and directs the auto there. She was understandably shaken and called me in panic.

I told her it’s  just a scare tactic to extort money. I then told her to take out her phone and start recording the interaction. As soon as she did that, his demeanor changed completely—he got scared and quickly got out of the auto. Before leaving,my sister had told him her name while she was panicking, he said something like “ye shaani ko baadme dekh lunga,” which given what our country is going through is just wow.

The whole time he refused to identify himself or show any badge, and he wasn’t in uniform either. ",5811,1.0,426,2024-10-14 13:20:18,all,https://reddit.com/r/mumbai/comments/1g3fl3x/encounter_with_a_suspicious_cop_over_a_vape_in/,False
1i44bsz,mumbai,Mumbai in a nutshell,,5738,0.99,110,2025-01-18 09:54:14,all,https://reddit.com/r/mumbai/comments/1i44bsz/mumbai_in_a_nutshell/,False
1ga9nn0,mumbai,A simple guide to help you determine if a Mumbai auto-rickshaw meter is faulty. This is an authentic video shared by a friend. ,,5718,0.99,168,2024-10-23 12:45:08,all,https://reddit.com/r/mumbai/comments/1ga9nn0/a_simple_guide_to_help_you_determine_if_a_mumbai/,False
12pckx2,mumbai,Take a tour of the first Apple store in India located in Mumbai!,,5674,0.94,326,2023-04-17 11:30:20,all,https://reddit.com/r/mumbai/comments/12pckx2/take_a_tour_of_the_first_apple_store_in_india/,False
