post_id,subreddit,title,body,score,upvote_ratio,num_comments,created_utc,time_filter,permalink,is_self
1lbzeo6,mumbai,Seeing this in a different light.,"R-City Mall, Kidzania, Ghatkopar.
",4245,0.98,84,2025-06-15 12:41:27,year,https://reddit.com/r/mumbai/comments/1lbzeo6/seeing_this_in_a_different_light/,False
1mfsy2w,mumbai,"Today at Borivali station, a ticketless passenger beat up the TT and broke government computers and other valuables",When government employees are not safe then how will the railways ensure the safety of the common man,4240,0.98,773,2025-08-02 15:12:41,year,https://reddit.com/r/mumbai/comments/1mfsy2w/today_at_borivali_station_a_ticketless_passenger/,False
1r73w3b,mumbai,"French President Emmanuel Macron, in India for the AI Impact Summit, drew attention in Mumbai as he stepped out for a morning jog around 11 am in Churchgate, running through city streets alongside his security team.",,4220,0.99,256,2026-02-17 11:48:22,year,https://reddit.com/r/mumbai/comments/1r73w3b/french_president_emmanuel_macron_in_india_for_the/,False
1l6ewzw,mumbai,Idiots in our city,"Was Mumbai police sleeping? Not OC
Idiots Treating no stop coastal road worli like Nariman point.",4150,0.98,311,2025-06-08 15:30:35,year,https://reddit.com/r/mumbai/comments/1l6ewzw/idiots_in_our_city/,False
1kraiks,mumbai,Tonight's lightning lit sky was unbelievable!,,4105,0.99,75,2025-05-20 17:18:12,year,https://reddit.com/r/mumbai/comments/1kraiks/tonights_lightning_lit_sky_was_unbelievable/,False
1k9pbe3,mumbai,Look at the rich celebrating the 'sprite of Mumbai',"""How cute and bizzare look beta that's how you would travel if you didn't have daddy's trust fund and your own Mercedes s class. Be greatful beta.""",4046,0.96,241,2025-04-28 06:53:54,year,https://reddit.com/r/mumbai/comments/1k9pbe3/look_at_the_rich_celebrating_the_sprite_of_mumbai/,False
1r4gqe8,mumbai,I Rest my case (Metro slab falls in Mulund),"A slab near pier p196 has fallen claiming a life of a rickshaw driver and injuring 4 others of which some are said to be in critical condition. This occurred just 7 piers away from the one that I pointed out p189. This highlights the quality of construction which is claimed to pass 1200 approvals by MMRDA.

Link to original post:

https://www.reddit.com/r/mumbai/comments/1qycetu/suspected\_crack\_on\_metro\_4\_pillar\_mulund/?utm\_source=share&utm\_medium=web3x&utm\_name=web3xcss&utm\_term=1&utm\_content=share\_button

Link to update post:

https://www.reddit.com/r/mumbai/comments/1qz31mm/update\_suspected\_crack\_on\_metro\_4\_pillar\_mulund/?utm\_source=share&utm\_medium=web3x&utm\_name=web3xcss&utm\_term=1&utm\_content=share\_button

Link to MMRDA’s X post:

https://x.com/mmrdaofficial/status/2020552889551479165?s=46",4037,0.99,335,2026-02-14 09:50:19,year,https://reddit.com/r/mumbai/comments/1r4gqe8/i_rest_my_case_metro_slab_falls_in_mulund/,False
1m6gtus,mumbai,In Kalyan a hospital receptionist girl was beaten by a patient's relative.,A receptionist at a private hospital was beaten up by a guy named Gopal Jha who was patients relative. He grew impatient as there were people lined up before him but he wanted to go first but the receptionist didn't let him. ,4028,0.95,890,2025-07-22 15:16:30,year,https://reddit.com/r/mumbai/comments/1m6gtus/in_kalyan_a_hospital_receptionist_girl_was_beaten/,False
1n0qglv,mumbai,"A teen passenger was harshly slapped by a rickshaw driver near Kalyan station after he claimed that his Rs 30 fare money had fallen out of his pocket. The boy reportedly apologized, but the driver still hit him before letting him go.",,4001,0.96,659,2025-08-26 16:25:47,year,https://reddit.com/r/mumbai/comments/1n0qglv/a_teen_passenger_was_harshly_slapped_by_a/,False
1kx5des,mumbai,This is one of Mumbai's posh location. Price here goes well beyond INR 1 lakh per sq ft. World-class pricing. Third-class drainage.,,3956,0.97,369,2025-05-28 02:03:29,year,https://reddit.com/r/mumbai/comments/1kx5des/this_is_one_of_mumbais_posh_location_price_here/,False
1ncgpje,mumbai,A Muslim man’s simple gesture during Ganesh Visarjan is winning hearts in Mumbai,,3929,0.94,188,2025-09-09 11:49:27,year,https://reddit.com/r/mumbai/comments/1ncgpje/a_muslim_mans_simple_gesture_during_ganesh/,False
1pmhd75,mumbai,"Everyone got booed, except one at Messi’s event.","The CM got booed (poor chap had to use the religion card). 

The CM’s wife - what the hell was she thinking taking selfies with Messi while chewing gum like an imbecile. 

Tiger Shroff got booed. Ajay Devgn got booed - btw why were they felicitated? Poor Messi stood at side watching them getting honoured.

Only one man was cheered for. And that man had every right to be there. Sachin Ramesh Tendulkar. 

Kudos to the Mumbai crowd yaar. They know who’s real and who’s fake.",3848,0.98,164,2025-12-14 15:56:37,year,https://reddit.com/r/mumbai/comments/1pmhd75/everyone_got_booed_except_one_at_messis_event/,True
1mv7zq2,mumbai,Cleaning help stole my AirPods,"My cleaning help stole my AirPods and now I feel bad about what happened

So this weird situation happened and I can’t stop thinking about it.

A few days ago, when I was heading to the gym, I couldn’t find my AirPods. I hadn’t gone out anywhere and I usually keep my stuff in place, so it was strange they were missing.

I checked the location and it showed up in a lane opposite my building where the Urban Company office is (my help came through UC, and since she was good at her work, we kept her on separately).

We didn’t want to assume the worst, so we decided to just check. Coincidentally, this was the same time she came to our building. When we went downstairs, we saw her at the main gate… wearing my AirPods.

We confronted her and she immediately tried to cover them with her dupatta, denied they were mine, and even tried to run away. Because it was right at the gate with guards and traffic, she couldn’t. Eventually, she handed them back.

The next day, she told us that she “didn’t steal them” and that they “fell into her pocket while cleaning”… which makes no sense at all.

I didn't complain about her but since this all happened in front of the guards, they reported it, and now they’re not letting her into the building anymore. That’s basically where her UC work is, so she’s lost her main source of jobs (atleast here). 
Now here’s the part messing with me, I feel bad. I don’t like being lied to, but at the same time I feel guilty that she’s lost her work because of this. She’ll probably get other buildings to work in, but the whole thing is sitting heavy on me. I also kind of believe in ill wishes, and this whole situation feels bad. 

What should I do? 😔

",3845,0.97,811,2025-08-20 07:19:47,year,https://reddit.com/r/mumbai/comments/1mv7zq2/cleaning_help_stole_my_airpods/,False
1nqdxzs,mumbai,A cloudy departure from Mumbai. A view of the Sealink from my flight to HYD.,Which one looks better? ,3837,1.0,108,2025-09-25 18:04:32,year,https://reddit.com/r/mumbai/comments/1nqdxzs/a_cloudy_departure_from_mumbai_a_view_of_the/,False
1l6z4r2,mumbai,Are we developing or just pretending?,"We are developing but not making real & sustainable development. 
Do you agree?

Every time I look around Mumbai, all I see are shiny blue glass buildings; looks fancy but where are the trees? The green patches? The breathable air?Is building skyscrapers with glass facade in a city already boiling really smart? Or just performative progress?

Feels like we're racing ahead without asking: Is this sustainable? Is this livable?

Is this real development, or just a shiny cover up of deeper issues?

",3803,0.98,154,2025-06-09 08:04:28,year,https://reddit.com/r/mumbai/comments/1l6z4r2/are_we_developing_or_just_pretending/,False
1mtoueb,mumbai,Gujaratis and their classist behaviour,"A Gujarati lady from the building opposite our independent home came and asked if we know of any domestic help, and when my mother said no, she started insisting my mother if she could wash utensils. 

We are living in 2025 and people still judge someone by their colour. My mother was taken aback but she calmly said no but the lady kept insisting that she would pay well. So my brother intervened and said that I will give you the money if you washed the utensils at our home.

After that statement, the lady got offended and left. My mother didn't say anything but we know that she felt bad because that lady judged her by her complexion.",3788,0.96,36,2025-08-18 15:14:02,year,https://reddit.com/r/mumbai/comments/1mtoueb/gujaratis_and_their_classist_behaviour/,True
1jyqbh2,mumbai,Ambedkar Jayanti,"Captured yesterday night. 
Sea link.",3789,0.92,46,2025-04-14 04:18:11,year,https://reddit.com/r/mumbai/comments/1jyqbh2/ambedkar_jayanti/,False
1lj4hkb,mumbai,This is how Juhu and Vile Parle looked in 1930s,,3688,0.99,140,2025-06-24 07:08:33,year,https://reddit.com/r/mumbai/comments/1lj4hkb/this_is_how_juhu_and_vile_parle_looked_in_1930s/,False
1ko6ob8,mumbai,The last 4 days in Mumbai have been a sight!,,3688,1.0,91,2025-05-16 17:29:13,year,https://reddit.com/r/mumbai/comments/1ko6ob8/the_last_4_days_in_mumbai_have_been_a_sight/,False
1mwahg0,mumbai,What is this thing? Noticed this at Marine Drive around 6pm!,,3590,0.98,679,2025-08-21 13:08:58,year,https://reddit.com/r/mumbai/comments/1mwahg0/what_is_this_thing_noticed_this_at_marine_drive/,False
1kmwnb1,mumbai,Pizza delivery boy apologies for falsely spreading video of marathi doctor couple,,3584,0.85,1031,2025-05-15 01:53:41,year,https://reddit.com/r/mumbai/comments/1kmwnb1/pizza_delivery_boy_apologies_for_falsely/,False
1q85jes,mumbai,"Idk how people fantasize about this rathole of a city in the name of ""Spirit of Mumbai"".",,3584,0.97,363,2026-01-09 11:09:50,year,https://reddit.com/r/mumbai/comments/1q85jes/idk_how_people_fantasize_about_this_rathole_of_a/,False
1q5dflo,mumbai,Both photos are clicked at 2 pm on different dates,"Both photos are taken exactly at 2 pm, in the exact spot and both with IPhone 15. 
The difference is too much. ",3558,0.99,86,2026-01-06 08:48:28,year,https://reddit.com/r/mumbai/comments/1q5dflo/both_photos_are_clicked_at_2_pm_on_different_dates/,False
1mzjnvv,mumbai,Lalbaugcha Raja first look 2025,"The first look of Lalbaugcha Raja 2025 is out, and the city’s buzzing with excitement! That stunning setup and crowd energy are pure Mumbai magic. Who got chance to see this live?",3537,0.97,97,2025-08-25 07:07:24,year,https://reddit.com/r/mumbai/comments/1mzjnvv/lalbaugcha_raja_first_look_2025/,False
1rj0ztu,mumbai,Oleum gas leaks from chemical unit in Palghar district of Maharashtra,,3546,1.0,126,2026-03-02 18:33:10,year,https://reddit.com/r/mumbai/comments/1rj0ztu/oleum_gas_leaks_from_chemical_unit_in_palghar/,False
1ndkt9w,mumbai,"Construction 8 years , Destruction 1 week",Palava Flyover ,3535,0.99,197,2025-09-10 17:34:47,year,https://reddit.com/r/mumbai/comments/1ndkt9w/construction_8_years_destruction_1_week/,False
1mo14ua,mumbai,Raped by 200 men in 3 months: 12-year-old Bangladeshi girl rescued in flesh trade racket bust in Mumbai,,3514,0.98,354,2025-08-12 06:21:18,year,https://reddit.com/r/mumbai/comments/1mo14ua/raped_by_200_men_in_3_months_12yearold/,False
1qlfg7l,mumbai,It was the same in 2014 It is the same in 2026 😭 What exactly has changed in the last 12 years?,Will it change in future?,3489,0.97,638,2026-01-24 06:21:15,year,https://reddit.com/r/mumbai/comments/1qlfg7l/it_was_the_same_in_2014_it_is_the_same_in_2026/,False
1o0h0d1,mumbai,"Sometimes, I love this city.","Even among all the craziness, it’s still home. ",3481,0.99,101,2025-10-07 14:53:57,year,https://reddit.com/r/mumbai/comments/1o0h0d1/sometimes_i_love_this_city/,False
1prg7ze,mumbai,A Day of “moderate” AQI and Mumbai feels unreal,"Today Mumbai’s AQI dropped to moderate and it’s wild how much that alone changes life.

Clear skies. Good visibility. The view looks beautiful, the sunset looks real, walks feel peaceful & the city feels… lighter.

Share your pics or thoughts. Curious how the city looked from your side.





",3481,0.99,70,2025-12-20 14:57:46,year,https://reddit.com/r/mumbai/comments/1prg7ze/a_day_of_moderate_aqi_and_mumbai_feels_unreal/,False
1nkrvn1,mumbai,how true is this?,,3471,0.97,279,2025-09-19 02:39:47,year,https://reddit.com/r/mumbai/comments/1nkrvn1/how_true_is_this/,False
1kkmngq,mumbai,A Drunk Girl at the Club Made Me Think Twice About the Nightlife Scenes,"After almost a year, I finally went to a club again. The music was great, the vibe was fun, and I was hanging out with my cousins just enjoying the night.

But then things took a weird turn.

There was a girl from another group who was completely drunk like couldn’t walk straight, couldn’t talk properly.  Her own friends couldn’t manage her, so they brought her over and made her sit at our table. I didn’t say much at first, but then she started eating our snacks while totally zoned out. It was awkward, messy, and honestly a little disturbing.

And that’s when it hit me do her parents even know where she is? Who she’s with? If she’s safe? Because in that moment, it sure didn’t look like anyone was really watching out for her. 

To those who get FOMO about clubbing this is the part no one talks about. It’s not all lights, music, and good vibes. Sometimes it’s just uncomfortable scenes, careless friends, and moments that make you question the whole environment.

So no, you’re not missing out as much as it may seem.",3419,0.96,312,2025-05-12 07:32:44,year,https://reddit.com/r/mumbai/comments/1kkmngq/a_drunk_girl_at_the_club_made_me_think_twice/,True
1pt1lql,mumbai,Made In Heaven - Mumbai edition (OC},,3418,0.99,137,2025-12-22 14:57:56,year,https://reddit.com/r/mumbai/comments/1pt1lql/made_in_heaven_mumbai_edition_oc/,False
1qp477e,mumbai,"City looks cleaner today, so I checked the AQI… it’s 88.","Clicked this from my office window a little while ago (Lower Parel side). The AQI apps are showing 88 which counts as satisfactory, but honestly the skyline looks way nicer than usual. No visible haze, buildings look sharp, and the sky actually has a proper blue tint for once.",3383,0.99,141,2026-01-28 06:54:49,year,https://reddit.com/r/mumbai/comments/1qp477e/city_looks_cleaner_today_so_i_checked_the_aqi_its/,False
1of04id,mumbai,Mumbai is safest for women. What say?,I think Mumbai deserved much better score. Men in mumbai are so respectful of women. They treat them as goddesses. What say?,3376,0.92,460,2025-10-24 15:02:42,year,https://reddit.com/r/mumbai/comments/1of04id/mumbai_is_safest_for_women_what_say/,False
1kvozno,mumbai,Welcome to the financial capital of 4th largest economy!! #MumbaiSpirit,"Water logging along Dadar’s Hindmata area. #Mumbairains

Welcome to the financial capital of 4th largest economy!! #MumbaiSpirit ",3366,0.98,253,2025-05-26 08:05:47,year,https://reddit.com/r/mumbai/comments/1kvozno/welcome_to_the_financial_capital_of_4th_largest/,False
1kzgsvi,mumbai,This will Blow buzz,,3356,1.0,88,2025-05-30 22:01:10,year,https://reddit.com/r/mumbai/comments/1kzgsvi/this_will_blow_buzz/,False
1lp5c9s,mumbai,Local Fish Sellers Being Harrassed,"No politics, no agenda, just a simple question :
What right do you have to stop them from selling their product ? It may be on the footpath or street, maybe they do not even have any permit from the BMC but as humans do you think it is right to impose yourself on poor people running such a small scale business just because you can ?",3356,0.94,106,2025-07-01 15:55:40,year,https://reddit.com/r/mumbai/comments/1lp5c9s/local_fish_sellers_being_harrassed/,False
1nmk4ku,mumbai,"""I'm dying,"" pleads an elderly heart patient. A government doctor's response? To scream in his face. This is beyond unacceptable.","I’m absolutely livid after watching this, and you should be too. A viral clip from a government hospital in Maharashtra shows a female doctor's sickening response to an elderly heart patient in distress. Instead of providing care, she **berates and screams at him**, callously dismissing his pleas for help. You can hear the desperation in his voice and see the complete, chilling lack of empathy in hers. This isn't just one rude employee; it’s a terrifying glimpse into a system where public servants have forgotten they are there to **serve the public**, not to rule over them. This needs to be more than just another video we rage-share and forget. This is about the fundamental right to be treated with dignity. Let's talk about the real issue:

* **Is this the new normal?** Have we become so desensitized to this kind of apathy from those in power?
* What's the most shocking encounter **you've** had with a public servant who acted like they were doing you a favor?
* Beyond just firing one person, what systemic changes will it take to **root out this toxic culture** of indifference and contempt for good?

This elderly man could be anyone's father or grandfather. We have to demand better.",3339,0.87,596,2025-09-21 05:56:30,year,https://reddit.com/r/mumbai/comments/1nmk4ku/im_dying_pleads_an_elderly_heart_patient_a/,False
1rg3svh,mumbai,Clear skies back finally!,,3327,1.0,120,2026-02-27 11:06:01,year,https://reddit.com/r/mumbai/comments/1rg3svh/clear_skies_back_finally/,False
1keoe0i,mumbai,"Got stood up, Ghosted by Bumble date after reaching the spot. Decided to turn it into a self-care date","After a 2 year long dating hiatus after the end of an LTR, decided to give dating a chance. Well, it happened. For the first time ever I got stood up by someone on a date. And I wasn't expecting it at all. 

We were talking since a few weeks, vibing well. She's smart, has interesting hobbies, didn't type only in slang (Lst grl I matchd on bumble b4 her spoke lyk this), actually seemed interested in me and had some good deep conversations. I was like wow, this could be the start of something meaningful. Our schedules allowed and we  finally decided to meet up. Dressed up well, picked up a cute Sunflower on the way. Travelled for more than an hour in the sweltering hot afternoon sun, and she went MIA! 

Had spoken to her an hour before leaving, wherein I confirmed the time with her on call. Then once I reached the spot and waited for half an hour, no response, radio silence. Absolute cinema. Was confused, disappointed and lowkey sad. Was it something I did? Is there something wrong with me? A lot of questions popped up in my head which made me contemplate my own shortcomings.

But then I remembered what the stoics say - *Nobody has the power to control your emotions. You are responsible for the way you feel, at every moment*. No matter how bad a situation you are in, *You always have a choice*, the choice to decide how you react and feel. I could sulk and go back home or make the most of my Sunday since I was already out anyway. 

**So this is what I did:**

\- Had a nice coffee and read a book in a corner, alone, for the first time in years. The chapter was about Trauma, the timing. I know.

\- Went to a crossword outlet and picked up a couple of books, a few gifts for family and friends who actually matter to me

\- Hit a Salon and got a fresh haircut, head massage and a pedicure! Feet have been neglected for a while, Getting stood up should be followed up with a pedicure no? ;)

\- Headed to the beach in the evening, watched the sunset with stray cats to keep me company. Finally wrapped up with an Icecream! Baskins & Robbins - Lotus Biscoff is nice, get it before it's phased out!

\- Also, I'd got her a sunflower because she mentioned she likes them. Gave it away to a little girl selling baloons outside the mall. She was excited and jumping with joy, asked me if 'asli hai'? And kya bolte hai ye phool ko? I finally know it's called Sooryamukhi in Hindi. Thanks google.

7 hours later, now she responds. I'm obviously not going to converse with her going forward, but I want to ask you guys and girls, what does 'Cold Feet' before a first date mean! Is this a thing?",3282,0.98,593,2025-05-04 16:49:34,year,https://reddit.com/r/mumbai/comments/1keoe0i/got_stood_up_ghosted_by_bumble_date_after/,False
1r62o5o,mumbai,"Mumbai police officer joins boys singing on the street, pure Mumbai spirit ❤️🎸✨",[Source](https://www.instagram.com/p/DUxsp7pjLl3/),3282,0.98,103,2026-02-16 06:56:48,year,https://reddit.com/r/mumbai/comments/1r62o5o/mumbai_police_officer_joins_boys_singing_on_the/,False
1qsdj6f,mumbai,"My friend lost ₹54,000 on his first dating app meet in Andheri –"," Please read before meeting strangers
I am sharing this incident for awareness.
This happened today with my close friend, and it honestly scared both of us.
My friend matched with a girl on a dating app in the morning. Within minutes, she gave him her number and they started chatting on WhatsApp. Everything moved very fast.
Very soon she said, “Let’s meet today.”
He was excited. Anyone would be. But at the same time, it felt strange. Who meets a complete stranger on the first day itself?
She asked him to come to Sakinaka Metro Station.
He called me and told me about the plan. I warned him that many girls have tie ups with pubs and clubs and target guys to make them spend money. But he said he would stay careful and not spend more than 3,000.
He lives in Nalasopara and still travelled all the way to Andheri just to meet her. Almost 2 hours of travel for this date.
They met and she took him to a place called Club Cafe.
At first everything looked normal.
Then the spending started.
She kept ordering expensive drinks continuously. Premium whiskey, shots, food, vapes, cigarettes. She drank around 7 pegs. My friend only had 2 drinks.
The staff kept bringing items very fast without even properly confirming prices. It felt planned.
Slowly he started getting suspicious.
Then the bill came.
Drinks alone were about 48,402.
Total bill was around 54,000.
He was shocked.
He tried to go outside saying he needed the washroom, but guards stopped him and said he cannot leave without paying the bill.
That moment he realized he was trapped in a scam.
When it was time to pay, the girl suddenly said her payment server was down. She acted confused and helpless like she couldn’t pay anything.
Finally, my friend had no choice. He paid the full 54,000 from his own savings.
After paying, he somehow managed to leave by saying there was an emergency call from home.
But the story does not end there.
While he was returning home, she messaged him again and asked for another 3,000 rupees, saying she wanted to buy a gift for her sister’s kid.
Imagine the audacity.
After scamming him for 54,000, she still asked for more money.
He came home feeling stressed, angry and embarrassed. This was his hard earned money. Months of savings gone in one evening.
Yes, maybe he made a mistake trusting her.
But these scams are designed exactly like this. Fast emotions. Quick meeting. Expensive place. Psychological pressure. Guards. No escape.
When an average middle class guy meets a beautiful stranger and everything happens quickly, sometimes logic stops working.
And that is exactly what these people take advantage of.
So please be careful:
Do not meet strangers immediately
Do not go to pubs or clubs suggested by them
Do not let someone order freely on your money
If something feels suspicious, leave early
Always choose public and simple places like cafes
Sharing this only for awareness.
If this post saves even one person from losing money, it’s worth it.
Stay safe everyone.

Attaching bill for proof.",3263,0.96,994,2026-01-31 20:37:28,year,https://reddit.com/r/mumbai/comments/1qsdj6f/my_friend_lost_54000_on_his_first_dating_app_meet/,False
1lqw1jn,mumbai,Nitesh Narayan Rane on the Miraroad Gujarati guy slapped for not speaking Marathi incident.,,3224,0.94,430,2025-07-03 17:48:59,year,https://reddit.com/r/mumbai/comments/1lqw1jn/nitesh_narayan_rane_on_the_miraroad_gujarati_guy/,False
